"84c725be-c0bb-4fee-88da-aa1721b4cfde"	"ucr"	"ucr132943"	"san gabriel mtns. arroyo seco, pasadena, north of jet prop. laboratory"	34.2125	-118.17222	"united states"	"california"	"los angeles"	NA	1000	"asteraceae"	"artemisia"	"douglasiana"	NA	"artemisia douglasiana"
"84d8827c-49d7-4ce3-b8e1-8f94fee635b5"	"ucr"	"ucr156705"	"sycuan peak ecological reserve (california dept. of fish & game): southeast of dehesa, southwest of loveland reservoir; on the lower northeast side of sycuan peak, near sloan ranch"	32.77167	-116.80028	"united states"	"california"	"san diego"	NA	1000	"asteraceae"	"artemisia"	"douglasiana"	NA	"artemisia douglasiana"
"85647125-0694-4c37-8f5b-7800b452597d"	"sbbg"	"sbbg124447"	"dunes, s side of gonzalez rd, 1000 ft e of harbor blvd; oxnard"	34.219	-119.25	"united states"	"california"	"ventura"	NA	1000	"asteraceae"	"artemisia"	"douglasiana"	NA	"artemisia douglasiana"
"85893355-0e6b-4410-a10e-c9b2c2947797"	"ucr"	"ucr153931"	"mission valley preserve: along the san diego river from sefton park to the interstate 5 bridge. square: r8"	32.76167	-117.19167	"united states"	"california"	"san diego"	NA	1000	"asteraceae"	"artemisia"	"douglasiana"	NA	"artemisia douglasiana"
"85a3a7a9-9164-4152-a4b2-9cab18faa0dc"	"sd"	"sd172932"	"nw of the city of fallbrook, n of daily road, 0.7mi s of county line, 0.8 mi n of ross lake, at the fallbrook utility district area on blm land."	33.4528	-117.2833	"united states"	"california"	"san diego"	NA	NA	"asteraceae"	"artemisia"	"douglasiana"	NA	"artemisia douglasiana"
"85cc7307-ee11-42d7-a3a5-01ccc7270532"	"sd"	"sd16426"	"palomar mountain."	33.36337	-116.83613	"united states"	"california"	"san diego"	NA	3300	"asteraceae"	"artemisia"	"douglasiana"	NA	"artemisia douglasiana"
"85eb8e89-0c12-4291-8ed6-455029bc0f78"	"obi"	"obi55620"	"santa cruz island. just upstream from orchid bak; cottonwood cyn, n of central valley"	34.0024048450991	-119.734763039919	"united states"	"california"	"santa barbara"	NA	1000	"asteraceae"	"artemisia"	"douglasiana"	NA	"artemisia douglasiana"
"85ec573b-8243-4386-a7da-4f8aa2072e73"	"ucr"	"ucr59840"	"sierra nevada mtns. west walker river, at hwy 395, 4 mi. south of walker"	38.47556	-119.46111	"united states"	"california"	"mono"	NA	1000	"asteraceae"	"artemisia"	"douglasiana"	NA	"artemisia douglasiana"
"865dd848-7f43-45aa-af6b-0c5013d4467c"	"jeps"	"jeps37056"	"portola"	39.8085	-120.4694	"united states"	"california"	"plumas"	NA	2300	"asteraceae"	"artemisia"	"douglasiana"	NA	"artemisia douglasiana"
"867614fc-5090-4f66-9f20-bf8f721ea228"	"ds"	"ds63698"	"near lake lagunita, stanford university"	37.4221393312963	-122.17637588899	"united states"	"california"	"santa clara"	NA	414	"asteraceae"	"artemisia"	"douglasiana"	NA	"artemisia douglasiana"
"8694a7c6-d17d-4f0c-9b73-3528526b6263"	"cas"	"378518"	"near railroad tracks at rincon, about 4 miles north of santa cruz"	37.0116666667	-122.05	"united states"	"california"	"santa cruz county"	NA	NA	"asteraceae"	"artemisia"	"douglasiana"	NA	"artemisia douglasiana  besser"
"86d90b47-e14a-4b1c-a99a-641b583af5a7"	"pom"	"pom199711"	"mandeville canyon, santa monica mountains."	34.0821	-118.5026	"united states"	"california"	"los angeles"	NA	1000	"asteraceae"	"artemisia"	"douglasiana"	NA	"artemisia douglasiana"
"87499556-a91a-4b7f-a2f7-c8827d587d40"	"pom"	"pom289337"	"kelseyville- bed of kelsey creek"	38.978	-122.8394	"united states"	"california"	"lake"	NA	3274	"asteraceae"	"artemisia"	"douglasiana"	NA	"artemisia douglasiana"
"876855e7-ee39-42ff-a0b5-a9550b92a770"	"sd"	"sd210666"	"rancho penasquitos, black mountain area, 1/4 mile north of cte. lampara & maler rd."	32.98121	-117.12776	"united states"	"california"	"san diego"	NA	NA	"asteraceae"	"artemisia"	"douglasiana"	NA	"artemisia douglasiana"
"876ed24f-d5be-40a9-8831-99db3906f5c3"	"sbbg"	"sbbg79893"	"santa rosa island: santa rosa island"	33.957	-120.104	"united states"	"california"	"santa barbara"	NA	13000	"asteraceae"	"artemisia"	"douglasiana"	NA	"artemisia douglasiana"
"879bb12f-d3fd-4093-9095-10debfc435e3"	"jeps"	"jeps33334"	"3 mi. ne of tobias peak (along tobias creek); tobias gorge"	35.8808495061144	-118.534886529651	"united states"	"california"	"tulare"	NA	7243	"asteraceae"	"artemisia"	"douglasiana"	NA	"artemisia douglasiana"
"87a825f8-e5c7-46c8-a2d1-ba9facf03dcf"	"la"	"la200161"	"santa monica mountains, mandeville canyon"	34.0975768020972	-118.506838955923	"united states"	"california"	"los angeles"	NA	9999	"asteraceae"	"artemisia"	"douglasiana"	NA	"artemisia douglasiana"
"87df2005-1710-4b38-b962-ad611d8866ec"	"clark-a"	"clark-a1528-1567"	"san jacinto san jacinto 7.5\'q"	33.7839	-116.9586	"united states"	"california"	"riverside"	NA	NA	"asteraceae"	"artemisia"	"douglasiana"	NA	"artemisia douglasiana"
"880b27ab-8cf6-4543-9b9f-e4bfd9b14f8d"	"ucd"	"ucd129291"	"yolo county: putah creek, east of county road 106 and west of yolo causeway"	38.51	-121.63	"united states"	"california"	"yolo"	NA	1000	"asteraceae"	"artemisia"	"douglasiana"	NA	"artemisia douglasiana"
"88208276-41d8-4f57-b6bc-7ce47b9e9a14"	"uc"	"uc449650"	"rumsey"	38.8884028594855	-122.237705961353	"united states"	"california"	"yolo"	NA	427	"asteraceae"	"artemisia"	"douglasiana"	NA	"artemisia douglasiana"
"882a847c-dce6-41a8-af4e-1f4d7f31cd9e"	"sbbg"	"sbbg108567"	"sierra nevada: just below troy meadow cmpgrd"	36.0697	-118.2301	"united states"	"california"	"tulare"	NA	1000	"asteraceae"	"artemisia"	"douglasiana"	NA	"artemisia douglasiana"
"883f5959-fa05-4475-854c-867ddb309e50"	"jeps"	"jeps36960"	"vacaville"	38.35667	-121.9867	"united states"	"california"	"solano"	NA	NA	"asteraceae"	"artemisia"	"douglasiana"	NA	"artemisia douglasiana"
"88aa11c9-2073-45f2-b904-0182fc14c8f2"	"cas"	"cas615570"	"greenhorn range - cedar creek, about 3 miles south of glennville."	35.6959	-118.6794	"united states"	"california"	"kern"	NA	1600	"asteraceae"	"artemisia"	"douglasiana"	NA	"artemisia douglasiana"
"8915e812-2193-4225-8ef3-bb66569eab5e"	"chsc"	"chsc66790"	"yuba pass-weber lake rd. (forest rt. 12) 2.2 mi s of hwy. 49"	39.5952777777778	-120.481388888889	"united states"	"california"	"sierra"	NA	412	"asteraceae"	"artemisia"	"douglasiana"	NA	"artemisia douglasiana"
"89930096-2300-42a4-97b0-5a8c46ba70f0"	"uc"	"uc1119552"	"mouth san carpoforo creek; cape san martin quadrangle"	35.761583	-121.312892	"united states"	"california"	"san luis obispo"	NA	505	"asteraceae"	"artemisia"	"douglasiana"	NA	"artemisia douglasiana"
"89ea56b0-5729-4711-9145-c3252979ee1e"	"uc"	"uc892586"	"mandeville canyon santa monica mountains, mandeville canyon"	34.0939475755613	-118.503555386508	"united states"	"california"	"los angeles"	NA	4372	"asteraceae"	"artemisia"	"douglasiana"	NA	"artemisia douglasiana"
"89eb1c81-b25d-4bfb-a76b-5aa24ebb46dd"	"ucd"	"ucd129310"	"alpine county: northern sierra nevada mountains: west end of caples lake at a dam; alongside hwy ca-88"	38.7036111110821	-120.065555555932	"united states"	"california"	"alpine"	NA	NA	"asteraceae"	"artemisia"	"douglasiana"	NA	"artemisia douglasiana"
"8a023a1f-f4c9-46f3-85ce-d180d6346c68"	"uc"	"uc29700"	"lake temescal"	37.8461594587153	-122.230129325914	"united states"	"california"	"alameda"	NA	437	"asteraceae"	"artemisia"	"douglasiana"	NA	"artemisia douglasiana"
"8a19520b-e4cf-4fba-9bd6-b97958728579"	"sd"	"sd80456"	"san onofre bluffs state beach."	33.36028	-117.54147	"united states"	"california"	"san diego"	NA	1650	"asteraceae"	"artemisia"	"douglasiana"	NA	"artemisia douglasiana"
"8a5e4158-465f-4447-b49f-e29c338b68b5"	"uc"	"uc297884"	"stony creek near granite peak"	40.9002757676716	-122.88133428195	"united states"	"california"	"trinity"	NA	343	"asteraceae"	"artemisia"	"douglasiana"	NA	"artemisia douglasiana"
"8abd47d4-2a8c-4db1-b73d-436abadb6cd5"	"rsa"	"rsa122552"	"castle rock ridge, santa cruz"	37.2253	-122.0924	"united states"	"california"	"santa cruz"	NA	5653	"asteraceae"	"artemisia"	"douglasiana"	NA	"artemisia douglasiana"
"8af2094a-227a-476f-b495-cc0c86b8354d"	"jeps"	"jeps30672"	"near mouth of malibu creek; santa monica mountains"	34.0410876040304	-118.683228804141	"united states"	"california"	"los angeles"	NA	1161	"asteraceae"	"artemisia"	"douglasiana"	NA	"artemisia douglasiana"
"8b6f6e38-fba7-414a-b204-50d477d974fa"	"ucr"	"ucr241730"	"northern sierra nevada mountains bowman lake road, 1.2 miles north of ca-20, n of i-80 between grass valley and truckee"	39.30944	-120.66583	"united states"	"california"	"nevada"	NA	100	"asteraceae"	"artemisia"	"douglasiana"	NA	"artemisia douglasiana"
"8bf947fa-40b9-42d7-8c19-016660b4073a"	"ucsb"	"ucsb67944"	"arroyo hondo preserve, main road 45m n of lower gate"	34.479249	-120.141024	"united states"	"california"	"santa barbara"	NA	NA	"asteraceae"	"artemisia"	"douglasiana"	NA	"artemisia douglasiana"
"8c0bad8e-5bb3-4525-90b6-8c11b0fbc630"	"uc"	"uc176432"	"red clover valley"	40.0535	-120.666	"united states"	"california"	"plumas"	NA	11410	"asteraceae"	"artemisia"	"douglasiana"	NA	"artemisia douglasiana"
"8c302b23-4a4a-43e3-9ae4-3ff4dc49877f"	"sd"	"sd228093"	"lake sutherland area: northeast of ramona; north of lake sutherland; along the canyon just north of the dam and east of lake sutherland dam road."	33.12179	-116.7866	"united states"	"california"	"san diego"	NA	NA	"asteraceae"	"artemisia"	"douglasiana"	NA	"artemisia douglasiana"
"8c6c6331-adb2-4dee-846c-8652c638cb10"	"cas"	"cas648580"	"sierra nevada, greenhorn mountains - kern co. park"	35.7366	-118.5549	"united states"	"california"	"kern"	NA	800	"asteraceae"	"artemisia"	"douglasiana"	NA	"artemisia douglasiana"
"8c84ea13-3084-4bab-860e-9d1ce1fc60fc"	"uc"	"uc892422"	"orrs springs"	39.230227666625	-123.366249353816	"united states"	"california"	"mendocino"	NA	178	"asteraceae"	"artemisia"	"douglasiana"	NA	"artemisia douglasiana"
"8cfdb320-d347-4996-8717-2ee2f06947f2"	"utc"	"utc00257812"	"along jerrys flat road ca. 6 miles east of gold beach and junction with u.s. hwy. 101, at the jim hunt public recreation area on the south bank of the rogue river."	42.46798	-124.34262	"united states"	"oregon"	"curry"	NA	NA	"asteraceae"	"artemisia"	"douglasiana"	NA	"artemisia douglasiana"
"8d4dd648-cdbf-40c5-a04f-6f57952eb87b"	"sjsu"	"sjsu3004"	"by junction of san joaquin & stanislaus rivers, san joaquin valley c. 14 mi w of modesto"	37.6647	-121.2407	"united states"	"california"	"stanislaus"	NA	699	"asteraceae"	"artemisia"	"douglasiana"	NA	"artemisia douglasiana"
"8daabaff-ff64-40b4-ab74-d88c6c9fc1ee"	"cas"	"cas409936"	"hill at n.w. end of u.c.l.a. campus, los angeles"	34.074	-118.4527	"united states"	"california"	"los angeles"	NA	800	"asteraceae"	"artemisia"	"douglasiana"	NA	"artemisia douglasiana"
"8dcf509d-4b75-4d6d-8f84-8babcd3a6702"	"ucr"	"ucr179984"	"san gabriel mountains bear flats, about 1.7 mi north of mt. baldy village, east fork of bear canyon"	34.24917	-117.65056	"united states"	"california"	"san bernardino"	NA	1000	"asteraceae"	"artemisia"	"douglasiana"	NA	"artemisia douglasiana"
"8de8bfc9-18b8-43d9-9261-617431510fdb"	"sd"	"sd186598"	"camp pendleton marine corps base: along north river road, east of stuart mesa road; along the northern edge of the santa margarita river in the southwestern portion of the base"	33.24153	-117.38461	"united states"	"california"	"san diego"	NA	NA	"asteraceae"	"artemisia"	"douglasiana"	NA	"artemisia douglasiana"
"8dedc71f-591d-4c33-80b6-7f7448155046"	"cas"	"cas657875"	"sierra nevada, rancheria road at rattlesnake creek"	35.5058	-118.7704	"united states"	"california"	"kern"	NA	500	"asteraceae"	"artemisia"	"douglasiana"	NA	"artemisia douglasiana"
"8e3dfa9a-51b6-4e0e-a3ae-d9a5acc9c7f3"	"ucr"	"ucr120149"	"south coast north park area of the city of san diego, switzer canyon just west of 30th st. between nutmeg st. and laurel st.; east of balboa park"	32.73361	-117.13056	"united states"	"california"	"san diego"	NA	1000	"asteraceae"	"artemisia"	"douglasiana"	NA	"artemisia douglasiana"
"8e963f9c-98d7-4ff6-b347-d8992d670916"	"uc"	"uc1119538"	"200 yd sw white hall; eldorado national forest, pyramid pk. quadrangle"	38.7741053482168	-120.418831355018	"united states"	"california"	"el dorado"	NA	825	"asteraceae"	"artemisia"	"douglasiana"	NA	"artemisia douglasiana"
"8e97e5f7-6155-4f7b-8cd2-0e4facbcd11f"	"cda"	"cda14033"	"sierra nevada forested, s-facing slopes, logged in past, ~ 1/4 mi. s of intersection of usfs 24n42 & 24n66, approx. 1 mi. s of brady\'s camp, plumas national forest. large colony in open site where old road crosses dry drainage. gravelly area."	39.9166666666667	-120.733333333333	"united states"	"california"	"plumas"	NA	NA	"asteraceae"	"artemisia"	"douglasiana"	NA	"artemisia douglasiana"
"8ebff142-f8b2-4bd1-a427-e618e78974b7"	"sd"	"sd235228"	"camp pendleton: central portion of base; training area india; northeast of basilone road and east of roblar road; along a canyon bottom south of a dirt road"	33.35792	-117.35109	"united states"	"california"	"san diego"	NA	NA	"asteraceae"	"artemisia"	"douglasiana"	NA	"artemisia douglasiana"
"8f6593c6-5c9b-47b7-a993-721facf141d4"	"jeps"	"jeps36924"	"corona del mar"	33.6000223766933	-117.87088995544	"united states"	"california"	"orange"	NA	1650	"asteraceae"	"artemisia"	"douglasiana"	NA	"artemisia douglasiana"
"8fb15c9a-45af-4d28-8815-e552642fe343"	"ucd"	"ucd83338"	"kern county; wind wolves preserve/ los padres national forest"	34.8732880517176	-119.133119557992	"united states"	"california"	"kern"	NA	20	"asteraceae"	"artemisia"	"douglasiana"	NA	"artemisia douglasiana"
"8fb486a7-bd2b-4be3-8a43-73e91ddad442"	"sd"	"sd106600"	"pine valley, corte madera ranch"	32.76409	-116.57253	"united states"	"california"	"san diego"	NA	1650	"asteraceae"	"artemisia"	"douglasiana"	NA	"artemisia douglasiana"
"8fd28aa2-6f7a-4413-ad2e-d704d0bf95cc"	"uc"	"uc418975"	"strawberry canyon berkeley, strawberry canyon"	37.8734537522942	-122.238889544308	"united states"	"california"	"alameda"	NA	1148	"asteraceae"	"artemisia"	"douglasiana"	NA	"artemisia douglasiana"
"8fd6901a-e70e-4a35-abe9-c5caa8f3e20b"	"cas"	"cas485141"	"north base of bayview hills"	37.7146314244547	-122.391882049567	"united states"	"california"	"san francisco"	NA	798	"asteraceae"	"artemisia"	"douglasiana"	NA	"artemisia douglasiana"
"9007e6b2-845c-4d39-87b8-8a48e26ebda8"	"uc"	"uc449640"	"santa cruz mts."	37.1546660261287	-121.963679259817	"united states"	"california"	"santa cruz"	NA	48856	"asteraceae"	"artemisia"	"douglasiana"	NA	"artemisia douglasiana"
"90109a44-7e56-4733-9076-14c493b41d8b"	"sd"	"sd170915"	"cuyamaca rancho state park, green valley. east of state highway 79 and the access road to the historic dyer house, about 600 feet north of the confluence of sweetwater river and cold stream on the west side of the river."	32.9253	-116.558	"united states"	"california"	"san diego"	NA	NA	"asteraceae"	"artemisia"	"douglasiana"	NA	"artemisia douglasiana"
"9051e3c4-9ff5-455b-82a8-320e93be7885"	"ucr"	"ucr232243"	"northern sierra nevada mountains forest route 5n02 at sourgrass bridge, nne of boards crossing of north fork stanislaus river"	38.32139	-120.21583	"united states"	"california"	"tuolumne"	NA	100	"asteraceae"	"artemisia"	"douglasiana"	NA	"artemisia douglasiana"
"908692e5-a3cd-48c0-a4b3-c931b646959b"	"utc"	"utc00184245"	"benton county: cold creek road, near saint michelle vineyards.  bottom of cold creek wash."	46.5697222	-119.7786111	"united states"	"washington"	"benton"	NA	NA	"asteraceae"	"artemisia"	"douglasiana"	NA	"artemisia douglasiana"
"90a4df2f-d927-4520-a33c-15a7ac2eaa19"	"ucsb"	"ucsb64207"	"south coast; ventura quad.; t2n, r23w; san bernardino bm; found in ventura river, west bank, above main street bridge"	34.28023333	-119.30488333	"united states"	"california"	"ventura"	NA	NA	"asteraceae"	"artemisia"	"douglasiana"	NA	"artemisia douglasiana"
"90b0a4e8-37bf-490c-813a-5b5f764b27c0"	"uc"	"uc1004848"	"12 mi sw bridgeport (near stream flowing into robinson creek); robinson creek"	38.195	-119.3275	"united states"	"california"	"mono"	NA	1000	"asteraceae"	"artemisia"	"douglasiana"	NA	"artemisia douglasiana"
"90fb373e-657c-4b17-aca8-09473abe40d7"	"sd"	"sd208664"	"fallbrook, 2&frac12; mi ne of, 3&frac12; mi w of rainbow, on south side of the santa margarita river at the willow glen and n. stagecoach trailhead."	33.41333	-117.21389	"united states"	"california"	"san diego"	NA	NA	"asteraceae"	"artemisia"	"douglasiana"	NA	"artemisia douglasiana"
"912566d9-f7ff-4763-a6b9-b2e52881d81e"	"ucr"	"ucr14925"	"sierra nevada mtns. beside big creek at bridge in fish camp"	37.47833	-119.64028	"united states"	"california"	"mariposa"	NA	10000	"asteraceae"	"artemisia"	"douglasiana"	NA	"artemisia douglasiana"
"913d63dd-13df-4b9b-9c0b-5c97d3181c62"	"sd"	"sd230415"	"camp pendleton: training area hotel; in the extreme eastern part of the base; northwest of fallbrook and just north of de luz road; along the santa margarita river just north of the de luz road bridge"	33.39938	-117.26337	"united states"	"california"	"san diego"	NA	NA	"asteraceae"	"artemisia"	"douglasiana"	NA	"artemisia douglasiana"
"91421a1b-968c-45a0-aa77-2fdda09b2ba3"	"uc"	"uc1795609"	"n shore convict lake between ne and w ends of the lake"	37.5943	-118.8513	"united states"	"california"	"mono"	NA	100	"asteraceae"	"artemisia"	"douglasiana"	NA	"artemisia douglasiana"
"915a9250-b574-40d4-b170-0c24f7311204"	"la"	"la94392"	"santa monica mountains, west fork las trancas canyon"	34.0801644296633	-118.856567468438	"united states"	"california"	"los angeles"	NA	200	"asteraceae"	"artemisia"	"douglasiana"	NA	"artemisia douglasiana"
"916122f6-7b5f-4386-95e1-d384656fc182"	"ucsb"	"ucsb29318"	"at coal oil point reserve, 2 miles west of goleta point on west campus of ucsb"	34.4095	-119.8786	"united states"	"california"	"santa barbara"	NA	1000	"asteraceae"	"artemisia"	"douglasiana"	NA	"artemisia douglasiana"
"91d7fa89-6e99-4a4a-9acf-ff2a7fafe3b0"	"clark-a"	"clark-a1528-1563"	"loma linda san bernardino s 7.5\'q"	34.0483	-117.2612	"united states"	"california"	"san bernardino"	NA	2000	"asteraceae"	"artemisia"	"douglasiana"	NA	"artemisia douglasiana"
"92015128-96c2-49f4-a3e3-7aa02a7e5e6b"	"uc"	"uc75906"	"near saratoga"	37.26389	-122.02194	"united states"	"california"	"santa clara"	NA	NA	"asteraceae"	"artemisia"	"douglasiana"	NA	"artemisia douglasiana"
"923f5995-61ec-4c12-8610-781645a29d25"	"uc"	"uc29695"	"alamo creek"	38.3364	-121.9882	"united states"	"california"	"solano"	NA	1500	"asteraceae"	"artemisia"	"douglasiana"	NA	"artemisia douglasiana"
"924a9b84-6b4f-45ea-acc2-9bc2c10c258d"	"ucr"	"ucr171623"	"northern sierra nevada foothills cameron park (e of sacramento, along us highway 50); corner of santos street and santos court road"	38.67028	-120.97694	"united states"	"california"	"el dorado"	NA	1000	"asteraceae"	"artemisia"	"douglasiana"	NA	"artemisia douglasiana"
"929c0bbf-f183-4d52-925a-8a400b33e0e7"	"uc"	"uc1558223"	"at water fountain below emerald lake (loop highway); lassen volcanic national park"	40.4679864741407	-121.518745790235	"united states"	"california"	"shasta"	NA	326	"asteraceae"	"artemisia"	"douglasiana"	NA	"artemisia douglasiana"
"92c23768-c2cc-48f9-9c0d-b6c3ce7ace69"	"ucr"	"ucr106909"	"agua tibia mountains pechanga indian reservation, ese of san gabriel church; along floodplain of the southern fork of pechanga creek."	33.43333	-117.05	"united states"	"california"	"riverside"	NA	NA	"asteraceae"	"artemisia"	"douglasiana"	NA	"artemisia douglasiana"
"92d010b1-0d20-4f74-a289-89f16d78a9f0"	"uc"	"uc571614"	"w side of mount hamilton (vicinity of smith creek)"	37.3413930010467	-121.643797316609	"united states"	"california"	"santa clara"	NA	704	"asteraceae"	"artemisia"	"douglasiana"	NA	"artemisia douglasiana"
"92d82c90-b1e9-45c4-b5ab-9b364a84a8cd"	"jeps"	"jeps19498"	"nw end of ucla campus; los angeles"	34.0727357834314	-118.450813377355	"united states"	"california"	"los angeles"	NA	588	"asteraceae"	"artemisia"	"douglasiana"	NA	"artemisia douglasiana"
"92f5db11-902c-4058-bf4f-95dc72ab2b5a"	"sd"	"sd41471"	"14 miles northwest santa barbara."	34.4315	-119.9107	"united states"	"california"	"santa barbara"	NA	1200	"asteraceae"	"artemisia"	"douglasiana"	NA	"artemisia douglasiana"
"9311c738-856b-4ce1-89ea-f1b52df9fb9f"	"ucr"	"ucr179810"	"northern sierra nevada mountains foothills bucks bar road, 3.9 miles south of pleasant valley road, general vicinity of somerset"	38.64667	-120.69167	"united states"	"california"	"el dorado"	NA	1000	"asteraceae"	"artemisia"	"douglasiana"	NA	"artemisia douglasiana"
"933df4cb-8382-48cd-8b3c-0c1fd712b8ef"	"ucd"	"ucd43091"	"placer county: lake tahoe basin; blackwood canyon. utm\'s 10 743067e, 4332664n"	39.1093	-120.1889	"united states"	"california"	"placer"	NA	69	"asteraceae"	"artemisia"	"douglasiana"	NA	"artemisia douglasiana"
"93c0676b-9b8e-4597-8306-692b2eebb6b3"	"rsa"	"rsa425027"	"loma linda"	34.0458	-117.2581	"united states"	"california"	"san bernardino"	NA	3300	"asteraceae"	"artemisia"	"douglasiana"	NA	"artemisia douglasiana"
"93c622fa-f91c-404c-847e-e2554d08123c"	"ucr"	"ucr67454"	"warner mtns goose lake, within 0.1 mi of the oregon border"	41.99194	-120.29833	"united states"	"california"	"modoc"	NA	1000	"asteraceae"	"artemisia"	"douglasiana"	NA	"artemisia douglasiana"
"9424585d-abd7-4198-9b84-27ae22833a0a"	"ucr"	"ucr210335"	"san gabriel mtns. mouth of san gabriel river canyon, spring 1.5 mi. north of sierra madre ave. on hwy 39"	34.15972	-117.9	"united states"	"california"	"los angeles"	NA	1000	"asteraceae"	"artemisia"	"douglasiana"	NA	"artemisia douglasiana"
"9493e662-db48-4374-87e8-2b620c27d0c1"	"uc"	"uc726606"	"near forest ranch; sierra foothills"	39.88222	-121.67167	"united states"	"california"	"butte"	NA	NA	"asteraceae"	"artemisia"	"douglasiana"	NA	"artemisia douglasiana"
"94ffa93e-f890-4e3b-89da-d036d16e437a"	"cas"	"1100166"	"along calif. highway 180 near yucca point, kings river drainage"	36.8291666667	-118.8666666667	"united states"	"california"	"fresno county"	NA	NA	"asteraceae"	"artemisia"	"douglasiana"	NA	"artemisia douglasiana  besser"
"9555a88c-4ebe-4a53-bd60-b3872d3cc104"	"ucd"	"ucd50117"	"sacramento co.: cosumnes river preserve plant inventory - tall forest. collected from the southern end of the tall forest, about 200 m e from the pump station"	38.2499159364814	-121.167723253242	"united states"	"california"	"sacramento"	NA	NA	"asteraceae"	"artemisia"	"douglasiana"	NA	"artemisia douglasiana"
"958ef55d-b3e1-4e8d-bb83-7f8271b058ab"	"uc"	"uc1119573"	"1/2 mi ne valencia peak (plot 88); cayucos quadrangle"	35.2733	-120.8695	"united states"	"california"	"san luis obispo"	NA	NA	"asteraceae"	"artemisia"	"douglasiana"	NA	"artemisia douglasiana"
"95aa4444-27b4-4d45-847c-fc7f89c1d1e7"	"sbbg"	"sbbg62507"	"oak\'s garage, mint cyn"	34.511	-118.354	"united states"	"california"	"los angeles"	NA	1000	"asteraceae"	"artemisia"	"douglasiana"	NA	"artemisia douglasiana"
"964272ba-2d42-43a6-bdd5-d7c7c3eabed8"	"cas"	"cas2652"	"palo alto"	37.4021	-122.1426	"united states"	"california"	"santa clara"	NA	13400	"asteraceae"	"artemisia"	"douglasiana"	NA	"artemisia douglasiana"
"969680e0-9d21-4dc9-a511-6414aa049dff"	"pom"	"pom319716"	"felton, on west side of old covered bridge"	37.051	-122.0702	"united states"	"california"	"santa cruz"	NA	99	"asteraceae"	"artemisia"	"douglasiana"	NA	"artemisia douglasiana"
"96acca98-2828-4872-88c2-8f79d9d40936"	"irvc"	"irvc29244"	"los alamos valley, 0.8 mile wnw of los alamos along hwy ca-135 central coast"	34.745	-120.301666666667	"united states"	"california"	"santa barbara"	NA	NA	"asteraceae"	"artemisia"	"douglasiana"	NA	"artemisia douglasiana"
"96f7f3fd-0937-4d02-8543-f8de9343e851"	"la"	"la200160"	"santa monica mountains, santa ynez canyon, at sunset blvd"	34.0429169769202	-118.551368360079	"united states"	"california"	"los angeles"	NA	100	"asteraceae"	"artemisia"	"douglasiana"	NA	"artemisia douglasiana"
"97247f55-4b1f-4837-8903-6a386bab82fd"	"ucr"	"ucr223135"	"transverse range; san gabriel mtns. sulphur spring campground, on south fork little rock creek"	34.36722	-117.9875	"united states"	"california"	"los angeles"	NA	1000	"asteraceae"	"artemisia"	"douglasiana"	NA	"artemisia douglasiana"
"9790a383-37b8-4640-9514-533c725d141c"	"ucr"	"ucr171994"	"mcginty mountain ecological reserve (california fish & game). se of city el cajon. se of intersection of willow glen dr and hillsdale road. san diego atlas square r14"	32.75531	-116.9015	"united states"	"california"	"san diego"	NA	1000	"asteraceae"	"artemisia"	"douglasiana"	NA	"artemisia douglasiana"
"97b74a30-d1ef-427c-bd8c-ca5d535268fe"	"sd"	"sd177955"	"lake henshaw (vista irrigation district property): approx. 2.5 miles n of the lake; along henshaw truck trail where it crosses the riparian area that drains into the lakel"	33.28708	-116.74775	"united states"	"california"	"san diego"	NA	NA	"asteraceae"	"artemisia"	"douglasiana"	NA	"artemisia douglasiana"
"9802bba7-a39c-4f86-9b38-ae5ed9cf85f3"	"ucsb"	"ucsb39566"	"central basin slope (area 3b); more mesa; along the pacific ocean, south of atascadero creek, adjacent to and west of hope ranch park, ca. 3 km. southeast of goleta"	34.422	-119.795	"united states"	"california"	"santa barbara"	NA	NA	"asteraceae"	"artemisia"	"douglasiana"	NA	"artemisia douglasiana"
"9840c49f-8fcf-4aa0-ba4d-224f643764ab"	"uc"	"uc579564"	"3 mi sw moccasin peak; sonora quadrangle"	37.7745	-120.32403	"united states"	"california"	"tuolumne"	NA	3000	"asteraceae"	"artemisia"	"douglasiana"	NA	"artemisia douglasiana"
"999a843d-8925-427c-95b3-963c90cbe880"	"sd"	"sd212932"	"camp pendleton: romeo ii training area; north of las pulgas road, east of i-5 and east of el camino real along horno canyon road"	33.34227	-117.48909	"united states"	"california"	"san diego"	NA	NA	"asteraceae"	"artemisia"	"douglasiana"	NA	"artemisia douglasiana"
"99d26d91-d4c1-44dd-910b-4d369a541be4"	"ucr"	"ucr179654"	"eastern san gabriel mtns. c. 0.6 mi. sw of junction of swarthout canyon rd. and cajon rd."	34.26778	-117.45972	"united states"	"california"	"san bernardino"	NA	1000	"asteraceae"	"artemisia"	"douglasiana"	NA	"artemisia douglasiana"
