"406a3028-4e81-428a-93ab-8eec520f060f"	"pom"	"pom497989"	"san antonio canyon wash"	34.094	-117.6968	"united states"	"california"	"los angeles"	NA	2000	"rosaceae"	"cercocarpus"	"betuloides"	"betuloides"	"cercocarpus betuloides var. betuloides"
"4085b425-16ff-447a-b1a7-afa25532ff51"	"chsc"	"chsc45963"	"along the west side of north honcut creek, about 1/2 mile north of avocado avenue, about 3 miles north-west of bangor"	39.4111111111111	-121.421944444444	"united states"	"california"	"butte"	NA	825	"rosaceae"	"cercocarpus"	"betuloides"	"betuloides"	"cercocarpus betuloides var. betuloides"
"40b5f963-4897-4b9f-bf19-39d57d27858d"	"la"	"la83698"	"on road from wrightwood to palmdale"	34.4646	-117.864	"united states"	"california"	"los angeles"	NA	25000	"rosaceae"	"cercocarpus"	"betuloides"	NA	"cercocarpus betuloides"
"40ee8b98-92c5-453b-8f75-4e3616d782ee"	"cas"	"cas565017"	"bullrush canyon south of middle ranch, santa catalina island"	33.3282334	-118.4048938	"united states"	"california"	"los angeles"	NA	422	"rosaceae"	"cercocarpus"	"betuloides"	"blancheae"	"cercocarpus betuloides var. blancheae"
"410b7ac7-b632-45ff-aec0-bfaf2ad29721"	"ucd"	"ucd113076"	"los angeles county: avalon, santa catalina island"	33.3348	-118.3312	"united states"	"california"	"los angeles"	NA	1500	"rosaceae"	"cercocarpus"	"betuloides"	"blancheae"	"cercocarpus betuloides var. blancheae"
"4137a3ae-d194-42f9-9d68-ee9f80b9fc3d"	"uc"	"uc1602230"	"4 mi e of shotgun (stanislaus national forest); stanislaus national forest"	38.1611345154159	-120.095582174586	"united states"	"california"	"tuolumne"	NA	850	"rosaceae"	"cercocarpus"	"betuloides"	"betuloides"	"cercocarpus betuloides var. betuloides"
"4140b9e8-ce73-44c1-b429-bd994fec207d"	"ucr"	"ucr241456"	"san bernardino valley rancho cucamonga, along etiwanda creek wash at highland ave., between east ave. and cherry ave."	34.13778	-117.50694	"united states"	"california"	"san bernardino"	NA	1000	"rosaceae"	"cercocarpus"	"betuloides"	NA	"cercocarpus betuloides"
"415df3a5-f615-48b7-b162-113476f7906c"	"uc"	"uc859427"	"santa cruz island, dix canyon santa cruz island; santa barbara islands, , dix canyon"	34.0444	-119.7432	"united states"	"california"	"santa barbara"	NA	1500	"rosaceae"	"cercocarpus"	"betuloides"	"blancheae"	"cercocarpus betuloides var. blancheae"
"415f2079-8826-403f-bd24-ea223927d839"	"chsc"	"chsc101091"	"on the south side of the guardian rock trail, about 100 yards southwest of the ten mile house road trail, about 300 yards west of highway 32, west of the intersection of highway 32 and ten mile house road, upper bidwell park, about 10 miles northeast of chico"	39.8044444444444	-121.718611111111	"united states"	"california"	"butte"	NA	NA	"rosaceae"	"cercocarpus"	"betuloides"	"betuloides"	"cercocarpus betuloides var. betuloides"
"4175d107-f5aa-4e2b-af99-554c9b66d171"	"uc"	"uc198770"	"loma alta"	34.4032	-119.6977	"united states"	"california"	"santa barbara"	NA	330	"rosaceae"	"cercocarpus"	"betuloides"	"betuloides"	"cercocarpus betuloides var. betuloides"
"41761a0c-2f00-4b3f-bb2a-31e7a65fde78"	"uc"	"uc691100"	"summit of meridian peak, mount diablo meridian peak; mount diablo, meridian peak"	37.881704606061	-121.914159430165	"united states"	"california"	"contra costa"	NA	1187	"rosaceae"	"cercocarpus"	"betuloides"	"betuloides"	"cercocarpus betuloides var. betuloides"
"41cdb209-118a-4295-b705-e83bdbd763d4"	"rsa"	"rsa453274"	"glendale"	34.1951	-118.2504	"united states"	"california"	"los angeles"	NA	8000	"rosaceae"	"cercocarpus"	"betuloides"	NA	"cercocarpus betuloides"
"41e46a18-3d96-4270-adba-24905644a792"	"rsa"	"rsa333463"	"top of lone pine canyon"	34.3388	-117.6021	"united states"	"california"	"san bernardino"	NA	1300	"rosaceae"	"cercocarpus"	"betuloides"	"betuloides"	"cercocarpus betuloides var. betuloides"
"4208fc09-efbe-4eef-be32-84b9087bdc33"	"cas"	"539650"	"0.7 miles north of coast highway, tuna canyon - santa monica mountains"	34	-118	"united states"	"california"	"los angeles county"	NA	NA	"rosaceae"	"cercocarpus"	"betuloides"	NA	"cercocarpus betuloides  nutt."
"421a7694-7308-4ca7-a61f-4f0146a2f757"	"uc"	"uc729575"	"above the last almond orchard (santa catalina island, avalon canyon); santa catalina island, avalon canyon"	33.3329	-118.3335	"united states"	"california"	"los angeles"	NA	2000	"rosaceae"	"cercocarpus"	"betuloides"	"blancheae"	"cercocarpus betuloides var. blancheae"
"422bfa90-7d90-451f-9233-4dd7cdcd1d9d"	"cas"	"cas168214"	"cochico prietos, santa cruz island"	33.9706	-119.7075	"united states"	"california"	"santa barbara"	NA	2000	"rosaceae"	"cercocarpus"	"betuloides"	NA	"cercocarpus betuloides"
"4230b0dd-d74b-4248-bd6f-6ed6d1be821e"	"sd"	"sd27969"	"santa cruz island. 1 mi. west of main ranch"	33.998	-119.731	"united states"	"california"	"santa barbara"	NA	500	"rosaceae"	"cercocarpus"	"betuloides"	"blancheae"	"cercocarpus betuloides var. blancheae"
"4245cd18-fca8-466f-9b30-1bf3c05eac16"	"sd"	"sd157104"	"l.l. ranch, bell bluff truck trail, 2 mi south of i-8 on japatul valley road."	32.8129	-116.6688	"united states"	"california"	"san diego"	NA	NA	"rosaceae"	"cercocarpus"	"betuloides"	"betuloides"	"cercocarpus betuloides var. betuloides"
"42812bde-1203-49c9-b88c-e9103302c476"	"uc"	"uc764011"	"ridge between long barn and cold spring"	38.1276193156596	-120.092519742006	"united states"	"california"	"tuolumne"	NA	5383	"rosaceae"	"cercocarpus"	"betuloides"	"betuloides"	"cercocarpus betuloides var. betuloides"
"42bfca0c-0b82-4522-8848-6f1858d3df5b"	"cas"	"cas73608"	"goose valley"	40.9418	-121.7083	"united states"	"california"	"shasta"	NA	3751	"rosaceae"	"cercocarpus"	"betuloides"	"betuloides"	"cercocarpus betuloides var. betuloides"
"42c7251c-7ae3-4807-8785-31ddc827dd54"	"rsa"	"rsa657449"	"verdugo mountains: on fire road at intersection of haines canyon road and day st., tujunga"	34.2535	-118.2794	"united states"	"california"	"los angeles"	NA	1000	"rosaceae"	"cercocarpus"	"betuloides"	NA	"cercocarpus betuloides"
"42d8b4b3-dd23-4be5-a9ef-8db5b1ab66dc"	"sd"	"sd208569"	"bureau of land management. pacific crest trail, ne-side of san felipe hills. 1.7 air miles se of trailhead at county road s-22 (montezuma valley road) and 1.7 air miles e of san felipe."	33.19749	-116.56902	"united states"	"california"	"san diego"	NA	NA	"rosaceae"	"cercocarpus"	"betuloides"	"betuloides"	"cercocarpus betuloides var. betuloides"
"42defe4f-b07b-47df-806e-68601379fc67"	"rsa"	"rsa587507"	"san gabriel mountains: carr canyon."	34.4771	-117.9962	"united states"	"california"	"los angeles"	NA	800	"rosaceae"	"cercocarpus"	"betuloides"	"betuloides"	"cercocarpus betuloides var. betuloides"
"42df9b23-08e9-4cc8-aad9-d66025a10e2b"	"ucr"	"ucr99428"	"san gabriel mtns. ralston peak, cajon pass area, west of hwy i-215 in cajon wash, south of hwy 138, east of lone pine canyon road, near junction with hwy 138"	34.3025	-117.49444	"united states"	"california"	"san bernardino"	NA	1000	"rosaceae"	"cercocarpus"	"betuloides"	NA	"cercocarpus betuloides"
"42f75ceb-62ca-47c1-8b14-00afbc67edd0"	"rsa"	"rsa216690"	"above christy\'s."	34.008	-119.81	"united states"	"california"	"santa barbara"	NA	5000	"rosaceae"	"cercocarpus"	"betuloides"	"blancheae"	"cercocarpus betuloides var. blancheae"
"42f8e648-4d6d-47af-89fb-68600cbed8a8"	"rsa"	"rsa453277"	"san antonio canyon. san gabriel mountains"	34.2359	-117.6587	"united states"	"california"	"los angeles"	NA	7000	"rosaceae"	"cercocarpus"	"betuloides"	"betuloides"	"cercocarpus betuloides var. betuloides"
"430bfbd3-277f-4fdf-a8fe-14d6218c288b"	"uc"	"uc859431"	"1/2 mi se of main ranch (about 1/2 way up small canyon); santa cruz island"	33.9901	-119.7123	"united states"	"california"	"santa barbara"	NA	500	"rosaceae"	"cercocarpus"	"betuloides"	"blancheae"	"cercocarpus betuloides var. blancheae"
"4315f3fb-2ac8-482e-bb4b-728fe145aa3d"	"rsa"	"rsa167833"	"santa catalina island. in wild boar gully."	33.3238	-118.4422	"united states"	"california"	"los angeles"	NA	150	"rosaceae"	"cercocarpus"	"betuloides"	"blancheae"	"cercocarpus betuloides var. blancheae"
"43460ae0-f003-4af4-95ef-aca35dfb759d"	"sbbg"	"sbbg94402"	"santa cruz island: santa cruz island"	34.01	-119.73	"united states"	"california"	"santa barbara"	NA	19000	"rosaceae"	"cercocarpus"	"betuloides"	"blancheae"	"cercocarpus betuloides var. blancheae"
"434a7da3-5242-4882-8b0d-12838e45a0b7"	"rsa"	"rsa596716"	"san jacinto mountains. 1 mi. west of hurley flat."	33.8693	-116.8091	"united states"	"california"	"riverside"	NA	1100	"rosaceae"	"cercocarpus"	"betuloides"	NA	"cercocarpus betuloides"
"4384d9fb-15b3-4010-a33d-9b5302943ab5"	"cas"	"172183"	"tahquitz trail to tahquitz pk. - san jacinto mts."	33.7408	-116.6896	"united states"	"california"	"riverside county"	NA	NA	"rosaceae"	"cercocarpus"	"betuloides"	"betuloides"	"cercocarpus betuloides var. betuloides  nutt."
"43b13aec-7632-4900-82fa-ae8f8181bc9d"	"ucsc"	"ucsc1443"	"southern crest of the san rafael hills san rafael hills"	34.1591	-118.1904	"united states"	"california"	"los angeles"	NA	4000	"rosaceae"	"cercocarpus"	"betuloides"	NA	"cercocarpus betuloides"
"43c6ef8a-f1da-43ba-95bc-4deea96108bc"	"hsc"	"hsc101771"	"along cassel road, lassen national forest."	40.924	-121.47	"united states"	"california"	"shasta"	NA	NA	"rosaceae"	"cercocarpus"	"betuloides"	"betuloides"	"cercocarpus betuloides var. betuloides"
"441394e3-6ff0-4d44-95c8-d8c30981e7ee"	"rsa"	"rsa754208"	"san gabriel river watershed; next to reservoir."	34.1580555555556	-117.770555555556	"united states"	"california"	"los angeles"	NA	NA	"rosaceae"	"cercocarpus"	"betuloides"	"betuloides"	"cercocarpus betuloides var. betuloides"
"441753de-f4db-478e-8247-8e3009cca525"	"cas"	"cas232445"	"badger"	36.6313477476129	-119.012240192783	"united states"	"california"	"tulare"	NA	2983	"rosaceae"	"cercocarpus"	"betuloides"	"betuloides"	"cercocarpus betuloides var. betuloides"
"445f4e1f-f8a9-4a1e-877f-f2edb191a41c"	"sbbg"	"sbbg78153"	"santa cruz island: cuesta grade below centinela"	34.017	-119.805	"united states"	"california"	"santa barbara"	NA	1600	"rosaceae"	"cercocarpus"	"betuloides"	"blancheae"	"cercocarpus betuloides var. blancheae"
"44685c38-9afd-4525-8ee1-dd8b3caf6000"	"cas"	"cas909005"	"mt. sherman jeep road"	36.01	-118.3908	"united states"	"california"	"tulare"	NA	4373	"rosaceae"	"cercocarpus"	"betuloides"	"betuloides"	"cercocarpus betuloides var. betuloides"
"44811b17-165e-4372-8a86-033d392f11df"	"uc"	"uc1324030"	"1/2 mi e of clough cave ( sequoia national park); sequoia national park"	36.3484339305773	-118.753048326963	"united states"	"california"	"tulare"	NA	1003	"rosaceae"	"cercocarpus"	"betuloides"	"betuloides"	"cercocarpus betuloides var. betuloides"
"4497ecfb-40bd-4024-affe-4682f4b17a8c"	"hsc"	"hsc101829"	"along south shore drive, s of whiskeytown lake."	40.6429	-122.6204	"united states"	"california"	"trinity"	NA	NA	"rosaceae"	"cercocarpus"	"betuloides"	"betuloides"	"cercocarpus betuloides var. betuloides"
"449a6bac-5033-4a32-ad50-fca65300afbe"	"uc"	"uc12129"	"mount diablo, summit mount diablo"	37.881704606061	-121.914159430165	"united states"	"california"	"contra costa"	NA	1187	"rosaceae"	"cercocarpus"	"betuloides"	"betuloides"	"cercocarpus betuloides var. betuloides"
"44a73cd7-3676-4a05-91ea-543e60ada9fd"	"pom"	"pom275799"	"100 yds. n. of foothill blvd. road to camp baldy, east of claremont."	34.1076	-117.7071	"united states"	"california"	"los angeles"	NA	300	"rosaceae"	"cercocarpus"	"betuloides"	NA	"cercocarpus betuloides"
"44b5cb32-a266-4f24-880a-f2ecfaa965c8"	"pom"	"pom180035"	"above cochie canyon"	33.973	-119.712	"united states"	"california"	"santa barbara"	NA	2000	"rosaceae"	"cercocarpus"	"betuloides"	"blancheae"	"cercocarpus betuloides var. blancheae"
"44bf336e-787d-4819-be6f-85ef7607bf8a"	"rsa"	"rsa809851"	"sheep mountain wilderness; coldwater canyon off of cattle canyon, on the southwestern flanks of mount san antonio."	34.24322	-117.72878	"united states"	"california"	"los angeles"	NA	NA	"rosaceae"	"cercocarpus"	"betuloides"	NA	"cercocarpus betuloides"
"44cb2436-a536-468c-b286-7fc668600aa8"	"ucd"	"ucd22488"	"santa monica mountains, in gulch at northwest corner of mulholland hwy. and little sycamore canyon rd"	34.0892068084783	-118.881027417757	"united states"	"california"	"los angeles"	NA	178	"rosaceae"	"cercocarpus"	"betuloides"	"blancheae"	"cercocarpus betuloides var. blancheae"
"44cb3363-ad2f-40e6-95e0-f8e523e781bd"	"ds"	"ds38546"	"oakgrove canyon, liebre mountains"	34.7229	-118.5832	"united states"	"california"	"los angeles"	NA	1500	"rosaceae"	"cercocarpus"	"betuloides"	NA	"cercocarpus betuloides"
"44dd5884-0c78-4638-be20-bc48dadcfcd2"	"pom"	"pom98638"	"head of purissima canyon, near lompoc."	34.732	-120.4225	"united states"	"california"	"santa barbara"	NA	1000	"rosaceae"	"cercocarpus"	"betuloides"	"blancheae"	"cercocarpus betuloides var. blancheae"
"45429d76-7d13-4cd0-8a05-6b284c17fb31"	"ds"	"ds206637"	"west end santa catalina island"	33.3923	-118.4512	"united states"	"california"	"los angeles"	NA	17400	"rosaceae"	"cercocarpus"	"betuloides"	"blancheae"	"cercocarpus betuloides var. blancheae"
"454e1067-4bde-4768-a079-0ea5e0843680"	"cas"	"cas73642"	"unspecified"	40.6004	-123.1408	"united states"	"california"	"trinity"	NA	70762	"rosaceae"	"cercocarpus"	"betuloides"	"betuloides"	"cercocarpus betuloides var. betuloides"
"455e3253-0ef3-45c6-bb88-8681e988ad50"	"sd"	"sd164156"	"laguna mountains: lucky 5 ranch; southern portion of new acquisition by california state parks: west side of sunrise hwy (s-1) between cuyamaca lake and mount laguna"	32.93889	-116.49111	"united states"	"california"	"san diego"	NA	NA	"rosaceae"	"cercocarpus"	"betuloides"	"betuloides"	"cercocarpus betuloides var. betuloides"
"456484fa-7ece-4964-853c-6419a6bea1bd"	"ucd"	"ucd113023"	"sonoma county: near petrified forest"	38.5557	-122.639	"united states"	"california"	"sonoma"	NA	500	"rosaceae"	"cercocarpus"	"betuloides"	NA	"cercocarpus betuloides"
"4565deee-26b9-4e21-a4a1-2ed41ac96a19"	"rsa"	"rsa805441"	"along highway 108 near stoddard spring northeast of long barn and mi-wok village"	38.1322222222222	-120.099166666667	"united states"	"california"	"tuolumne"	NA	NA	"rosaceae"	"cercocarpus"	"betuloides"	NA	"cercocarpus betuloides"
"457b781f-eaa0-40fd-af02-a1914df224b4"	"la"	"la82108"	"santa monica mountains, w-fork las trancas (rattlesnake) canyon, n slope"	34.0792302606973	-118.85871438918	"united states"	"california"	"los angeles"	NA	200	"rosaceae"	"cercocarpus"	"betuloides"	"betuloides"	"cercocarpus betuloides var. betuloides"
"458e43e8-abdc-4f26-b1ea-507b61c5140b"	"cas"	"1025976"	"clear lake, lake county land trust, rodman slough"	39.1166666667	-122.8666666667	"united states"	"california"	"lake county"	NA	NA	"rosaceae"	"cercocarpus"	"betuloides"	"betuloides"	"cercocarpus betuloides var. betuloides  nutt."
"45b94d27-e039-4ea8-aabb-27bb06f60c8d"	"rsa"	"rsa172271"	"tin mine canyon above beek\'s spring, trabuco district, cleveland national forest"	33.8200167758141	-117.630883752793	"united states"	"california"	"orange"	NA	165	"rosaceae"	"cercocarpus"	"betuloides"	NA	"cercocarpus betuloides"
"45cb06cc-d9b0-47ca-a892-6ca5344d2804"	"rsa"	"rsa657368"	"south by southeast face of the eagle rock, eagle rock district, los angeles, california 90041."	34.1433333333333	-118.183611111111	"united states"	"california"	"los angeles"	NA	NA	"rosaceae"	"cercocarpus"	"betuloides"	"betuloides"	"cercocarpus betuloides var. betuloides"
"45e3742f-8dd4-4ea4-abaf-645aa2d3d323"	"cas"	"883253"	"southern santa ana mountains, san mateo canyon wilderness area. indian potrero trail south from verdugo potrero to indian potrero on ridge between talega canyon and nickel canyon"	33.5283	-117.4656	"united states"	"california"	"riverside county"	NA	NA	"rosaceae"	"cercocarpus"	"betuloides"	"betuloides"	"cercocarpus betuloides var. betuloides  nutt."
"460a5d9e-bfdd-4427-ba45-18ed3618bec5"	"uc"	"uc466619"	"w of los gatos"	37.2327	-121.9988	"united states"	"california"	"santa clara"	NA	2200	"rosaceae"	"cercocarpus"	"betuloides"	"betuloides"	"cercocarpus betuloides var. betuloides"
"465f3262-ede6-4455-847b-3cc852403227"	"cas"	"cas73588"	"tassajara springs"	36.2336	-121.5486	"united states"	"california"	"monterey"	NA	1752	"rosaceae"	"cercocarpus"	"betuloides"	"betuloides"	"cercocarpus betuloides var. betuloides"
"466d20d6-76e6-4bd2-86f6-2900d2888c10"	"ucr"	"ucr118668"	"moorpark hills south of tierra rejada valley, along read rd. c. 1/2 mile east of moorpark rd., just west of hwy 23, c. 1 mile nw of wood ranch reservoir, c. 2 mi. ne of thousand oaks"	34.24583	-118.84639	"united states"	"california"	"ventura"	NA	1000	"rosaceae"	"cercocarpus"	"betuloides"	NA	"cercocarpus betuloides"
"4676d74d-ccb5-4a76-bc3f-716e4cfe2cfb"	"uc"	"uc1052817"	"1 2/3 mi se of wish-i-ah sanitarium (new auberry); sierra national forest, new auberry"	37.0953048905577	-119.521899066426	"united states"	"california"	"fresno"	NA	2514	"rosaceae"	"cercocarpus"	"betuloides"	"betuloides"	"cercocarpus betuloides var. betuloides"
"467bb454-6c3e-423e-9a0e-2604bb426a99"	"ucd"	"ucd113050"	"napa county: beside road up south side of howell mountain, 5.6 miles north of st. helena"	38.5849	-122.4687	"united states"	"california"	"napa"	NA	2802	"rosaceae"	"cercocarpus"	"betuloides"	NA	"cercocarpus betuloides"
"4697f8ec-3011-477b-9de0-d9e96f6c49c0"	"ucr"	"ucr63401"	"about 1 mi below seigler hot springs along creek"	38.8515	-122.6894	"united states"	"california"	"lake"	NA	3500	"rosaceae"	"cercocarpus"	"betuloides"	NA	"cercocarpus betuloides"
"46b3909b-50a0-4bfe-880f-86deeb4b3301"	"sbbg"	"sbbg89841"	"santa cruz island: campo raton, just w of base of centinela grade"	34.01560443979	-119.809463180742	"united states"	"california"	"santa barbara"	NA	1000	"rosaceae"	"cercocarpus"	"betuloides"	"blancheae"	"cercocarpus betuloides var. blancheae"
"46de0d45-d1fc-4054-a4d9-e31c89ae83b2"	"uc"	"uc195332"	"nw of san bernardino (lytle creek); lytle creek"	34.1315	-117.3464	"united states"	"california"	"san bernardino"	NA	10000	"rosaceae"	"cercocarpus"	"betuloides"	"betuloides"	"cercocarpus betuloides var. betuloides"
"46e9e121-5631-49f9-81e1-923bce335025"	"la"	"la47758"	"mission canyon"	34.469	-119.706	"united states"	"california"	"santa barbara"	NA	3000	"rosaceae"	"cercocarpus"	"betuloides"	NA	"cercocarpus betuloides"
"46eeca64-d042-4477-a312-d401015f8c3e"	"ds"	"ds72751"	"live oak springs, laguna mts."	32.6905	-116.3349	"united states"	"california"	"san diego"	NA	1650	"rosaceae"	"cercocarpus"	"betuloides"	"betuloides"	"cercocarpus betuloides var. betuloides"
"47456c38-7807-4427-afc3-39952009ce2d"	"la"	"la47759"	"simi hills - santa susana mountains, santa susana pass"	34.2664039513998	-118.632032099288	"united states"	"california"	"los angeles"	NA	500	"rosaceae"	"cercocarpus"	"betuloides"	"betuloides"	"cercocarpus betuloides var. betuloides"
"4788fc14-23c7-4ef7-a60e-c171fabb7f56"	"sd"	"sd204629"	"sw of oak grove, ne slope of aguanga mountain, cleveland national forest, at north edge of oak grove truck trail (usfs 9s09)."	33.37639	-116.825	"united states"	"california"	"san diego"	NA	NA	"rosaceae"	"cercocarpus"	"betuloides"	"betuloides"	"cercocarpus betuloides var. betuloides"
"47893d9f-3b26-4af8-acc0-87ab3df345a8"	"jeps"	"jeps45550"	"forestdale"	41.2682	-121.3418	"united states"	"california"	"modoc"	NA	1500	"rosaceae"	"cercocarpus"	"betuloides"	"macrourus"	"cercocarpus betuloides var. macrourus"
"478f45bf-b8ec-4eb2-82ff-6671f7d1d1e7"	"rsa"	"rsa175267"	"3 1/2 miles e of alta sierra."	35.7210513072929	-118.505720399906	"united states"	"california"	"kern"	NA	3230	"rosaceae"	"cercocarpus"	"betuloides"	NA	"cercocarpus betuloides"
"47ef7dce-eda0-48a6-8055-dfdafc252ebf"	"rsa"	"rsa449414"	"santa catalina island"	33.3982	-118.4457	"united states"	"california"	"los angeles"	NA	16473	"rosaceae"	"cercocarpus"	"betuloides"	"blancheae"	"cercocarpus betuloides var. blancheae"
"48307dd6-bced-4010-9c0a-faedb2077a8f"	"la"	"la52111"	"santa monica mountains, griffith park"	34.1359	-118.2942	"united states"	"california"	"los angeles"	NA	3000	"rosaceae"	"cercocarpus"	"betuloides"	"betuloides"	"cercocarpus betuloides var. betuloides"
"486beec9-02e9-4711-86d8-ac1c945a5233"	"ds"	"ds38521"	"humbug mountain"	41.7791	-122.6741	"united states"	"california"	"siskiyou"	NA	2450	"rosaceae"	"cercocarpus"	"betuloides"	"macrourus"	"cercocarpus betuloides var. macrourus"
"491e63cc-b220-4459-a306-6d13c718ad72"	"ucr"	"ucr183179"	"la sierra hills norco, nw side of the la sierra hills, east of the end of rushmore dr."	33.94167	-117.51611	"united states"	"california"	"riverside"	NA	1000	"rosaceae"	"cercocarpus"	"betuloides"	"betuloides"	"cercocarpus betuloides var. betuloides"
"495f5bdf-8ad0-4ea7-aad2-6f9df44e072a"	"pom"	"pom607"	"claremont."	34.0955	-117.718	"united states"	"california"	"los angeles"	NA	2500	"rosaceae"	"cercocarpus"	"betuloides"	NA	"cercocarpus betuloides"
"499c87ec-1d52-4fbe-8b0f-25161a3da451"	"cas"	"178209"	"arroyo mocho at ne. base of cedar mt."	37.5813	-121.5998	"united states"	"california"	"alameda county"	NA	NA	"rosaceae"	"cercocarpus"	"betuloides"	"betuloides"	"cercocarpus betuloides var. betuloides  nutt."
"49ab0732-ca5b-44f7-9e4a-14297f2a235a"	"cas"	"cas823415"	"north fork eel river, about 500 feet e of confluence with main eel"	39.9566	-123.4351	"united states"	"california"	"mendocino"	NA	200	"rosaceae"	"cercocarpus"	"betuloides"	"betuloides"	"cercocarpus betuloides var. betuloides"
"49b074df-03b9-417d-9edc-f08d8b6bcea6"	"uc"	"uc1127925"	"1 3/4 mi se of mouth of beartrap canyon (santa barbara national forest); santa barbara national forest"	34.6410863505194	-118.757324760841	"united states"	"california"	"los angeles"	NA	825	"rosaceae"	"cercocarpus"	"betuloides"	"betuloides"	"cercocarpus betuloides var. betuloides"
"49b4ad5b-693a-435f-ad27-9c08117e6b22"	"sbbg"	"sbbg108044"	"santa lucia mtns: cuesta"	35.3482738674853	-120.629402679007	"united states"	"california"	"san luis obispo"	NA	NA	"rosaceae"	"cercocarpus"	"betuloides"	"betuloides"	"cercocarpus betuloides var. betuloides"
"49baabfb-f26d-4b27-a317-580a4a1df62a"	"obi"	"obi72270"	"tierra redonda mtn blm acec"	35.765258	-120.987553	"united states"	"california"	"san luis obispo"	NA	NA	"rosaceae"	"cercocarpus"	"betuloides"	"betuloides"	"cercocarpus betuloides var. betuloides"
"49d3dfd7-87b3-47b7-a841-e680625fc92c"	"sd"	"sd143757"	"santa ana mts: above modjeska canyon: proposed water tank site"	33.70833	-117.61667	"united states"	"california"	"orange"	NA	NA	"rosaceae"	"cercocarpus"	"betuloides"	NA	"cercocarpus betuloides"
"49db9d8a-6888-4f56-9a87-0312e4711f08"	"uc"	"uc1193192"	"4 1/2 mi ne of platina"	40.3973713915295	-122.850529761274	"united states"	"california"	"shasta"	NA	825	"rosaceae"	"cercocarpus"	"betuloides"	"betuloides"	"cercocarpus betuloides var. betuloides"
"49e155b0-c3fe-4c5f-99aa-e420af72d57c"	"cas"	"1091239"	"pinnacles n.m., west entrance, about 1 km from chaparral ranger station parking area, near trail"	36.49	-121.19	"united states"	"california"	"san benito county"	NA	NA	"rosaceae"	"cercocarpus"	"betuloides"	"betuloides"	"cercocarpus betuloides var. betuloides  nutt."
"49e4f68a-e7d0-4dd4-90e0-db0b8ab8c29a"	"cas"	"cas1025976"	"clear lake, lake county land trust, rodman slough"	39.1166666667	-122.8666666667	"united states"	"california"	"lake"	NA	NA	"rosaceae"	"cercocarpus"	"betuloides"	"betuloides"	"cercocarpus betuloides var. betuloides"
"49eb12e2-e9e3-4d31-a7ae-2626f0afce0d"	"ucd"	"ucd83275"	"fresno county: sierra national forest, west of the san joaquin river, southeast of bridge to road 225, northeast of halian bar rd"	37.1521874786769	-119.403104807279	"united states"	"california"	"fresno"	NA	NA	"rosaceae"	"cercocarpus"	"betuloides"	NA	"cercocarpus betuloides"
"4a03ac69-dd99-4531-bd91-bb5be1694756"	"pom"	"pom48331"	"snow canyon, san jacinto mts. alt. 1500 ft."	33.88359	-116.67514	"united states"	"california"	"riverside"	NA	NA	"rosaceae"	"cercocarpus"	"betuloides"	NA	"cercocarpus betuloides"
"4a3f7337-0c5d-4190-9119-6f981af84bba"	"uc"	"uc1719446"	"santa ana mountains, 4.8 mi s of lake elsinore, along hwy 74"	33.6520216080693	-117.407875270198	"united states"	"california"	"riverside"	NA	5000	"rosaceae"	"cercocarpus"	"betuloides"	"macrourus"	"cercocarpus betuloides var. macrourus"
"4a496ea9-1c6f-426e-acbf-a8c0cf47c629"	"cas"	"cas278341"	"rocky ridges near pipe creek, above hemet valley - san jacinto mts."	33.6383	-116.5827	"united states"	"california"	"riverside"	NA	899	"rosaceae"	"cercocarpus"	"betuloides"	"betuloides"	"cercocarpus betuloides var. betuloides"
"4a602f96-6bdf-4568-9886-a6975d57c48c"	"jeps"	"jeps44703"	"santa monica mountains, mandeville canyon mandeville canyon; santa monica mountains, mandeville canyon"	34.0939475755613	-118.503555386508	"united states"	"california"	"los angeles"	NA	4372	"rosaceae"	"cercocarpus"	"betuloides"	"betuloides"	"cercocarpus betuloides var. betuloides"
"4acdfdad-67c9-4db6-b953-f464bdd99003"	"ds"	"ds290575"	"five miles east of napa"	38.3242	-122.216	"united states"	"california"	"napa"	NA	3869	"rosaceae"	"cercocarpus"	"betuloides"	"betuloides"	"cercocarpus betuloides var. betuloides"
"4adb27fc-4399-424e-baff-6d1b3bcd48a4"	"ds"	"ds116944"	"witch creek"	33.0827	-116.7169	"united states"	"california"	"san diego"	NA	3712	"rosaceae"	"cercocarpus"	"betuloides"	"betuloides"	"cercocarpus betuloides var. betuloides"
"4aec1793-0837-492c-975c-5bb4a9ee6721"	"uc"	"uc555654"	"santa barbara to la combre peak via la combre trail and rattlesnake canyon la combre trail"	34.4775	-119.692	"united states"	"california"	"santa barbara"	NA	4900	"rosaceae"	"cercocarpus"	"betuloides"	"betuloides"	"cercocarpus betuloides var. betuloides"
"4b089767-552a-4c7a-a943-2a293aeaf3c4"	"ds"	"ds96881"	"san gabriel canyon [ca&ntilde;on]"	34.2329	-117.8442	"united states"	"california"	"los angeles"	NA	8000	"rosaceae"	"cercocarpus"	"betuloides"	NA	"cercocarpus betuloides"
