"b454bb71-2ae4-4779-b02b-b33e942e5096"	"rsa"	"rsa453294"	"lytle creek"	34.3008	-117.5863	"united states"	"california"	"san bernardino"	NA	4400	"rosaceae"	"cercocarpus"	"betuloides"	NA	"cercocarpus betuloides"
"b45d1af2-5ec6-4250-a3fa-b403db38300f"	"jeps"	"jeps44706"	"trinity river valley at willow creek willow creek; northern coast ranges, trinity river valley, willow creek"	40.944	-123.6319	"united states"	"california"	"humboldt"	NA	1328	"rosaceae"	"cercocarpus"	"betuloides"	"betuloides"	"cercocarpus betuloides var. betuloides"
"b47b6a5d-b924-4dbc-a44f-3ba24567f7bc"	"sbbg"	"sbbg78148"	"santa cruz island: santa cruz island"	34.01	-119.73	"united states"	"california"	"santa barbara"	NA	19000	"rosaceae"	"cercocarpus"	"betuloides"	"blancheae"	"cercocarpus betuloides var. blancheae"
"b4865614-f567-4d15-bb17-d0b63bafe098"	"sd"	"sd187129"	"hauser wilderness: cleveland national forest; w of morena reservoir, unburned patch of chaparral just sw of bronco flats and s of skye valley road"	32.69308	-116.57178	"united states"	"california"	"san diego"	NA	NA	"rosaceae"	"cercocarpus"	"betuloides"	"betuloides"	"cercocarpus betuloides var. betuloides"
"b4a8ffd0-d661-44ba-97e5-bfbe89065497"	"cas"	"781072"	"indian rd. ca. 15 mi. w. of sun city, site 4"	33.7333333333	-117.45	"united states"	"california"	"riverside county"	NA	NA	"rosaceae"	"cercocarpus"	"betuloides"	"betuloides"	"cercocarpus betuloides var. betuloides  nutt."
"b4afcd04-d0d2-413e-9b20-12f142ff48a0"	"uc"	"uc518023"	"adams springs"	38.8560421817461	-122.718520200357	"united states"	"california"	"lake"	NA	1745	"rosaceae"	"cercocarpus"	"betuloides"	"betuloides"	"cercocarpus betuloides var. betuloides"
"b4b9a98f-6aa1-4d6e-9ac9-a59f828fae75"	"rsa"	"rsa449417"	"santa catalina island"	33.3993	-118.4409	"united states"	"california"	"los angeles"	NA	16811	"rosaceae"	"cercocarpus"	"betuloides"	"blancheae"	"cercocarpus betuloides var. blancheae"
"b4ec11d3-949c-481d-85af-4ac844d160c0"	"sbbg"	"sbbg80147"	"santa cruz island: 6 mi w of main ranch"	34.017	-119.818	"united states"	"california"	"santa barbara"	NA	3000	"rosaceae"	"cercocarpus"	"betuloides"	"blancheae"	"cercocarpus betuloides var. blancheae"
"b4ef9799-45af-4474-94a9-2533a77d35e5"	"uc"	"uc1970488"	"walker canyon ecological reserve (california dept. of fish & game): between boulevard and jacumba on the north side of interstate 8, on the northeast side of the reserve."	32.66806	-116.24611	"united states"	"california"	"san diego"	NA	NA	"rosaceae"	"cercocarpus"	"betuloides"	"betuloides"	"cercocarpus betuloides var. betuloides"
"b50519b4-2f2c-40ef-b5c9-bb3e14b25881"	"rsa"	"rsa453283"	"long canyon, san gabriel mountains."	34.2613	-118.1704	"united states"	"california"	"los angeles"	NA	1200	"rosaceae"	"cercocarpus"	"betuloides"	"betuloides"	"cercocarpus betuloides var. betuloides"
"b55ca5c4-2be2-4464-864a-a35c1e390f86"	"ds"	"ds160461"	"summit on boundary of trinity & shasta counties on eureka-red bluff road"	40.3819	-123.0162	"united states"	"california"	"trinity"	NA	1140	"rosaceae"	"cercocarpus"	"betuloides"	"betuloides"	"cercocarpus betuloides var. betuloides"
"b56481ce-fc3d-4393-94c1-767e92d7ac03"	"jeps"	"jeps45528"	"e of calistoga (pope valley grade near the palisades); napa river basin"	38.6547	-122.5584	"united states"	"california"	"napa"	NA	7650	"rosaceae"	"cercocarpus"	"betuloides"	"betuloides"	"cercocarpus betuloides var. betuloides"
"b5a94d41-45d2-422c-ab04-ecabdbe70611"	"ucd"	"ucd48195"	"yolo county: mclaughlin uc reserve. w side of davis creek reservoir, along road that goes from soda spring area to rayhouse rd. ca. 0.5 airline mile due n of soda springs and ca. 1.0 airline mile wnw of uc davis aquatic lab facility. along edges of running stream and slopes to the north and south of stream on the w side of the road"	38.8563888886943	-122.370833333551	"united states"	"california"	"yolo"	NA	NA	"rosaceae"	"cercocarpus"	"betuloides"	"betuloides"	"cercocarpus betuloides var. betuloides"
"b5d9b2ae-b45f-40f4-a544-75c3255ab40f"	"ds"	"ds162654"	"fort tejon"	34.8742	-118.8951	"united states"	"california"	"kern"	NA	1600	"rosaceae"	"cercocarpus"	"betuloides"	"betuloides"	"cercocarpus betuloides var. betuloides"
"b6368f93-253a-42ed-907f-1724940b10b6"	"cas"	"cas907911"	"4.5 miles east of claraville on road to kelso valley"	35.4636	-118.2676	"united states"	"california"	"kern"	NA	500	"rosaceae"	"cercocarpus"	"betuloides"	"betuloides"	"cercocarpus betuloides var. betuloides"
"b64ea7a1-b288-4a11-8e74-2a2c8017a6e9"	"uc"	"uc859446"	"santa catalina island"	33.38333	-118.41667	"united states"	"california"	"los angeles"	NA	NA	"rosaceae"	"cercocarpus"	"betuloides"	"blancheae"	"cercocarpus betuloides var. blancheae"
"b661c133-b3a2-429b-863c-6f0ccab0ebf0"	"ds"	"ds84811"	"near st. helena sanitarium"	38.541	-122.4744	"united states"	"california"	"napa"	NA	775	"rosaceae"	"cercocarpus"	"betuloides"	"betuloides"	"cercocarpus betuloides var. betuloides"
"b66bb9e0-7cd7-4273-8940-011139239276"	"cas"	"582766"	"eagle rock"	37.1466666667	-122.195	"united states"	"california"	"santa cruz county"	NA	NA	"rosaceae"	"cercocarpus"	"betuloides"	"betuloides"	"cercocarpus betuloides var. betuloides  nutt."
"b69878e2-24f0-4889-a05a-c4e0f0e12e0f"	"ucd"	"ucd22471"	"rush creek campground in modoc national forest, about 10 miles north of adin and 6 miles south of adin pass"	41.2975	-120.8639	"united states"	"california"	"modoc"	NA	1722	"rosaceae"	"cercocarpus"	"betuloides"	"macrourus"	"cercocarpus betuloides var. macrourus"
"b69c1622-4cdf-4abc-bb3c-a79e952b8032"	"chsc"	"chsc86829"	"vicinity of red bank creek and dry creek"	40.0969444444444	-122.576388888889	"united states"	"california"	"tehama"	NA	4950	"rosaceae"	"cercocarpus"	"betuloides"	"betuloides"	"cercocarpus betuloides var. betuloides"
"b6b14e1e-5733-4521-ae90-c914af81ed67"	"uc"	"uc511186"	"cajon canyon, cajon creek watershed cajon canyon; san bernardino mountain range, cajon canyon"	34.2135	-117.4122	"united states"	"california"	"san bernardino"	NA	3000	"rosaceae"	"cercocarpus"	"betuloides"	"betuloides"	"cercocarpus betuloides var. betuloides"
"b6cf3052-28c0-41e6-9854-25f910925bcd"	"pom"	"pom122726"	"arrowhead grade, san bernardino mts."	34.20841	-117.28352	"united states"	"california"	"san bernardino"	NA	6400	"rosaceae"	"cercocarpus"	"betuloides"	NA	"cercocarpus betuloides"
"b6f9ce21-de1b-45c1-a9c3-0098b6c87eda"	"uc"	"uc466614"	"s of avalon (santa catalina island); santa catalina island"	33.312023	-118.32687	"united states"	"california"	"los angeles"	NA	2200	"rosaceae"	"cercocarpus"	"betuloides"	"blancheae"	"cercocarpus betuloides var. blancheae"
"b7103acd-529c-4ee9-ab7b-245fee3b22f4"	"csusb"	"csusb1861"	"lytle creek"	34.2301	-117.4694	"united states"	"california"	"san bernardino"	NA	1000	"rosaceae"	"cercocarpus"	"betuloides"	NA	"cercocarpus betuloides"
"b7128e91-9f91-4c69-998a-298742f35880"	"rsa"	"rsa90789"	"logging road about 9.5 miles w of taskenta in serpentine"	39.9	-122.6496	"united states"	"california"	"tehama"	NA	300	"rosaceae"	"cercocarpus"	"betuloides"	NA	"cercocarpus betuloides"
"b714ed11-7875-4085-9033-a018bf86e5dd"	"sd"	"sd171323"	"walker canyon ecological reserve (ca. dept. of fish & game): between boulevard and jacumba on the north side of interstate 8, on the northeast side of the reserve."	32.66806	-116.24611	"united states"	"california"	"san diego"	NA	NA	"rosaceae"	"cercocarpus"	"betuloides"	"betuloides"	"cercocarpus betuloides var. betuloides"
"b744bdb4-80ab-41d9-a361-f0d158c11354"	"pom"	"pom12099"	"idyllwild"	33.7465	-116.7148	"united states"	"california"	"riverside"	NA	NA	"rosaceae"	"cercocarpus"	"betuloides"	NA	"cercocarpus betuloides"
"b7c66ae1-3f84-44d1-824e-3616017e24e6"	"ds"	"ds110344"	"live oak springs, laguna mts."	32.6905	-116.3349	"united states"	"california"	"san diego"	NA	1650	"rosaceae"	"cercocarpus"	"betuloides"	"betuloides"	"cercocarpus betuloides var. betuloides"
"b7c918ef-b476-4cb1-a3e9-deb2354f5c9f"	"rsa"	"rsa4550"	"w of summit of buena vista grade."	34.0157	-119.7998	"united states"	"california"	"santa barbara"	NA	1000	"rosaceae"	"cercocarpus"	"betuloides"	"blancheae"	"cercocarpus betuloides var. blancheae"
"b7d40206-335a-49bd-8b34-72df446e9dd3"	"ucr"	"ucr213319"	"city of upland, san antonio wash, north of foothill blvd and immediately west of concrete channel, near county line and city of claremont"	34.10833	-117.7	"united states"	"california"	"san bernardino"	NA	1000	"rosaceae"	"cercocarpus"	"betuloides"	NA	"cercocarpus betuloides"
"b7d9dd59-0b82-4592-a35c-36fd33b8ea24"	"rsa"	"rsa786953"	"santa ana mountains: along ortega highway (74)"	33.6469	-117.3848	"united states"	"california"	"riverside"	NA	1160	"rosaceae"	"cercocarpus"	"betuloides"	"betuloides"	"cercocarpus betuloides var. betuloides"
"b7ff2d77-d23d-4ca2-983b-44c4de3ce392"	"uc"	"uc859433"	"rawhide hill"	37.9638	-120.454	"united states"	"california"	"tuolumne"	NA	2610	"rosaceae"	"cercocarpus"	"betuloides"	"betuloides"	"cercocarpus betuloides var. betuloides"
"b8a70773-fcea-41c2-ad08-4b4f11dfa908"	"uc"	"uc724425"	"at headwaters of arroyo mocho (mount hamilton range); inner south coast ranges, , arroyo mocho"	37.5829	-121.6265	"united states"	"california"	"alameda"	NA	4500	"rosaceae"	"cercocarpus"	"betuloides"	"betuloides"	"cercocarpus betuloides var. betuloides"
"b8b01aa1-7f5a-440d-959a-839185b329de"	"rsa"	"rsa5286"	"main divide of santa ana mts. between sierra peak and skyline drive"	33.8400163251865	-117.650884640593	"united states"	"california"	"orange"	NA	1650	"rosaceae"	"cercocarpus"	"betuloides"	NA	"cercocarpus betuloides"
"b8b3feeb-67a4-41a8-b1a5-237de24b4e56"	"la"	"la52114"	"santa monica mountains, griffith park"	34.1354	-118.3018	"united states"	"california"	"los angeles"	NA	3000	"rosaceae"	"cercocarpus"	"betuloides"	"betuloides"	"cercocarpus betuloides var. betuloides"
"b8d95062-cf1b-4ab9-b4eb-eafce8c94987"	"uc"	"uc466611"	"pasadena; pacific coast, coast ranges, pasadena"	34.14778	-118.14361	"united states"	"california"	"los angeles"	NA	NA	"rosaceae"	"cercocarpus"	"betuloides"	"betuloides"	"cercocarpus betuloides var. betuloides"
"b8db8ad2-931a-49f0-9631-82b6e49ed683"	"cas"	"278341"	"rocky ridges near pipe creek, above hemet valley - san jacinto mts."	33.6383	-116.5827	"united states"	"california"	"riverside county"	NA	NA	"rosaceae"	"cercocarpus"	"betuloides"	"betuloides"	"cercocarpus betuloides var. betuloides  nutt."
"b8f4143e-9108-4c1b-87df-3d9bd9535d09"	"cas"	"213641"	"sonoma creek canyon"	38.439896	-122.52355	"united states"	"california"	"sonoma county"	NA	NA	"rosaceae"	"cercocarpus"	"betuloides"	"betuloides"	"cercocarpus betuloides var. betuloides  nutt."
"b90a58ce-978c-4369-b73c-5a56e765a4cf"	"ds"	"ds244484"	"chevy chase drive, between glendale & flintridge"	34.1696	-118.2034	"united states"	"california"	"los angeles"	NA	2500	"rosaceae"	"cercocarpus"	"betuloides"	NA	"cercocarpus betuloides"
"b92c0d2a-eed4-461e-b33b-b709731396dc"	"ds"	"ds38513"	"lime kiln [ca&ntilde;on] canyon, region of [tehachpi] tehachapi peak"	35.0911	-118.4835	"united states"	"california"	"kern"	NA	2000	"rosaceae"	"cercocarpus"	"betuloides"	"betuloides"	"cercocarpus betuloides var. betuloides"
"b98d378e-0a59-4431-8f00-5c16c1ded974"	"rsa"	"rsa49539"	"grown at rsabg under propagation number 184 (material for this number originally by by b.d. stark from claymine canyon)."	33.8726	-117.7073	"united states"	"california"	"orange"	NA	1650	"rosaceae"	"cercocarpus"	"betuloides"	NA	"cercocarpus betuloides"
"b98e6cff-d5d8-4c04-aa57-82683f2709d7"	"uc"	"uc1127825"	"1 1/4 mi nw of junction rattlesnake and deer creek (lassen national forest); lassen national forest"	40.2082812514104	-121.527986909284	"united states"	"california"	"tehama"	NA	825	"rosaceae"	"cercocarpus"	"betuloides"	"betuloides"	"cercocarpus betuloides var. betuloides"
"b999bce8-ae12-44c4-8766-be58d6a4cc0b"	"sbbg"	"sbbg97817"	"santa cruz island: upper canada christi drainage, in side branch of the w fork of embudo cyn, s of embudo water trough"	34.013	-119.8116	"united states"	"california"	"santa barbara"	NA	1000	"rosaceae"	"cercocarpus"	"betuloides"	"blancheae"	"cercocarpus betuloides var. blancheae"
"b9ac5119-7ca5-48f2-a03a-ef2f0cafbcdb"	"sbbg"	"sbbg19248"	"near cedar crk cmpgrd, ca. 10 mi e of glennville"	35.7479514858691	-118.583521074716	"united states"	"california"	"kern"	NA	1000	"rosaceae"	"cercocarpus"	"betuloides"	"betuloides"	"cercocarpus betuloides var. betuloides"
"b9b0dfd9-670f-439e-86a7-201312306a07"	"rsa"	"rsa1787"	"near pipe creek, above hemet valley, san jacinto mountains"	33.6380555555556	-116.581944444444	"united states"	"california"	"riverside"	NA	NA	"rosaceae"	"cercocarpus"	"betuloides"	NA	"cercocarpus betuloides"
"b9d90491-fef4-4ac2-b69a-b0d90df75cd8"	"ds"	"ds339782"	"4 mi. from oak knoll ranger station on klamath river, on road to dry lake lookout - siskiyou mts."	41.9096746966986	-122.916370359974	"united states"	"california"	"siskiyou"	NA	5141	"rosaceae"	"cercocarpus"	"betuloides"	"betuloides"	"cercocarpus betuloides var. betuloides"
"b9ef80e5-15d6-4fb8-ae7b-92872f2aa408"	"sdsu"	"sdsu8980"	"otay mtn. truck trail."	32.59478	-116.84394	"united states"	"california"	"san diego"	NA	6600	"rosaceae"	"cercocarpus"	"betuloides"	NA	"cercocarpus betuloides"
"b9f1a3c1-0ce6-4a27-a468-89c657ee1b00"	"cas"	"cas73661"	"hills west of willows"	39.5935	-122.5161	"united states"	"california"	"glenn"	NA	147	"rosaceae"	"cercocarpus"	"betuloides"	"betuloides"	"cercocarpus betuloides var. betuloides"
"b9f5a9c6-9330-4139-ba56-35bd8865047c"	"cas"	"cas536841"	"by side of the old dirt road going up chualar canyon"	36.6043	-121.4039	"united states"	"california"	"monterey"	NA	7700	"rosaceae"	"cercocarpus"	"betuloides"	"betuloides"	"cercocarpus betuloides var. betuloides"
"ba0b4f51-c7af-4169-bc68-d6458888451e"	"sd"	"sd191391"	"cleveland national forest, cuyamaca mountains, 1 mi w of north peak, s of cosmit indian reservation, e of engineers road, near grandview road"	33.0159	-116.6113	"united states"	"california"	"san diego"	NA	NA	"rosaceae"	"cercocarpus"	"betuloides"	"betuloides"	"cercocarpus betuloides var. betuloides"
"ba17c804-e9a5-474e-9bc6-117cd52a84a0"	"rsa"	"rsa1012"	"15 miles e of burney."	40.8648	-121.3912	"united states"	"california"	"shasta"	NA	6543	"rosaceae"	"cercocarpus"	"betuloides"	NA	"cercocarpus betuloides"
"ba3d3240-418d-43ed-b0d8-64db35c45879"	"sd"	"sd188189"	"granite mountain wilderness. near pacific coast trail, ca. 3 miles east of junction of trail with rodriguez canyon road, ca. 1.3 miles northwest of 5633 ft. peak."	33.06389	-116.49556	"united states"	"california"	"san diego"	NA	NA	"rosaceae"	"cercocarpus"	"betuloides"	"betuloides"	"cercocarpus betuloides var. betuloides"
"ba4a2d9b-765f-4af0-aba9-a802beb963f1"	"uc"	"uc1127911"	"1/2 mi e of copernicus peak"	37.3395386544234	-121.614256161949	"united states"	"california"	"santa clara"	NA	825	"rosaceae"	"cercocarpus"	"betuloides"	"betuloides"	"cercocarpus betuloides var. betuloides"
"ba7956a8-e697-4230-8be7-78ec6ac9eaa3"	"ds"	"ds38518"	"tamalpais"	37.925367	-122.575887	"united states"	"california"	"marin"	NA	2500	"rosaceae"	"cercocarpus"	"betuloides"	"betuloides"	"cercocarpus betuloides var. betuloides"
"ba903096-bfd5-4343-a04e-9366565bc538"	"rsa"	"rsa41993"	"5 miles sw of minersville-weanerville road near summit, trinity county"	40.8098	-122.8663	"united states"	"california"	"trinity"	NA	4418	"rosaceae"	"cercocarpus"	"betuloides"	NA	"cercocarpus betuloides"
"baa03c43-a312-4a6b-ac84-afd8216330e6"	"uc"	"uc212357"	"san bernardino mountains, canyon diablo canyon diablo; san bernardino mountains, canyon diablo"	34.2408	-117.3381	"united states"	"california"	"san bernardino"	NA	5000	"rosaceae"	"cercocarpus"	"betuloides"	"betuloides"	"cercocarpus betuloides var. betuloides"
"baa79ccd-9416-4cd4-abf9-4712add4060c"	"rsa"	"rsa660285"	"vicinity of sierra peak. (historical locality). on old roadcut heading down to power lines at 2280\'."	33.8499	-117.654	"united states"	"california"	"orange"	NA	1000	"rosaceae"	"cercocarpus"	"betuloides"	NA	"cercocarpus betuloides"
"bab23e34-8e26-4f18-860a-ba5a014ef536"	"rsa"	"rsa787496"	"northern santa ana mountains: sierra peak"	33.8499	-117.654	"united states"	"california"	"orange"	NA	1000	"rosaceae"	"cercocarpus"	"betuloides"	"betuloides"	"cercocarpus betuloides var. betuloides"
"bad9110d-d3c6-4ef8-9fc6-1e58ec21a680"	"rsa"	"rsa599806"	"liebre mountains region: upper end of broad alluvial valley at head of cienaga canyon, southern base of liebre mountain, at end of dirt road leading 1 km northeast of knapp ranch."	34.6963888888889	-118.659444444444	"united states"	"california"	"los angeles"	NA	NA	"rosaceae"	"cercocarpus"	"betuloides"	"betuloides"	"cercocarpus betuloides var. betuloides"
"baf1c225-51ed-4e70-a797-e91c9dfb397b"	"cas"	"73581"	"ukiah"	39.144680071231	-123.206713322447	"united states"	"california"	"mendocino county"	NA	NA	"rosaceae"	"cercocarpus"	"betuloides"	"betuloides"	"cercocarpus betuloides var. betuloides  nutt."
"bb1ea71b-d50e-45da-a51b-10e1603fe806"	"cas"	"38518"	"tamalpais"	37.925367	-122.575887	"united states"	"california"	"marin county"	NA	NA	"rosaceae"	"cercocarpus"	"betuloides"	"betuloides"	"cercocarpus betuloides var. betuloides  nutt."
"bb3bb866-9106-4fe6-a8b0-8d507b214683"	"cas"	"cas73586"	"san antonio canyon near claremont"	34.1979	-117.6753	"united states"	"california"	"los angeles"	NA	4600	"rosaceae"	"cercocarpus"	"betuloides"	NA	"cercocarpus betuloides"
"bb3cd05e-01a8-4030-ab02-6b58d28b49c9"	"rsa"	"rsa714692"	"around large sandstone monolith (visible for miles) along private crest road, nw of head of sulphur canyon."	34.35	-118.6275	"united states"	"california"	"los angeles"	NA	NA	"rosaceae"	"cercocarpus"	"betuloides"	NA	"cercocarpus betuloides"
"bb40fa1d-9459-4f37-9fce-130257cc8f77"	"sbbg"	"sbbg95411"	"santa catalina island: grand cyn"	33.3445	-118.3652	"united states"	"california"	"los angeles"	NA	1433	"rosaceae"	"cercocarpus"	"betuloides"	"blancheae"	"cercocarpus betuloides var. blancheae"
"bb43353e-ffc0-4fda-9bed-cedc559a75a2"	"rsa"	"rsa156045"	"main divide truck trail at saddle about 1 mile north of santiago peak."	33.7200191798241	-117.530879706476	"united states"	"california"	"orange"	NA	2805	"rosaceae"	"cercocarpus"	"betuloides"	NA	"cercocarpus betuloides"
"bb930fb4-d17e-4515-90d7-7ffd8ad2fa8f"	"la"	"la47743"	"peak of figueroa mt"	34.7438	-119.985	"united states"	"california"	"santa barbara"	NA	1900	"rosaceae"	"cercocarpus"	"betuloides"	NA	"cercocarpus betuloides"
"bbbec760-03ca-4cdc-aaa9-bbe727c1ccee"	"la"	"la47768"	"san gabriel mountains, santa anita canyon, along trail sturdevant"	34.2079	-118.0175	"united states"	"california"	"los angeles"	NA	4500	"rosaceae"	"cercocarpus"	"betuloides"	"multiflorus"	"cercocarpus betuloides var. multiflorus"
"bbd368fc-ae2f-430d-bebb-c24fd7d87862"	"ucr"	"ucr136936"	"western transverse range; santa monica mtns. mulholland drive northwest of hollywood"	34.125	-118.38333	"united states"	"california"	"los angeles"	NA	NA	"rosaceae"	"cercocarpus"	"betuloides"	NA	"cercocarpus betuloides"
"bbf0a12d-fe72-45c0-9f54-591804377f56"	"chsc"	"chsc37621"	"along hwy 32, ca. 1/2 mi below t. v. cable antenna, ca. 11 mi n of chico"	39.8327777777778	-121.705555555556	"united states"	"california"	"butte"	NA	1650	"rosaceae"	"cercocarpus"	"betuloides"	"betuloides"	"cercocarpus betuloides var. betuloides"
"bc5632ab-9105-4e3d-9d17-b8f93967a49e"	"sbbg"	"sbbg38720"	"santa cruz island: pelican bay"	34.032	-119.702	"united states"	"california"	"santa barbara"	NA	2000	"rosaceae"	"cercocarpus"	"betuloides"	"blancheae"	"cercocarpus betuloides var. blancheae"
"bc8c83ec-d432-43d0-926b-d2ba98f3a5d4"	"cas"	"cas539646"	"foot of purdy ridge south of purdy canyon, tejon ranch"	34.9334	-118.6739	"united states"	"california"	"kern"	NA	3000	"rosaceae"	"cercocarpus"	"betuloides"	"betuloides"	"cercocarpus betuloides var. betuloides"
"bcc7fdcb-d52c-4e23-baec-3f8956127bab"	"ds"	"ds205146"	"reyes mt."	34.635	-119.2999	"united states"	"california"	"ventura"	NA	2500	"rosaceae"	"cercocarpus"	"betuloides"	NA	"cercocarpus betuloides"
"bceb4cd4-d6f8-4588-a0ea-5b6b4fcff074"	"ds"	"ds38544"	"santa ana mountains, near elsinore"	33.6814	-117.3608	"united states"	"california"	"riverside"	NA	4000	"rosaceae"	"cercocarpus"	"betuloides"	"betuloides"	"cercocarpus betuloides var. betuloides"
"bcf22af9-6763-4a07-97f4-e5b38b0cd8bd"	"sd"	"sd64089"	"idyllwild, san jacinto river"	33.7372	-116.7184	"united states"	"california"	"san bernardino"	NA	2568	"rosaceae"	"cercocarpus"	"betuloides"	NA	"cercocarpus betuloides"
"bd123d95-93a8-4f5f-8a50-97bc102bac5c"	"ucr"	"ucr35158"	"san jacinto mtns s side of thomas mtn"	33.60972	-116.66889	"united states"	"california"	"riverside"	NA	10000	"rosaceae"	"cercocarpus"	"betuloides"	NA	"cercocarpus betuloides"
"bd1ba229-4ca5-4293-9640-6ea8d2260168"	"rsa"	"rsa771606"	"sulphur springs campground, south fork of little rock creek"	34.3672222222222	-117.9875	"united states"	"california"	"los angeles"	NA	NA	"rosaceae"	"cercocarpus"	"betuloides"	NA	"cercocarpus betuloides"
"bd76eb6c-cc4b-453d-8bb3-3e9af7c99077"	"sd"	"sd214543"	"north of julian. volcan mountain open space preserve. 820 meters east north east of the intersection of farmer and wynola road"	33.1066	-116.5947	"united states"	"california"	"san diego"	NA	NA	"rosaceae"	"cercocarpus"	"betuloides"	"betuloides"	"cercocarpus betuloides var. betuloides"
"bd77bdfc-725a-40c5-8ecc-4022ece6b17d"	"ym-yose"	"ym-yose64343"	"wawona"	37.5381	-119.6563	"united states"	"california"	"mariposa"	NA	3000	"rosaceae"	"cercocarpus"	"betuloides"	NA	"cercocarpus betuloides"
"bd88f731-255b-4f0c-86bb-10df0932a71e"	"uc"	"uc859430"	"2 8/10 mi below camp nelson (upper tule river); sierra nevada, upper tule river"	36.1411863294409	-118.64177332209	"united states"	"california"	"tulare"	NA	2653	"rosaceae"	"cercocarpus"	"betuloides"	"betuloides"	"cercocarpus betuloides var. betuloides"
"bdaffeab-a169-4a79-a195-cb0f6d29f43c"	"uc"	"uc1127924"	"1/2 mi s of silver mountain (mono national forest); mono national forest"	38.5567928733702	-119.759875552962	"united states"	"california"	"alpine"	NA	206	"rosaceae"	"cercocarpus"	"betuloides"	"betuloides"	"cercocarpus betuloides var. betuloides"
"bde91bc8-6359-485c-90c7-9d266044e85d"	"cas"	"cas73585"	"san rafael"	37.977041	-122.544129	"united states"	"california"	"marin"	NA	4900	"rosaceae"	"cercocarpus"	"betuloides"	"betuloides"	"cercocarpus betuloides var. betuloides"
"bdfe1d22-4ec1-4537-b2fa-9204650e28d5"	"ds"	"ds172192"	"la cumbre trail"	34.488	-119.7103	"united states"	"california"	"santa barbara"	NA	1500	"rosaceae"	"cercocarpus"	"betuloides"	NA	"cercocarpus betuloides"
"be005357-b345-4bd3-8fc2-9493dbaea709"	"cas"	"cas278348"	"7 miles from minersville, on road to weaverville"	40.848	-122.8326	"united states"	"california"	"trinity"	NA	326	"rosaceae"	"cercocarpus"	"betuloides"	"betuloides"	"cercocarpus betuloides var. betuloides"
"be1a343b-1360-4008-99a7-32d39c873e3b"	"pom"	"pom209899"	"san gabriel mountains: south fork big rock creek"	34.398	-117.8239	"united states"	"california"	"los angeles"	NA	2000	"rosaceae"	"cercocarpus"	"betuloides"	"betuloides"	"cercocarpus betuloides var. betuloides"
"be258978-c133-4640-95f8-f44613fe36fd"	"ds"	"ds125310"	"loma alta, santa barbara"	34.4032	-119.6977	"united states"	"california"	"santa barbara"	NA	330	"rosaceae"	"cercocarpus"	"betuloides"	NA	"cercocarpus betuloides"
"be2f27c6-d70d-4cd5-85fe-95f593c7a4e3"	"sbbg"	"sbbg35329"	"santa cruz island: bottom of pk 1848, little valdez cyn (e-most cyn draining into valdez harbor)"	34.038	-119.816	"united states"	"california"	"santa barbara"	NA	1500	"rosaceae"	"cercocarpus"	"betuloides"	"blancheae"	"cercocarpus betuloides var. blancheae"
"be38d50d-d67e-4954-a9c7-86784e114628"	"uc"	"uc1127867"	"rush creek, modoc national forest rush creek; modoc national forest, rush creek"	41.2957912280593	-120.876397046381	"united states"	"california"	"modoc"	NA	850	"rosaceae"	"cercocarpus"	"betuloides"	"macrourus"	"cercocarpus betuloides var. macrourus"
"be7eb033-a287-402a-a418-418c198c0fdb"	"uc"	"uc859440"	"mount st. helena"	38.6685	-122.6302	"united states"	"california"	"napa"	NA	3400	"rosaceae"	"cercocarpus"	"betuloides"	"betuloides"	"cercocarpus betuloides var. betuloides"
"be861859-0c15-42ca-8cca-968c9b73caaa"	"cas"	"cas73609"	"near upland"	34.0969	-117.6879	"united states"	"california"	"san bernardino"	NA	2000	"rosaceae"	"cercocarpus"	"betuloides"	"betuloides"	"cercocarpus betuloides var. betuloides"
"be87dee8-7fda-4a62-b913-2ba3cdadeb15"	"sbbg"	"sbbg24303"	"hwy 33, near cherry crk rd jct"	34.6054873047434	-119.356650536922	"united states"	"california"	"ventura"	NA	1000	"rosaceae"	"cercocarpus"	"betuloides"	"betuloides"	"cercocarpus betuloides var. betuloides"
"beb0b9b8-7a54-4b34-8a33-5588e50d015b"	"ucd"	"ucd22491"	"santa monica mountains. on decker rd., 1 mile north of junction of mulholland hwy. and decker rd"	34.1051064494904	-118.858226689351	"united states"	"california"	"los angeles"	NA	3258	"rosaceae"	"cercocarpus"	"betuloides"	"blancheae"	"cercocarpus betuloides var. blancheae"
"beb77747-6c10-4fec-a2d6-d999a0d3ce72"	"uc"	"uc1127846"	"santa barbara national forest, juncal dam juncal dam; santa barbara national forest, juncal dam"	34.4896926890261	-119.505157333903	"united states"	"california"	"santa barbara"	NA	825	"rosaceae"	"cercocarpus"	"betuloides"	"betuloides"	"cercocarpus betuloides var. betuloides"
"bec40866-6104-4fe0-a09b-11ce26d939c4"	"la"	"la47775"	"angelus crest hwy. near hidden springs"	34.3179	-118.1318	"united states"	"california"	"los angeles"	NA	300	"rosaceae"	"cercocarpus"	"betuloides"	"multiflorus"	"cercocarpus betuloides var. multiflorus"
"bec6b617-7993-4375-97fc-66d69071c048"	"sjsu"	"sjsu438"	"summit dr, santa catalina island"	33.3542	-118.3509	"united states"	"california"	"los angeles"	NA	109	"rosaceae"	"cercocarpus"	"betuloides"	"blancheae"	"cercocarpus betuloides var. blancheae"
