"a48f3a56-a122-4510-bc41-1bd00b47cee0"	"des"	"des00061677"	"paria canyon, transect rf t10/fr 11, upstream from wrather canyon, 430735 e, 4092929 n, nad 83."	36.979931	-111.778257	"united states"	"arizona"	"coconino county"	NA	500	"solanaceae"	"lycium"	"pallidum"	NA	"lycium pallidum"
"a577d98f-8e65-443b-8627-c15063a3880e"	"hsc"	"hsc21259"	"w side of daylight pass, death valley national monument, 10 mi. from hwy. 190"	36.7499	-116.9376	"united states"	"california"	"inyo"	NA	300	"solanaceae"	"lycium"	"pallidum"	"oligospermum"	"lycium pallidum var. oligospermum"
"a5931aa9-b691-4b98-afa2-e7d086990d85"	"la"	"la209692"	"calico mountains, between barstow and pickhandle pass"	34.9937	-116.9728	"united states"	"california"	"san bernardino"	NA	8000	"solanaceae"	"lycium"	"pallidum"	"oligospermum"	"lycium pallidum var. oligospermum"
"a598665b-2f72-41a5-9ac4-3ab62829790c"	"asc"	"66372"	"ne foothills santa rita mountains, rosemont canyon."	31.8241	-110.737333	"united states"	"arizona"	"pima county"	NA	NA	"solanaceae"	"lycium"	"pallidum"	NA	"lycium pallidum"
"a61a1905-8b7c-4801-b237-87a8e94eedb2"	"asu"	"287722"	"in verde river canyon near headwaters before perennial flows begin; 0.64 mi west of confluence with granite creek; 2miles south of paulden."	34.864868	-112.442734	"united states"	"arizona"	"yavapai county"	NA	NA	"solanaceae"	"lycium"	"pallidum"	NA	"lycium pallidum"
"a6f69368-35b2-4f25-bb55-9f7ad2b1144f"	"asc"	"66917"	"ne prescott, 3.9 km due n of badger mountain, s of granite dells, just s of watson lake, e side granite creek, at kiosk."	34.57418	-112.42818	"united states"	"arizona"	"yavapai county"	NA	NA	"solanaceae"	"lycium"	"pallidum"	"pallidum"	"lycium pallidum var. pallidum"
"a744443f-8df6-433a-808d-125e22b16425"	"asc"	"63347"	"tsegi canyon, 10 mi sw kayenta"	36.68466	-110.5187	"united states"	"arizona"	"navajo county"	NA	NA	"solanaceae"	"lycium"	"pallidum"	NA	"lycium pallidum"
"a753f542-90e0-48f4-8acd-ba4706774f02"	"uvsc"	"4207"	"shivwits reservation road, about 2 miles n of boundry."	37.150003	-113.01667	"united states"	"utah"	"washington"	NA	1800	"solanaceae"	"lycium"	"pallidum"	NA	"lycium pallidum"
"a7ac2527-d50a-4b72-9df9-93ca28c86791"	"asc"	"1839"	"oak creek canyon; above jordan's at flume."	34.912377	-111.726886	"united states"	"arizona"	"coconino county"	NA	NA	"solanaceae"	"lycium"	"pallidum"	"pallidum"	"lycium pallidum var. pallidum"
"a7ee343c-a0b9-45d9-85c5-437df908da84"	"chsc"	"chsc35871"	"ca. 15 air mi. nw of barstow along powerline rd. near water valley in mojave desert"	35.07	-117.180277777778	"united states"	"california"	"san bernardino"	NA	4950	"solanaceae"	"lycium"	"pallidum"	"oligospermum"	"lycium pallidum var. oligospermum"
"a82be464-4b6c-4b64-b810-0509d3b7aefc"	"asu"	NA	"grand canyon area; 0.5 miles below mooney falls"	36.2555	-112.707	"united states"	"arizona"	"coconino county"	NA	NA	"solanaceae"	"lycium"	"pallidum"	NA	"lycium pallidum"
"a8532851-bfb7-4a4b-a398-80a5cc807e2b"	"rsa"	"rsa278367"	"ca 6 air miles nne of barstow, ca 0.1 mile w of fort irwin road along fossil bed road."	34.9847	-117.0003	"united states"	"california"	"san bernardino"	NA	700	"solanaceae"	"lycium"	"pallidum"	"oligospermum"	"lycium pallidum var. oligospermum"
"a8f4d250-c141-455d-86a4-cb2c5d2d1447"	"ds"	"ds589652"	"about 10 miles north and east of trona, mojave desert"	35.8833333333	-117.3333333333	"united states"	"california"	"inyo"	NA	NA	"solanaceae"	"lycium"	"pallidum"	"oligospermum"	"lycium pallidum var. oligospermum"
"aada2785-4589-44bb-ba8c-93f223d7f0bb"	"ucr"	"ucr4610"	"northern mojave desert 51 mi south of stove pipe wells, near ballarat, panamint valley"	36.0475	-117.28167	"united states"	"california"	"inyo"	NA	10000	"solanaceae"	"lycium"	"pallidum"	NA	"lycium pallidum"
"ac46427f-4613-47e2-aacb-f79ea22a9a03"	"asc"	"58118"	"montezuma castle national monument, 400-500m ne of nw boundary fence corner"	34.61667	-111.83333	"united states"	"arizona"	"yavapai county"	NA	NA	"solanaceae"	"lycium"	"pallidum"	NA	"lycium pallidum"
"ac601c7a-d6af-4418-9686-7ba23216f140"	"rsa"	"rsa668192"	"9km n of hinkley on hinkley road."	35.0333333333333	-117.183333333333	"united states"	"california"	"san bernardino"	NA	NA	"solanaceae"	"lycium"	"pallidum"	"oligospermum"	"lycium pallidum var. oligospermum"
"aeaa4c53-d039-464d-8332-4b8badd9b254"	"dbg"	"khd00036723"	"mesa verde national park"	37.231391	-108.478523	"united states"	"colorado"	"montezuma county"	NA	10000	"solanaceae"	"lycium"	"pallidum"	NA	"lycium pallidum"
"af7b33e9-7127-448b-b34e-31ad84d44996"	"des"	"des00041570"	"northeastern foothills of santa rita mountains, rosemont canyon."	31.8241	-110.737333	"united states"	"arizona"	"pima"	NA	NA	"solanaceae"	"lycium"	"pallidum"	NA	"lycium pallidum"
"afc1f6ce-227e-4d8e-ba4a-d182391e94bb"	"rsa"	"rsa743881"	"northeast of barstow, just south of irwin road along dirt powerline road, bajada just west of mitchell range."	34.9383143309084	-117.025040482754	"united states"	"california"	"san bernardino"	NA	NA	"solanaceae"	"lycium"	"pallidum"	"oligospermum"	"lycium pallidum var. oligospermum"
"b0b9f122-d0e0-49ab-8189-47fab972f994"	"ny"	"1260071"	"one mile east of cottonwood, along rocking chair road"	34.7378	-111.9958	"united states"	"arizona"	"yavapai co."	NA	NA	"solanaceae"	"lycium"	"pallidum"	NA	"lycium pallidum miers"
"b1c61a59-c3a0-4ee2-9024-717cf9d60be1"	"pom"	"pom184076"	"4 miles north of trona, mohave desert."	35.8245	-117.355	"united states"	"california"	"san bernardino"	NA	2000	"solanaceae"	"lycium"	"pallidum"	"oligospermum"	"lycium pallidum var. oligospermum"
"b384b9b1-dbf4-4599-970f-5814dd4c6b9a"	"asc"	"87503"	"el morro national monument, along the east side of the south boundary"	35.0302473310596	-108.331534306242	"united states"	"new mexico"	"cibola"	NA	NA	"solanaceae"	"lycium"	"pallidum"	NA	"lycium pallidum"
"b415f10f-4a9c-42f3-94a9-2eeb5e884fc8"	"jeps"	"jeps23024"	"along rd. from trona to wildrose canyon (along grade over the slate range, at w. end panamint valley); slate range, panamint valley"	35.9602	-117.3351	"united states"	"california"	"inyo"	NA	1000	"solanaceae"	"lycium"	"pallidum"	"oligospermum"	"lycium pallidum var. oligospermum"
"b633d68b-4cdc-4e21-a0f0-001dfd9e7a8d"	"sd"	"sd42445"	"mojave desert, mesa, 3 mi. ne of barstow on us highway #91 to yermo"	34.9064	-116.9779	"united states"	"california"	"san bernardino"	NA	800	"solanaceae"	"lycium"	"pallidum"	"oligospermum"	"lycium pallidum var. oligospermum"
"b73ad3d8-5857-4889-b957-b46957758d9d"	"asc"	NA	"nw of flagstaff off highway 180, red mountain geologic area"	35.53333	-111.86667	"united states"	"arizona"	"coconino county"	NA	NA	"solanaceae"	"lycium"	"pallidum"	NA	"lycium pallidum"
"b7c08623-f7a7-46d4-837b-3e82a922f702"	"des"	"des00059308"	"wet beaver creek wilderness area, ca 1/2 mile east of parking area on north side of wet beaver creek."	34.67815	-111.698583	"united states"	"arizona"	"yavapai"	NA	NA	"solanaceae"	"lycium"	"pallidum"	NA	"lycium pallidum"
"b8fb0f84-9719-49f3-b4a1-74aa7eac7da4"	"utc"	"utc00189907"	".5 miles n of route 163 on road up comb wash (which leaves route 163 about 8.2 miles w of bluff)."	37.2163906	-109.7053995	"united states"	"utah"	"san juan"	NA	NA	"solanaceae"	"lycium"	"pallidum"	NA	"lycium pallidum"
"b94f818c-b2c5-412e-9712-8b8aece89903"	"asu"	NA	"paymaster tank; san carlos indian reservaiton"	33.3833	-110.1	"united states"	"arizona"	"graham county"	NA	NA	"solanaceae"	"lycium"	"pallidum"	NA	"lycium pallidum"
"b995763a-1918-4171-8469-73e5f0b2ea16"	"chsc"	"chsc1920"	"daggett in mohave desert"	34.8627777777778	-116.884722222222	"united states"	"california"	"san bernardino"	NA	1650	"solanaceae"	"lycium"	"pallidum"	"oligospermum"	"lycium pallidum var. oligospermum"
"bc00ec5b-d288-4f33-840c-c93377dccc9c"	"ucr"	"ucr226656"	"mojave desert calico mountains, on west side of range, 5.5 miles north of hwy i-15 (yermo), 0.9 miles east of fort irwin road at its junction with strachan road"	34.97842	-116.91065	"united states"	"california"	"san bernardino"	NA	1000	"solanaceae"	"lycium"	"pallidum"	"oligospermum"	"lycium pallidum var. oligospermum"
"bc62b7b0-8268-4440-8166-fd2647ad624e"	"ds"	"ds286985"	"near summit of grade between barstow and yermo on u.s. highway #91. mojave desert"	34.9064	-116.9564	"united states"	"california"	"san bernardino"	NA	800	"solanaceae"	"lycium"	"pallidum"	"oligospermum"	"lycium pallidum var. oligospermum"
"bd9436e1-2b05-495a-aa02-2096f8e543ec"	"asu"	NA	"globe,  near edge south of town"	33.3541	-110.8	"united states"	"arizona"	"gila county"	NA	NA	"solanaceae"	"lycium"	"pallidum"	NA	"lycium pallidum"
"bdf15700-7f7a-49f4-9e69-ca121e4bcfb5"	"asu"	NA	"outskirts of globe, az"	33.3942	-110.786	"united states"	"arizona"	"gila county"	NA	NA	"solanaceae"	"lycium"	"pallidum"	"pallidum"	"lycium pallidum var. pallidum"
"be3cd35e-305b-4f08-9a05-0508c0069f4b"	"des"	"des00057519"	"freeman road trailhead."	32.871233	-110.88325	"united states"	"arizona"	"pinal county"	NA	NA	"solanaceae"	"lycium"	"pallidum"	NA	"lycium pallidum"
"beb01700-f96c-430e-a758-44884232a66d"	"jeps"	"jeps12201"	"barstow mohave desert"	34.897	-117.0228	"united states"	"california"	"san bernardino"	NA	3500	"solanaceae"	"lycium"	"pallidum"	"oligospermum"	"lycium pallidum var. oligospermum"
"beed69f1-6a95-4fb8-ac8e-42b1e93193a1"	"cas"	"cas232111"	"road from darwin to death valley, panamint mt. grade"	36.3982	-117.2801	"united states"	"california"	"inyo"	NA	8500	"solanaceae"	"lycium"	"pallidum"	NA	"lycium pallidum"
"bf70caa3-c74e-407a-bcec-cefb33620473"	"utc"	"utc00184825"	"owl creek canyon, nevill's arch."	37.4541667	-109.7747222	"united states"	"utah"	"san juan"	NA	NA	"solanaceae"	"lycium"	"pallidum"	NA	"lycium pallidum"
"c0a74b43-ae62-480c-8be6-c376ec8e52b0"	"asu"	NA	"16 miles east of fredonia"	36.9452	-112.236	"united states"	"arizona"	"coconino county"	NA	NA	"solanaceae"	"lycium"	"pallidum"	NA	"lycium pallidum"
"c13443a6-471a-4cc1-84bd-d85b3b6d220c"	"jeps"	"jeps12413"	"ne of barstow (in the calico wash); mohave desert, calico wash"	34.9496	-116.9256	"united states"	"california"	"san bernardino"	NA	5000	"solanaceae"	"lycium"	"pallidum"	"oligospermum"	"lycium pallidum var. oligospermum"
"c149ccc1-5f1a-4da9-929e-dbab931f989f"	"asc"	"84803"	"vicinity of red mountain trailhead.  ca. 0.3 mi. w of hwy 180 and ca. 0.25 mi. ne of the lower flanks of red mountain."	35.53729	-111.85783	"united states"	"arizona"	"coconino county"	NA	NA	"solanaceae"	"lycium"	"pallidum"	NA	"lycium pallidum"
"c2b28673-9d78-4d9c-b840-e28f8b09b8a7"	"jeps"	"jeps12191"	"mohave desert, barstow barstow; mohave desert, barstow"	34.897	-117.0228	"united states"	"california"	"san bernardino"	NA	3500	"solanaceae"	"lycium"	"pallidum"	"oligospermum"	"lycium pallidum var. oligospermum"
"c3637535-8bef-48b8-8af3-9d5585bf7cce"	"asu"	NA	"ca. 40 miles (by air) south of kingman, t15 n, r15w, section 9 (sw 1/4 of nw1/4)"	35.1894	-114.052	"united states"	"arizona"	"mohave county"	NA	NA	"solanaceae"	"lycium"	"pallidum"	NA	"lycium pallidum"
"c41670e9-4556-4b43-9a11-92c87e0440fb"	"jeps"	"jeps12196"	"barstow mohave desert"	34.897	-117.0228	"united states"	"california"	"san bernardino"	NA	3500	"solanaceae"	"lycium"	"pallidum"	"oligospermum"	"lycium pallidum var. oligospermum"
"c5b351ca-0eb7-4a43-b4b6-42426869c2b7"	"cas"	"cas349260"	"emigrant canyon, w miles n. of emigrant spring, death valley nat\'l monument, panamint mts."	36.4567	-117.2066	"united states"	"california"	"inyo"	NA	500	"solanaceae"	"lycium"	"pallidum"	"oligospermum"	"lycium pallidum var. oligospermum"
"c6ea46c5-e28e-4c07-9c3f-ab32f7c8cc81"	"ds"	"ds79174"	"barstow"	34.897	-117.0228	"united states"	"california"	"san bernardino"	NA	3500	"solanaceae"	"lycium"	"pallidum"	NA	"lycium pallidum"
"c70836cc-64a9-4c0d-ad75-962baa88c8b6"	"des"	"67192"	"vermilion cliffs, attwo mile south spring, 12s 405744 e, 4075362 n nad 83/84."	36.819426	-112.05683	"united states"	"arizona"	"coconino county"	NA	NA	"solanaceae"	"lycium"	"pallidum"	NA	"lycium pallidum"
"c840bad7-7826-47cf-8037-8cd97c95a1e0"	"asu"	NA	"whetstone mountains; 10.5 miles south of interstate 10 on az highway 90; then 1.9 miles west on french joe canyon road (jeep trail); e-most hill south of road"	31.8102	-110.377	"united states"	"arizona"	"cochise county"	NA	700	"solanaceae"	"lycium"	"pallidum"	NA	"lycium pallidum"
"c88f71d6-6fe6-48ba-bc42-a02510860bc0"	"rsa"	"rsa24232"	"n side of mojave river 1.5 mi. from daggett on rd. yermo."	34.8833	-116.887	"united states"	"california"	"san bernardino"	NA	200	"solanaceae"	"lycium"	"pallidum"	"oligospermum"	"lycium pallidum var. oligospermum"
"c8c98452-0736-4393-9751-7e7b2fd5eccf"	"rsa"	"rsa699022"	"dos palmas"	33.4967	-115.8505	"united states"	"california"	"riverside"	NA	NA	"solanaceae"	"lycium"	"pallidum"	"oligospermum"	"lycium pallidum var. oligospermum"
"cab5c167-b994-4d5f-94ba-022779ebe2b5"	"ucr"	"ucr89408"	"mojave desert western mojave desert, c. 5 miles west of barstow on hwy 58"	34.91667	-117.16667	"united states"	"california"	"san bernardino"	NA	NA	"solanaceae"	"lycium"	"pallidum"	"oligospermum"	"lycium pallidum var. oligospermum"
"cbd57849-9d29-41b3-9a78-9353c06c1bb6"	"asu"	NA	"near big bug creek; 0.5 miles south of mayer"	34.4003	-112.235	"united states"	"arizona"	"yavapai county"	NA	NA	"solanaceae"	"lycium"	"pallidum"	"pallidum"	"lycium pallidum var. pallidum"
"cde7b680-3502-4966-85e7-f49f281ef0e0"	"cas"	"cas1128718"	"northeastern mojave desert: pahrump valley, east of the nopah range at calvada springs, charleston view rd. (silver st.), 1.1 mi. south of state line rd. elev. given as 2600 ft."	35.9889833333	-115.89995	"united states"	"california"	"inyo"	NA	NA	"solanaceae"	"lycium"	"pallidum"	NA	"lycium pallidum"
"ce673c73-2755-4a57-83e1-10d5b8a82f59"	"utc"	"utc00237930"	"chiricahua mountains; portal road 0.1 mi se of portal."	31.9138889	-109.1	"united states"	"arizona"	"cochise"	NA	NA	"solanaceae"	"lycium"	"pallidum"	NA	"lycium pallidum"
"cf4e3026-e858-44c0-b4d2-89c4fe21e39a"	"rsa"	"rsa387847b"	"inyo mountains. low hills just e of n end of saline valley rd, 2.9 mi n85&deg;e of bunker hill mine, saline valley drainage."	36.9302777777778	-117.896666666667	"united states"	"california"	"inyo"	NA	NA	"solanaceae"	"lycium"	"pallidum"	"oligospermum"	"lycium pallidum var. oligospermum"
"cf8c14cd-acdd-44da-a49c-4f82e09806d0"	"asc"	"46776"	"15 mi s of rocky springs"	33.74	-111.484	"united states"	"arizona"	"maricopa county"	NA	NA	"solanaceae"	"lycium"	"pallidum"	NA	"lycium pallidum"
"d0b7d1f6-d6ae-4982-bb6c-a9a9587cd27d"	"asu"	NA	"chiricahua national monument; northwest corner of cnm"	32.0044	-109.356	"united states"	"arizona"	"cochise county"	NA	NA	"solanaceae"	"lycium"	"pallidum"	"pallidum"	"lycium pallidum var. pallidum"
"d0c8092e-a3b6-4015-ac5e-bd606dab1489"	"asu"	NA	"woodruff; near river bed"	34.7814	-110.043	"united states"	"arizona"	"navajo county"	NA	NA	"solanaceae"	"lycium"	"pallidum"	"pallidum"	"lycium pallidum var. pallidum"
"d1537bdb-9327-4295-ba5b-9c31a9b34bf2"	"des"	"des00061636"	"grand canyon national park, south bass trail, on esplanade."	36.200696	-112.374808	"united states"	"arizona"	"coconino county"	NA	NA	"solanaceae"	"lycium"	"pallidum"	NA	"lycium pallidum"
"d1b2580b-5f36-42cc-ae2d-67ec215075cd"	"ds"	"ds281013"	"tule holes valley, 9 miles north of tule hole, between nopah and kingston ranges, mojave desert"	35.9333	-116.0045	"united states"	"california"	"inyo"	NA	5000	"solanaceae"	"lycium"	"pallidum"	"oligospermum"	"lycium pallidum var. oligospermum"
"d1c09638-27d9-4d51-a7ab-60444ad23bad"	"jeps"	"jeps12192"	"barstow mohave desert"	34.897	-117.0228	"united states"	"california"	"san bernardino"	NA	3500	"solanaceae"	"lycium"	"pallidum"	"oligospermum"	"lycium pallidum var. oligospermum"
"d2a4490c-fca4-4ddc-9704-bc59e14f35e6"	"asc"	"8188"	"boynton canyon pass, nw of sedona."	34.825976	-111.786964	"united states"	"arizona"	"yavapai county"	NA	NA	"solanaceae"	"lycium"	"pallidum"	"pallidum"	"lycium pallidum var. pallidum"
"d2da8ca6-6084-427c-8bce-4a1aa119e208"	"uvsc"	"13175"	"sitla study site, foothills se of the virgin river & sw of atkinville wash, n side of dirt road ca. 1 mile w of the i-15 inspection station;"	37.01988	-113.63583	"united states"	"utah"	"washington"	NA	30	"solanaceae"	"lycium"	"pallidum"	NA	"lycium pallidum"
"d36b70af-cf05-47d0-aed3-9d2c04b7702b"	"asu"	NA	"upper san pedro river floodplain; st. david site ~2 miles south of curtiss flat rd., several hundred meters east of san pedro"	31.818	-110.214	"united states"	"arizona"	"cochise county"	NA	NA	"solanaceae"	"lycium"	"pallidum"	NA	"lycium pallidum"
"d52b95ba-ed91-4890-962d-da57506532a5"	"asc"	"89111"	"rrsp, eagle's nest trail"	34.811417	-111.829139	"united states"	"arizona"	"yavapai county"	NA	NA	"solanaceae"	"lycium"	"pallidum"	NA	"lycium pallidum"
"d53b60ac-192c-47ee-9dd3-ecd7c4984312"	"jeps"	"jeps12188"	"slate range"	35.787	-117.2294	"united states"	"california"	"inyo"	NA	23500	"solanaceae"	"lycium"	"pallidum"	"oligospermum"	"lycium pallidum var. oligospermum"
"d5404f5b-0f97-4948-aa2f-99f60f9fe895"	"ny"	"00951077"	"2.5 air mi nw of fry canyon store on n side of white canyon."	37.77	-110.18	"united states"	"utah"	"san juan co."	NA	NA	"solanaceae"	"lycium"	"pallidum"	NA	"lycium pallidum miers"
"d5869739-e768-4a78-b656-dc4140b196ec"	"ny"	"00951080"	"ca. 2 miles south of highway 12, hole-in-the-rock road"	37.69	-111.5	"united states"	"utah"	"garfield co."	NA	NA	"solanaceae"	"lycium"	"pallidum"	NA	"lycium pallidum miers"
"d78b9fd6-9e42-4876-85dd-dee65f3fdbd5"	"ny"	"00951084"	"petrified forest sector, ca. 2 miles north of rockville"	37.02	-113.04	"united states"	"utah"	"washington co."	NA	NA	"solanaceae"	"lycium"	"pallidum"	NA	"lycium pallidum miers"
"d78f5562-0596-4063-8b2f-0b5f2d7c9a3b"	"asc"	"100232"	"grand canyon national park, south bass trail, on esplanade."	36.200696	-112.374808	"united states"	"arizona"	"coconino county"	NA	NA	"solanaceae"	"lycium"	"pallidum"	NA	"lycium pallidum"
"d7ab4e3e-4635-4120-ab79-27c54daa522a"	"uc"	"uc457341"	"argus mts."	36.1576	-117.4668	"united states"	"california"	"inyo"	NA	25000	"solanaceae"	"lycium"	"pallidum"	"oligospermum"	"lycium pallidum var. oligospermum"
"d7f0ec10-78e1-4932-bc1b-346c94f35842"	"dbg"	"khd00036716"	"bayfield"	37.223647	-107.59706	"united states"	"colorado"	NA	NA	10000	"solanaceae"	"lycium"	"pallidum"	NA	"lycium pallidum"
"d90be9a2-424b-4b6d-9e23-ca5cd0b3a03b"	"uc"	"uc303756"	"barstow mohave desert"	34.897	-117.0228	"united states"	"california"	"san bernardino"	NA	3500	"solanaceae"	"lycium"	"pallidum"	"oligospermum"	"lycium pallidum var. oligospermum"
"daa5ad34-66fa-4712-8a5a-9dd364bfc5e1"	"asu"	NA	"white mountain apache reservation; white river; south of ft. apache"	33.7876	-110.001	"united states"	"arizona"	"navajo county"	NA	NA	"solanaceae"	"lycium"	"pallidum"	"pallidum"	"lycium pallidum var. pallidum"
"dce14cc2-1d9c-4ff7-94e9-936f498b181c"	"jeps"	"jeps12193"	"daggett mohave desert"	34.8621	-116.8852	"united states"	"california"	"san bernardino"	NA	1600	"solanaceae"	"lycium"	"pallidum"	"oligospermum"	"lycium pallidum var. oligospermum"
"dd6f13ea-93ec-4f35-81ee-7d7d4c1335d2"	"asu"	NA	"tonto national forest; pinal creek; 6 miles west of miami, az"	33.4657	-110.851	"united states"	"arizona"	"gila county"	NA	NA	"solanaceae"	"lycium"	"pallidum"	"pallidum"	"lycium pallidum var. pallidum"
"de73f7b3-f2bd-4121-bbfd-6eac68d185c5"	"ny"	"00951093"	"ca 7 mi w of beatti [beatty]"	36.85	-116.81481	"united states"	"nevada"	"nye co."	NA	NA	"solanaceae"	"lycium"	"pallidum"	NA	"lycium pallidum miers"
"dfad511c-1673-4a23-9ca1-5ec25fe99b2e"	"asc"	"15859"	"holbrook."	34.90222	-110.1575	"united states"	"arizona"	"navajo county"	NA	NA	"solanaceae"	"lycium"	"pallidum"	"pallidum"	"lycium pallidum var. pallidum"
"e181cf83-0140-484f-97b6-331e2770ef3a"	"des"	"des00044948"	"pearce; dragoon mts.; east drainage slope; middle march canyon w of middle march rd."	31.882849	-109.948968	"united states"	"arizona"	"cochise"	NA	3036	"solanaceae"	"lycium"	"pallidum"	NA	"lycium pallidum"
"e1a23d4b-8dbc-426c-8614-263c1b8db042"	"des"	"des00010344"	"city of rocks, 11.5 airline miles southeast of hurley."	32.5977	-107.9671	"united states"	"new mexico"	"grant"	NA	969	"solanaceae"	"lycium"	"pallidum"	"pallidum"	"lycium pallidum var. pallidum"
"e473ede9-11c7-4814-ab2a-2275c3a70020"	"cas"	"cas527320"	"daylight pass area"	36.7887	-116.9314	"united states"	"california"	"inyo"	NA	300	"solanaceae"	"lycium"	"pallidum"	"oligospermum"	"lycium pallidum var. oligospermum"
"e4a70fd9-69d2-4073-90ba-0198dd878548"	"jeps"	"jeps12190"	"barstow"	34.897	-117.0228	"united states"	"california"	"san bernardino"	NA	3500	"solanaceae"	"lycium"	"pallidum"	"oligospermum"	"lycium pallidum var. oligospermum"
"e7cfb916-89ce-49f7-8bdd-a32067a3e05a"	"rsa"	"rsa261600"	"inyo mountains.: eureka valley drainage. marble canyon."	37.1043	-117.886	"united states"	"california"	"inyo"	NA	900	"solanaceae"	"lycium"	"pallidum"	"oligospermum"	"lycium pallidum var. oligospermum"
"e851a526-b67b-4bef-9923-fb29e940604c"	"dbg"	"khd00036717"	"bayfield"	37.223647	-107.59706	"united states"	"colorado"	NA	NA	10000	"solanaceae"	"lycium"	"pallidum"	NA	"lycium pallidum"
"e8aa7fa9-23a4-4a26-a524-2eff4af593a5"	"asc"	"7528"	"supai village, havasu."	36.23694	-112.68833	"united states"	"arizona"	"coconino county"	NA	NA	"solanaceae"	"lycium"	"pallidum"	"pallidum"	"lycium pallidum var. pallidum"
"e8b33217-5652-4446-b7c0-8fe5224e548a"	"cas"	"cas380406"	"9 miles north of tule springs, valley to s.e. of nopah range, death valley region"	35.9333	-116.0045	"united states"	"california"	"inyo"	NA	5000	"solanaceae"	"lycium"	"pallidum"	"oligospermum"	"lycium pallidum var. oligospermum"
"e8ece74d-8fb5-4210-b641-65faeb0b4dc2"	"uc"	"uc1535129"	"2.9 mi n 85 degrees e bunker hill mine (low hills just e of n end of saline valley rd, saline valley drainage); inyo mountains, saline valley"	36.9317315830401	-117.904317584422	"united states"	"california"	"inyo"	NA	825	"solanaceae"	"lycium"	"pallidum"	"oligospermum"	"lycium pallidum var. oligospermum"
"e97b1e53-ab90-4772-8cc8-b9255bbd8cd0"	"sbbg"	"sbbg6595"	"boundry cyn, death valley"	36.7472	-116.9399	"united states"	"california"	"inyo"	NA	5000	"solanaceae"	"lycium"	"pallidum"	NA	"lycium pallidum"
"e9a8c5a9-5689-4dbd-8b97-5080d10b4aa6"	"des"	"des00045169"	"grand canyon np: dripping springs trail, at dripping springs"	36.068333	-112.265	"united states"	"arizona"	"coconino"	NA	NA	"solanaceae"	"lycium"	"pallidum"	"pallidum"	"lycium pallidum var. pallidum"
"ed0fc9f1-c587-43bb-9dbf-3792d2c6844a"	"dbg"	"khd00036722"	"on road 52; 13.5 miles n of junction of road 52 and highway 350."	37.374187	-104.474364	"united states"	"colorado"	"las animas county"	NA	NA	"solanaceae"	"lycium"	"pallidum"	NA	"lycium pallidum"
"edd2e587-dfc3-4eb9-9f33-45166eb3ca4d"	"ucr"	"ucr41702"	"northern mojave desert slate range, c. 14 mi north of trona on trona-wildrose road"	35.95639	-117.33194	"united states"	"california"	"inyo"	NA	1000	"solanaceae"	"lycium"	"pallidum"	NA	"lycium pallidum"
"ee0b73d1-1717-4412-ba29-cedc117b71c9"	"asu"	NA	"paradise; east side of the chiricahuas mountains"	31.5922	-109.24	"united states"	"arizona"	"cochise county"	NA	NA	"solanaceae"	"lycium"	"pallidum"	"pallidum"	"lycium pallidum var. pallidum"
"effc4b12-ed4d-47b8-84e3-94ef4ec51412"	"utc"	"utc00220252"	"amargosa desert/ south end of bullfrog hills  rte. 374  about 3 road miles west of us 95 junction in beatty."	36.8913889	-116.8030556	"united states"	"nevada"	"nye"	NA	NA	"solanaceae"	"lycium"	"pallidum"	NA	"lycium pallidum"
"f03cd7bc-56df-4519-aa72-da0793654ab7"	"asu"	NA	"dragoon mountains, rd. to cochise stronghold campground of coronado national forest. ca. 10 mi west of hwy. 666."	31.925	-109.967	"united states"	"arizona"	"cochise county"	NA	NA	"solanaceae"	"lycium"	"pallidum"	NA	"lycium pallidum"
"f0be9245-a3e9-440c-9098-89f79963d75e"	"asu"	NA	"galiuro mountains; bass canyon on muleshoe ranch; ca. 25 miles northwest of willcox; winchester mountains 15' quad.. (sections 29, 31, 32)"	32.3611	-110.225	"united states"	"arizona"	"cochise county"	NA	700	"solanaceae"	"lycium"	"pallidum"	"pallidum"	"lycium pallidum var. pallidum"
"f2280d1b-f4ff-4a23-b58d-f88e9dcbbfc3"	"ucd"	"ucd126615"	"inyo county: nevada-california border, daylight pass, highway 58, death valley national monument"	36.7887	-116.9314	"united states"	"california"	"inyo"	NA	300	"solanaceae"	"lycium"	"pallidum"	"oligospermum"	"lycium pallidum var. oligospermum"
"f312aa35-bfa9-4d3d-8bd3-d4f035fce043"	"dbg"	"khd00036715"	"pinyon canyon maneuver site, taylor arroyo drainage, near burson camp; in short side canyon leading to taylor arroyo from s. ca. 3 mi. above its mouth in purgatoire canyon"	37.407771	-103.877968	"united states"	"colorado"	"las animas county"	NA	NA	"solanaceae"	"lycium"	"pallidum"	NA	"lycium pallidum"
"f3d2d968-050a-4521-b75b-692fd02a8d32"	"sd"	"sd51233"	"4.5 miles north of barstow on road to camp irwin"	34.9673	-117.0157	"united states"	"california"	"san bernardino"	NA	700	"solanaceae"	"lycium"	"pallidum"	"oligospermum"	"lycium pallidum var. oligospermum"
"f480f8bd-0937-4c3c-82eb-53783dd27353"	"asu"	NA	"bottofm of walnut canyon"	35.2019	-111.423	"united states"	"arizona"	"coconino county"	NA	NA	"solanaceae"	"lycium"	"pallidum"	NA	"lycium pallidum"
"f49376db-f8c5-474b-ac89-1c80e121d0bc"	"cas"	"cas994423"	"on bajada in extreme ne extension of range, about 9 mi. ene of horse thief springs, kingston range"	35.8277	-115.7458	"united states"	"california"	"inyo"	NA	4200	"solanaceae"	"lycium"	"pallidum"	"oligospermum"	"lycium pallidum var. oligospermum"
"f518b71a-f944-4eb0-90b9-7c32c170b401"	"dbg"	"khd00031276"	"mesa overlooking vogel canyon"	37.749039	-103.481787	"united states"	"colorado"	"otero county"	NA	10000	"solanaceae"	"lycium"	"pallidum"	NA	"lycium pallidum"
"f53b7205-a1c4-4530-bbbe-0c9350f216ae"	"des"	"des00007298"	"dirt road connecting rte 69 and rte 89a, 3 mi north of dewey."	34.564641	-112.287595	"united states"	"arizona"	"yavapai"	NA	3036	"solanaceae"	"lycium"	"pallidum"	NA	"lycium pallidum"
