"f6ce809f-720a-4c7a-af08-6492ee554838"	"asc"	"68772"	"700m wnw of the confluence of apache and walnut creeks, ca. 50k nnw of prescott; indian peak quadrangle"	34.92286	-112.84962	"united states"	"arizona"	"yavapai county"	NA	NA	"solanaceae"	"lycium"	"pallidum"	NA	"lycium pallidum"
"f772ad37-6ee4-4f75-b70e-3c82d64ea5fc"	"asu"	NA	"pearce; dragoon mountains; e-draining slope; middle march canyon west of middle march road"	31.9394	-109.981	"united states"	"arizona"	"cochise county"	NA	NA	"solanaceae"	"lycium"	"pallidum"	NA	"lycium pallidum"
"f7be9677-0d3a-4149-93a0-52f5a4ab835d"	"ucr"	"ucr90702"	"western mojave desert iron mountain, c. 15 air mi west of barstow, between hinckley road and harper lake road"	34.87	-117.23667	"united states"	"california"	"san bernardino"	NA	1000	"solanaceae"	"lycium"	"pallidum"	NA	"lycium pallidum"
"f80397ae-ed2f-48f4-b7c5-88170edf3651"	"des"	"des00049048"	"along arizona trail, ca 3.4 miles north of freeman road and trailhead, the trailhead ca 2.4 miles east of hayden ranch road and 19.3 miles from junction of highway 79 and freeman road."	32.8993	-110.9231	"united states"	"arizona"	"pinal county"	NA	NA	"solanaceae"	"lycium"	"pallidum"	NA	"lycium pallidum"
"f82db550-f967-4926-9654-88c8b607fa40"	"asu"	NA	"4.5 miles northeast of st. johns on route 666; then west on gravel road 0.5 miles; st. johns north 7.5' quad."	34.5489	-109.36	"united states"	"arizona"	"apache county"	NA	700	"solanaceae"	"lycium"	"pallidum"	NA	"lycium pallidum"
"f862e439-479e-4e57-95f1-3ecc0409f502"	"asu"	NA	"upper san pedro river floodplain, st. david ~3 miles south of curtis flat turnoff, near banks of old irrigation ditch"	31.8184	-110.214	"united states"	"arizona"	"cochise county"	NA	NA	"solanaceae"	"lycium"	"pallidum"	NA	"lycium pallidum"
"f88d84b0-038d-48a3-8a74-77e34bc35b67"	"pom"	"pom292854"	"mojave desert; hills 5 miles west of yermo. alt; 2400 ft."	34.901	-116.9156	"united states"	"california"	"san bernardino"	NA	1000	"solanaceae"	"lycium"	"pallidum"	"oligospermum"	"lycium pallidum var. oligospermum"
"fa2078bc-c8b4-4efa-a993-e1dc1a23e753"	"jeps"	"jeps12195"	"barstow mohave desert"	34.897	-117.0228	"united states"	"california"	"san bernardino"	NA	3500	"solanaceae"	"lycium"	"pallidum"	"oligospermum"	"lycium pallidum var. oligospermum"
"fb04b8f4-efa5-40ea-8ea7-40317aa70fbd"	"asc"	"34333"	"highway i-40, ca. 1 mi w of buffalo ranch rd exit; 40 mi e flagstaff."	36.470829	-111.966365	"united states"	"arizona"	"coconino county"	NA	NA	"solanaceae"	"lycium"	"pallidum"	NA	"lycium pallidum"
"fbdcbfae-76f5-414b-852f-701d18d71f1e"	"ds"	"ds120842"	"barstow"	34.897	-117.0228	"united states"	"california"	"san bernardino"	NA	3500	"solanaceae"	"lycium"	"pallidum"	NA	"lycium pallidum"
"fc3a3a30-e3ee-4e9f-b356-ea05ac36bae3"	"asu"	NA	"pinaleno mountains; stockton pass"	32.6408	-109.843	"united states"	"arizona"	"graham county"	NA	NA	"solanaceae"	"lycium"	"pallidum"	NA	"lycium pallidum"
"fdc1a726-a9f3-44ad-b206-fbe80eec46a7"	"asu"	NA	"black rock. t5s,r21e,sec34,sw,sw."	32.9545	-110.18	"united states"	"arizona"	"graham county"	NA	NA	"solanaceae"	"lycium"	"pallidum"	NA	"lycium pallidum"
"feb22b2e-c000-40eb-9973-18875fd69128"	"asc"	"5251"	"20 mi sw kayenta."	36.522418	-110.509777	"united states"	"arizona"	"navajo county"	NA	NA	"solanaceae"	"lycium"	"pallidum"	NA	"lycium pallidum"
"ff9d54cc-c2fc-42b9-9d83-3271e354ae21"	"asc"	"96315"	"prescott national forest: just e of ariz hwy 89, ca 4 air mi n of paulden; ca 20 air mi s of ash fork."	34.9347	-112.4317	"united states"	"arizona"	"yavapai"	NA	NA	"solanaceae"	"lycium"	"pallidum"	"pallidum"	"lycium pallidum var. pallidum"
"ffb25f66-a413-423d-b0eb-fdcde89c275a"	"des"	"des00055223"	"approximately 6 miles west of bluff, ut on hwy 163 to butler wash exit, then n on main blm dirt road approximately 12 miles, then left on dirt two-track approximately 150 m to edge of comb geologic formation."	37.388514	-109.632994	"united states"	"utah"	"san juan county"	NA	NA	"solanaceae"	"lycium"	"pallidum"	NA	"lycium pallidum"
