"d057aab6-ea10-4ff6-99c3-4e0c9daa4fd0"	"sd"	"sd187513"	"cleveland national forest. jeep trail 0.1 miles s of laguna meadow road, 2.05 miles sw from junction with sunrise highway (s-1). section 5."	32.8939	-116.4836	"united states"	"california"	"san diego"	NA	NA	"pinaceae"	"pinus"	"jeffreyi"	NA	"pinus jeffreyi"
"d0d61565-2e3f-48e3-960d-81357d77638c"	"cas"	"cas1131339"	"foothills, northern sierra nevada mountains: granite springs road 0.4 mile east of its junction with ice house road, junct. about 4 miles southwest of ice house elev. given as 5600 ft"	38.8013888889	-120.3841666667	"united states"	"california"	"el dorado"	NA	NA	"pinaceae"	"pinus"	"jeffreyi"	NA	"pinus jeffreyi"
"d10beb27-9398-437b-8fee-5b925f4b6dca"	"uc"	"uc902029"	"grouse mountain"	40.7753	-123.6787	"united states"	"california"	"humboldt"	NA	1208	"pinaceae"	"pinus"	"jeffreyi"	NA	"pinus jeffreyi"
"d1782dde-cfbb-4d00-a379-783a61f7de90"	"hsc"	"hsc50375"	"near wimer rd., close to the town of smith river"	41.98711111	-123.9894444	"united states"	"california"	"del norte"	NA	NA	"pinaceae"	"pinus"	"jeffreyi"	NA	"pinus jeffreyi"
"d17a8250-a1bf-4fcf-a397-1f8ff1473c01"	"obi"	"obi7731"	"on the very top of mt figueroa"	34.7433	-119.9849	"united states"	"california"	"santa barbara"	NA	500	"pinaceae"	"pinus"	"jeffreyi"	NA	"pinus jeffreyi"
"d20a97e8-63c9-4904-b206-dc5b9c0d1d64"	"cas"	"cas949224"	"tule creek valley, ne of tule pk, between aguanga & anza, s of hwy 371. old house site on tule peak rd., 0.7 mi w of bonny ln., sec. 14. utm: ng-2e, 0n durasno valley."	33.4833333333	-116.75	"united states"	"california"	"riverside"	NA	NA	"pinaceae"	"pinus"	"jeffreyi"	NA	"pinus jeffreyi"
"d2456c73-9afa-41d7-8560-f9769fdab08c"	"rsa"	"rsa248930"	"mt. san antonio"	34.2892	-117.647	"united states"	"california"	"san bernardino"	NA	4500	"pinaceae"	"pinus"	"jeffreyi"	NA	"pinus jeffreyi"
"d2d1aec6-b18f-4d08-b578-770bc7d2d77f"	"uc"	"uc1786737"	"great basin province; east of sierra nevada; alpers canyon: along fs rd. 2s04, above big switchbacks."	37.767776	-118.934166	"united states"	"california"	"mono"	NA	NA	"pinaceae"	"pinus"	"jeffreyi"	NA	"pinus jeffreyi"
"d35b804a-c6a1-45af-b665-95d1475c50ac"	"rsa"	"rsa180863"	"tehachapi mountains. summit of tehachapi peak. on the upper 1000 feet elevation tehachapi peak."	35.0468	-118.4846	"united states"	"california"	"kern"	NA	1000	"pinaceae"	"pinus"	"jeffreyi"	NA	"pinus jeffreyi"
"d3a992c0-ad18-4bbf-a52d-c05deefd4d90"	"chsc"	"chsc84950"	"on the north side of the road to tamarack flat, about 1/8 mile west of the intersection of lumpkin ridge road and road to tamarack flat, about 1 mile (air) northwest of little grass valley reservoir dam, about 4 miles (air) northwest of la porte"	39.7391666666667	-121.029444444444	"united states"	"california"	"plumas"	NA	NA	"pinaceae"	"pinus"	"jeffreyi"	NA	"pinus jeffreyi"
"d3ca3277-5636-4c31-894a-fd3de225497b"	"cas"	"cas448164"	"5 miles north of sonora pass junction, west walker river"	38.4173	-119.4495	"united states"	"california"	"mono"	NA	650	"pinaceae"	"pinus"	"jeffreyi"	NA	"pinus jeffreyi"
"d4a0ea4a-3dad-4ea3-a95d-fd0d4c851d12"	"jeps"	"jeps81327"	"s side snow mt. (summit springs trail, lake-colusa county boundary)"	39.3752194005385	-122.74819427775	"united states"	"california"	"lake"	NA	2983	"pinaceae"	"pinus"	"jeffreyi"	NA	"pinus jeffreyi"
"d4f8e99b-8a70-46dc-a5ec-fbfa7af19b65"	"pom"	"pom176910"	"near lily lake, glen alpine canyon."	38.8757	-120.0816	"united states"	"california"	"el dorado"	NA	482	"pinaceae"	"pinus"	"jeffreyi"	NA	"pinus jeffreyi"
"d500c59f-19bf-4803-b168-2fb56f19a9f2"	"cas"	"cas577023"	"sierra nevada, kern plateau - rockhouse meadow."	35.8882	-118.1978	"united states"	"california"	"tulare"	NA	600	"pinaceae"	"pinus"	"jeffreyi"	NA	"pinus jeffreyi"
"d62256a7-d923-464a-a24f-2f3ada1e2a20"	"cas"	"425916"	"lassen volcanic national park, manzanita lake"	40.5345	-121.5666	"united states"	"california"	"shasta county"	NA	NA	"pinaceae"	"pinus"	"jeffreyi"	NA	"pinus jeffreyi  balf."
"d68ed8a4-c4c3-405b-bc20-45ec0b41cd7e"	"rsa"	"rsa248922"	"mt. san antonio"	34.2892	-117.647	"united states"	"california"	"san bernardino"	NA	4500	"pinaceae"	"pinus"	"jeffreyi"	NA	"pinus jeffreyi"
"d71eb133-6cb8-4e62-87c2-4086e30823c4"	"sd"	"sd229025"	"taquitz valley camp, 2.5 mi. east (via trail) of humber park, idyllwild."	33.7704	-116.6619	"united states"	"california"	"riverside"	NA	NA	"pinaceae"	"pinus"	"jeffreyi"	NA	"pinus jeffreyi"
"d74f26a9-b743-4924-b17c-0d721db00292"	"rsa"	"rsa237337"	"0.1 mile north of english lake outlets. salmon mountains. high lake basins in the vicinity of english peak. marble mountain wilderness area."	41.4177	-123.2074	"united states"	"california"	"siskiyou"	NA	163	"pinaceae"	"pinus"	"jeffreyi"	NA	"pinus jeffreyi"
"d7916686-3c98-4309-a57c-9f30818bd221"	"hsc"	"hsc1500"	"mineral king, sequoia national forest"	36.4507413975743	-118.594026556188	"united states"	"california"	"tulare"	NA	5906	"pinaceae"	"pinus"	"jeffreyi"	NA	"pinus jeffreyi"
"d8635084-330d-407b-aa68-3f8a6609fd71"	"ds"	"ds212078"	"rock creek, in the pass between the inyo and mono basins"	37.5646	-118.6867	"united states"	"california"	"mono"	NA	2800	"pinaceae"	"pinus"	"jeffreyi"	NA	"pinus jeffreyi"
"d86a2646-0db8-4dae-9992-be5fa48069f9"	"hsc"	"hsc29658"	"1/10 mi. n of english lake, bulk collection # 49"	41.4164	-123.21	"united states"	"california"	"siskiyou"	NA	208	"pinaceae"	"pinus"	"jeffreyi"	NA	"pinus jeffreyi"
"d878eb5b-61b7-45ce-927f-15437e599b97"	"pom"	"pom212426"	"1/2 mile nw of lundy, e slope of sierra nevada."	38.029	-119.2501	"united states"	"california"	"mono"	NA	400	"pinaceae"	"pinus"	"jeffreyi"	NA	"pinus jeffreyi"
"d8d78560-08fa-4f0a-81f0-99c0a4645a0b"	"cas"	"cas446729"	"southwest of peanut"	40.4638	-123.1762	"united states"	"california"	"trinity"	NA	1520	"pinaceae"	"pinus"	"jeffreyi"	NA	"pinus jeffreyi"
"d9039bda-ff0d-4340-907c-6f735ed2d8e8"	"cas"	"cas576359"	"piute mountains: south slope of sorrel peak"	35.4136	-118.2908	"united states"	"california"	"kern"	NA	1500	"pinaceae"	"pinus"	"jeffreyi"	NA	"pinus jeffreyi"
"d96a7bf7-fdcf-4431-aed6-43aa294851dc"	"chsc"	"chsc8540"	"grant grove, seq. national park. sierra nevada mt.. range"	36.7511111111111	-118.983888888889	"united states"	"california"	"fresno"	NA	1650	"pinaceae"	"pinus"	"jeffreyi"	NA	"pinus jeffreyi"
"d9be140a-1575-4775-a861-4b472374817d"	"jeps"	"jeps104187"	"in rock pile ca 25 yd n of humboldt peak, ca 1/2 mi e of humboldt summit, ca 8 mi (air) ne of butte meadows."	40.1509253806575	-121.433572727916	"united states"	"california"	"butte"	NA	508	"pinaceae"	"pinus"	"jeffreyi"	NA	"pinus jeffreyi"
"d9f84ee3-7a64-41fd-ae3f-ec1a51d18048"	"uc"	"uc398883"	"jonesville"	40.1124651316344	-121.466153445659	"united states"	"california"	"butte"	NA	1333	"pinaceae"	"pinus"	"jeffreyi"	NA	"pinus jeffreyi"
"da2f21d0-c345-4986-be5b-31c524c7d74e"	"sd"	"sd16141"	"pine hills (ipb 5/07)"	33.04838	-116.63085	"united states"	"california"	"san diego"	NA	1650	"pinaceae"	"pinus"	"jeffreyi"	NA	"pinus jeffreyi"
"db02e9f5-e47c-4aa3-a2c5-db007b3cbe5d"	"cas"	"425913"	"brokeoff mt. trail"	40.4414	-121.5596	"united states"	"california"	"tehama county"	NA	NA	"pinaceae"	"pinus"	"jeffreyi"	NA	"pinus jeffreyi  balf."
"db0fa457-8f11-48d4-89f5-43499ebbda71"	"ucr"	"ucr223095"	"transverse range; san gabriel mtns. east slope of pacifico mountain at fountainhead spring"	34.37972	-118.0275	"united states"	"california"	"los angeles"	NA	1000	"pinaceae"	"pinus"	"jeffreyi"	NA	"pinus jeffreyi"
"db43d515-f1fa-45aa-b30e-c992bee0685b"	"uc"	"uc496179"	"just e of mono craters and n of: south end of mono lake mono mills; mono lake"	37.9003	-118.9819	"united states"	"california"	"mono"	NA	2000	"pinaceae"	"pinus"	"jeffreyi"	NA	"pinus jeffreyi"
"db5e941b-2369-4ec2-a42c-cc7651b4396c"	"cas"	"cas95266"	"gold lake region"	39.9413	-121.1368	"united states"	"california"	"plumas"	NA	1340	"pinaceae"	"pinus"	"jeffreyi"	NA	"pinus jeffreyi"
"dbd6e706-4dc8-48d8-8cdb-e054587d2a62"	"chsc"	"chsc110234"	"northern high sierra nevada. plumas national forest; southwest-ern end of rocky ridge, 0.8 km west of ponderosa way/rim road, near high-voltage power lines"	39.7808333333333	-121.478888888889	"united states"	"california"	"butte"	NA	NA	"pinaceae"	"pinus"	"jeffreyi"	NA	"pinus jeffreyi"
"dd73b091-8540-4ace-9650-405e5bccc91c"	"hsc"	"hsc54535"	"near horse mtn. creek"	40.86938889	-123.7277222	"united states"	"california"	"humboldt"	NA	NA	"pinaceae"	"pinus"	"jeffreyi"	NA	"pinus jeffreyi"
"dd80eda0-6fba-4816-ab03-f6dc02762339"	"ds"	"ds636216"	"summit of divide at lily pad lake - trail to marble mt."	41.9203	-123.1887	"united states"	"california"	"siskiyou"	NA	500	"pinaceae"	"pinus"	"jeffreyi"	NA	"pinus jeffreyi"
"ddcdeca4-8ae6-4096-b4cd-9c62df13af54"	"hsc"	"hsc78852"	"bear lakes area, along trail to big bear lake."	41.1991	-122.6993	"united states"	"california"	"trinity"	NA	267	"pinaceae"	"pinus"	"jeffreyi"	NA	"pinus jeffreyi"
"de22180d-96f8-43d8-bfdf-35efd687ed52"	"ucr"	"ucr197615"	"northern sierra nevada mountains wright\'s lake road, 1.2 miles north of its junction with us-50"	38.79028	-120.22028	"united states"	"california"	"el dorado"	NA	1000	"pinaceae"	"pinus"	"jeffreyi"	NA	"pinus jeffreyi"
"def60359-f9bc-4f2b-a566-e8e1598dbeef"	"chsc"	"chsc33871"	"n side of antelope lake, ca. 1/4 mi e of boulder creek and usfs work center, between rd and lake, ca 20 mi ne of taylorville"	40.1961111111111	-120.610555555556	"united states"	"california"	"plumas"	NA	412	"pinaceae"	"pinus"	"jeffreyi"	NA	"pinus jeffreyi"
"df09a26d-a65e-4ca6-80cc-fe4a0adcc4f3"	"rsa"	"rsa384339"	"san gabriel mountains, angeles forest: barley flats."	34.2783	-118.0749	"united states"	"california"	"los angeles"	NA	800	"pinaceae"	"pinus"	"jeffreyi"	NA	"pinus jeffreyi"
"df0ecde5-bcc7-45f7-8c5f-baea4db75832"	"ds"	"ds267461"	"margins of pine valley, cleveland national forest"	32.8438	-116.5274	"united states"	"california"	"san diego"	NA	2062	"pinaceae"	"pinus"	"jeffreyi"	NA	"pinus jeffreyi"
"df1c7d81-b61d-4a00-a460-a808e9786baa"	"scfs"	"scfs586"	"sagehen creek field station. 3 mi w of sagehen station, 25 yds sw of road"	39.433	-120.2422	"united states"	"california"	"nevada"	NA	625	"pinaceae"	"pinus"	"jeffreyi"	NA	"pinus jeffreyi"
"dff4b45f-2de5-440c-96d2-d4935700fade"	"cas"	"cas801436"	"monkey rock on hull mt. road"	39.5485	-122.9577	"united states"	"california"	"mendocino"	NA	350	"pinaceae"	"pinus"	"jeffreyi"	NA	"pinus jeffreyi"
"e07822bc-0862-4af5-84f4-f24595c972a1"	"rsa"	"rsa681838"	"""dry fork"" drainage to adobe valley. appx. 1 mi. n of fs rd. 1s01 (sawmill mdw. rd), along and below 4wd ranch road running n."	37.8036111111111	-118.675	"united states"	"california"	"mono"	NA	NA	"pinaceae"	"pinus"	"jeffreyi"	NA	"pinus jeffreyi"
"e0cb939a-182e-4741-ba68-81424a2b570c"	"ds"	"ds212003"	"rock creek inn, rock creek, mono county, 26 miles north of bishop"	37.4698	-118.7257	"united states"	"california"	"inyo"	NA	1000	"pinaceae"	"pinus"	"jeffreyi"	NA	"pinus jeffreyi"
"e19270ae-457a-4a33-9640-9bc37cb7de3f"	"rsa"	"rsa787280"	"east slope of pacifico mountain at fountainhead spring"	34.3797222222222	-118.0275	"united states"	"california"	"los angeles"	NA	NA	"pinaceae"	"pinus"	"jeffreyi"	NA	"pinus jeffreyi"
"e1a04b9c-c46c-493d-ab2d-4ad8d9b82ce9"	"ucr"	"ucr196781"	"eastern sierra nevada mountains junction of ca-88/89 and entrance to crystal springs campground, 1.2 miles southwest of woodfords"	38.76694	-119.84389	"united states"	"california"	"alpine"	NA	1000	"pinaceae"	"pinus"	"jeffreyi"	NA	"pinus jeffreyi"
"e1e3a8d2-6c0a-4dab-b309-bf1d903b758a"	"hsc"	"hsc60218"	"old gasquet toll rd. 0.1 mi. n of s entrance, bulk collection # 218"	41.8469	-123.959	"united states"	"california"	"del norte"	NA	105	"pinaceae"	"pinus"	"jeffreyi"	NA	"pinus jeffreyi"
"e2215d9b-4226-4dc4-8a80-aa693941336d"	"rsa"	"rsa9492"	"near fallen leaf lake."	38.9027	-120.0631	"united states"	"california"	"el dorado"	NA	3239	"pinaceae"	"pinus"	"jeffreyi"	NA	"pinus jeffreyi"
"e2f4e9ad-066a-4aa5-b567-864649da17dc"	"cas"	"212077"	"lundy lake"	38.0293	-119.2301	"united states"	"california"	"mono county"	NA	NA	"pinaceae"	"pinus"	"jeffreyi"	NA	"pinus jeffreyi  balf."
"e3d7b855-63cc-4721-ab37-204a5ea65ebc"	"sfv"	"sfv18302"	"san gabriel mountains angeles national forest, camp eaton (= camp cumorah crest), 3 km ne of newcomb ranch."	34.3499992548777	-117.980899788971	"united states"	"california"	"los angeles"	NA	NA	"pinaceae"	"pinus"	"jeffreyi"	NA	"pinus jeffreyi"
"e3f22aee-844a-4c89-83ab-dbb805b5c25d"	"hsc"	"hsc31984"	"horse mtn. ski area"	40.8791	-123.7352	"united states"	"california"	"humboldt"	NA	333	"pinaceae"	"pinus"	"jeffreyi"	NA	"pinus jeffreyi"
"e48d53d8-4dbb-4dec-b5bf-87989c29ecbf"	"obi"	"obi33911"	"ca. 4 mi se of sr 299 along titlow hill rd below horse mtn summit rd"	40.8654	-123.7379	"united states"	"california"	"humboldt"	NA	399	"pinaceae"	"pinus"	"jeffreyi"	NA	"pinus jeffreyi"
"e4a0b104-e570-4ed1-a392-64f2eb734949"	"rsa"	"rsa6655"	"sierraville."	39.5896	-120.3674	"united states"	"california"	"sierra"	NA	3360	"pinaceae"	"pinus"	"jeffreyi"	NA	"pinus jeffreyi"
"e4a7114c-d204-414d-9e1a-a64e252cfd7a"	"ucr"	"ucr67404"	"plumas national forest, south of susanville, north of milford pass"	40.23306	-120.52972	"united states"	"california"	"lassen"	NA	10000	"pinaceae"	"pinus"	"jeffreyi"	NA	"pinus jeffreyi"
"e4fb722b-8d3e-4a0c-be36-6b54e7b79091"	"ucr"	"ucr150880"	"transverse ranges; san gabriel mtns kratka ridge, upper little rock creek, williamson rock climbing area"	34.36028	-117.875	"united states"	"california"	"los angeles"	NA	1000	"pinaceae"	"pinus"	"jeffreyi"	NA	"pinus jeffreyi"
"e530c3a6-2fbe-4102-9344-b4452b39ee21"	"cas"	"711045"	"quaking [aspen] asp [canyon] canyon on the northeast side of wheeler peak above sweetwater, nevada, mono county"	38.433172	-119.262836	"united states"	"california"	"mono county"	NA	NA	"pinaceae"	"pinus"	"jeffreyi"	NA	"pinus jeffreyi  balf."
"e564b272-d176-4613-b78a-106ac7e07951"	"ny"	"991238"	"along cow creek road, ca. 8.4 miles southwest of riddle"	42.919539	-123.50965	"united states"	"oregon"	"douglas co."	NA	NA	"pinaceae"	"pinus"	"jeffreyi"	NA	"pinus jeffreyi grev. & balf."
"e5841df0-1efc-4a3e-8b0c-f10b51efd4cf"	"uc"	"uc496204"	"kelleys camp mt. lassen region, warner valley"	40.4309	-121.3493	"united states"	"california"	"plumas"	NA	1515	"pinaceae"	"pinus"	"jeffreyi"	NA	"pinus jeffreyi"
"e61f810f-6909-467e-acf8-51b7dfa4a017"	"rsa"	"rsa787246"	"the owens peak eastern watershed. along the pacific crest trail, on the northeast side of mount jenkins."	35.7104517524887	-117.989706484899	"united states"	"california"	"kern"	NA	NA	"pinaceae"	"pinus"	"jeffreyi"	NA	"pinus jeffreyi"
"e72409c9-5d01-4cf3-8433-9e5e873dfda6"	"rsa"	"rsa46500"	"[writing illegible] susanville"	40.4161	-120.6505	"united states"	"california"	"lassen"	NA	5500	"pinaceae"	"pinus"	"jeffreyi"	NA	"pinus jeffreyi"
"e93c6dcf-7ddb-4644-88b7-6256033957be"	"rsa"	"rsa185046"	"deadman summit."	37.7719	-119.0095	"united states"	"california"	"mono"	NA	250	"pinaceae"	"pinus"	"jeffreyi"	NA	"pinus jeffreyi"
"e967a85d-bcfd-433d-a589-8530a868680e"	"cas"	"236753"	"horse mountain"	40.8739	-123.7336	"united states"	"california"	"humboldt county"	NA	NA	"pinaceae"	"pinus"	"jeffreyi"	NA	"pinus jeffreyi  balf."
"eb06db04-6947-40b1-98a1-5c0682701a62"	"ds"	"ds267457"	"laguna lakes, laguna mountains"	32.8798	-116.4577	"united states"	"california"	"san diego"	NA	2475	"pinaceae"	"pinus"	"jeffreyi"	NA	"pinus jeffreyi"
"eb0c8948-8a2f-40db-9ed7-97b3f1d8fff5"	"hsc"	"hsc51563"	"near lower coon mtn., close to town of gasquet."	41.76866667	-123.9593056	"united states"	"california"	"del norte"	NA	NA	"pinaceae"	"pinus"	"jeffreyi"	NA	"pinus jeffreyi"
"eb7f34c2-af62-4f76-b479-a71a28f87a66"	"ucd"	"ucd134717"	"tulare county: crystal creek, from point where it enters east fork kaweah river to ca, 1.75-2 miles above (east) that point, mineral king game refuge, sequoia national forest"	36.4398	-118.5783	"united states"	"california"	"tulare"	NA	1492	"pinaceae"	"pinus"	"jeffreyi"	NA	"pinus jeffreyi"
"eb9f3652-2a4b-4101-9e18-1fc6c14261ab"	"ds"	"ds211983"	"southern mono county on highway 2 miles north of the road to mammoth hot spring"	37.6649	-118.9318	"united states"	"california"	"mono"	NA	1000	"pinaceae"	"pinus"	"jeffreyi"	NA	"pinus jeffreyi"
"ebc67416-b941-41fb-9b25-36d7ca6f1637"	"hsc"	"hsc50786"	"near monkey creek ridge, close to the town of gasquet"	41.99447222	-123.7882778	"united states"	"california"	"del norte"	NA	NA	"pinaceae"	"pinus"	"jeffreyi"	NA	"pinus jeffreyi"
"ec1e0c1d-1c1f-40a1-a6d9-34e071b0d12c"	"ds"	"ds161194"	"lassen\'s peaks. signal peak."	40.3339	-123.5545	"united states"	"california"	"humboldt"	NA	106	"pinaceae"	"pinus"	"jeffreyi"	NA	"pinus jeffreyi"
"ed1692ca-e59a-4756-814f-90beaec3f087"	"chsc"	"chsc40685"	"about 1 mile west of pilot peak, about 9 miles north-east of la porte"	39.7836111111111	-120.886666666667	"united states"	"california"	"plumas"	NA	825	"pinaceae"	"pinus"	"jeffreyi"	NA	"pinus jeffreyi"
"ed29f43a-b1d1-4922-aa59-2c4278099ed6"	"sbbg"	"sbbg123417"	"pine mountain: flat n of reyes pk trail, ca. 0.6 km nnw of reyes pk summit"	34.63702	-119.28322	"united states"	"california"	"ventura"	NA	200	"pinaceae"	"pinus"	"jeffreyi"	NA	"pinus jeffreyi"
"efba2dda-da49-4dbd-b622-bb8caf8a0522"	"obi"	"obi20192"	"mt figueroa"	34.7433	-119.9849	"united states"	"california"	"santa barbara"	NA	500	"pinaceae"	"pinus"	"jeffreyi"	NA	"pinus jeffreyi"
"efe3dc80-5ba6-48e4-b296-a0ad1e3bf73d"	"pom"	"pom156050"	"open pine forest. bear valley."	34.2571	-116.8962	"united states"	"california"	"san bernardino"	NA	7800	"pinaceae"	"pinus"	"jeffreyi"	NA	"pinus jeffreyi"
"f05cccba-9f44-49bc-810f-43c91b419b50"	"chsc"	"chsc84953"	"in rock pile about 25 yards north of humboldt peak, about 1/2 mile east of humboldt summit, about 8 miles (air) northeast of butte meadows"	40.1508333333333	-121.431666666667	"united states"	"california"	"butte"	NA	412	"pinaceae"	"pinus"	"jeffreyi"	NA	"pinus jeffreyi"
"f0ac7c47-c35d-4129-8f46-c81b7901758a"	"ds"	"ds558237"	"7 miles west of sonora pass."	38.318	-119.731	"united states"	"california"	"tuolumne"	NA	500	"pinaceae"	"pinus"	"jeffreyi"	NA	"pinus jeffreyi"
"f0c59854-bad7-4329-a0f2-84b98232e77b"	"ucsb"	"ucsb9212"	"5.2 miles east of idyllwild on idyllwild-banning hwy."	33.6972	-116.7153	"united states"	"california"	"riverside"	NA	1150	"pinaceae"	"pinus"	"jeffreyi"	NA	"pinus jeffreyi"
"f0fe3eb0-8c4c-4d0c-935f-324697c9809b"	"ucr"	"ucr195299"	"southern sierra nevada owens peak eastern watershed, along the pacific crest trail, on the northeast side of mount jenkins"	35.71056	-117.98889	"united states"	"california"	"kern"	NA	1000	"pinaceae"	"pinus"	"jeffreyi"	NA	"pinus jeffreyi"
"f1a2983a-3450-4ae8-bff5-53a1040e8b3c"	"rsa"	"rsa169029"	"table mountain, table mountain campground area; n-facing slope 3 miles north of big pines ranger station, angeles national forest"	34.3967	-117.6971	"united states"	"california"	"los angeles"	NA	800	"pinaceae"	"pinus"	"jeffreyi"	NA	"pinus jeffreyi"
"f1b78eec-d9e5-4e9e-acbe-fda1de610270"	"sd"	"sd16314"	"pine hills (ipb 5/07)"	33.04838	-116.63085	"united states"	"california"	"san diego"	NA	1650	"pinaceae"	"pinus"	"jeffreyi"	NA	"pinus jeffreyi"
"f1d0da7b-bba4-4cd0-a8f4-4374d86c44ca"	"uc"	"uc1571795"	"w of idria (on clear creek); san benito mts., clear creek"	36.3833167151133	-120.721817072165	"united states"	"california"	"san benito"	NA	6969	"pinaceae"	"pinus"	"jeffreyi"	NA	"pinus jeffreyi"
"f21144d7-1af4-4037-8dd0-55e9db455915"	"rsa"	"rsa237336"	"0.1 mile north of english lake. salmon mountains. high lake basins in the vicinity of english peak. marble mountain wilderness area."	41.4164	-123.21	"united states"	"california"	"siskiyou"	NA	208	"pinaceae"	"pinus"	"jeffreyi"	NA	"pinus jeffreyi"
"f29e4ff2-3bf6-41b2-bb00-8c64835eb352"	"cas"	"868635"	"about 1 mile west of pilot peak, about 9 miles north-east of la porte"	39.7836111111	-120.8866666667	"united states"	"california"	"plumas county"	NA	NA	"pinaceae"	"pinus"	"jeffreyi"	NA	"pinus jeffreyi  balf."
"f40019ea-f3c2-4e51-8697-5b6488eb6c33"	"cas"	"95212"	"metcalf's [ranch] ranch at the foot of mt. eddy"	41.3741622074079	-122.426679935244	"united states"	"california"	"siskiyou county"	NA	NA	"pinaceae"	"pinus"	"jeffreyi"	NA	"pinus jeffreyi  balf."
"f43b952b-3238-4b4a-a12d-55fee32232e3"	"uvsc"	"16824"	"bodie hills, masonic region, ca. 0.75 mile down masonic gulch from lower townsite."	38.367333	-119.12735	"united states"	"california"	"mono"	NA	NA	"pinaceae"	"pinus"	"jeffreyi"	NA	"pinus jeffreyi"
"f4724cb0-56ac-4af4-a832-5f821924f184"	"jeps"	"jeps104182"	"on the n side of the road to tamarack flat, ca 1/8 mi w of the intersection of lumpkin ridge rd and road to tamarack flat, ca 1 mi (air) nw of little grass valley reservoir dam, ca 4 mi (air) nw of la porte."	39.73389	-121.01778	"united states"	"california"	"plumas"	NA	NA	"pinaceae"	"pinus"	"jeffreyi"	NA	"pinus jeffreyi"
"f480777b-e130-4478-aa02-06b8b12c1e8e"	"chsc"	"chsc109842"	"northern high sierra nevada. southwestern spur of rocky ridge, 0.6 air km south of batchelor point; along road 23n06e 0.8 road km southeast of rim road/ponderosa way"	39.7808333333333	-121.478888888889	"united states"	"california"	"butte"	NA	NA	"pinaceae"	"pinus"	"jeffreyi"	NA	"pinus jeffreyi"
"f53b2274-fcfb-4ebb-8bf9-ae3316f0bf17"	"hsc"	"hsc78797"	"bear lakes area, e of little bear lake"	41.1901	-122.6979	"united states"	"california"	"trinity"	NA	38	"pinaceae"	"pinus"	"jeffreyi"	NA	"pinus jeffreyi"
"f62e0a32-9de2-45c3-b8e1-f4b1008e958e"	"ucd"	"ucd134714"	"amador county: northern sierra nevada mountains: junction of tonzi road and ca--124 about 7 miles north of ione"	38.4061111110263	-120.893888888446	"united states"	"california"	"amador"	NA	1000	"pinaceae"	"pinus"	"jeffreyi"	NA	"pinus jeffreyi"
"f671bfac-cca5-4c96-a90a-362e4a894b0e"	"pom"	"pom126999"	"metcalf\'s ranch at the foot of mt. eddy."	41.3741717400838	-122.426727568923	"united states"	"california"	"siskiyou"	NA	2504	"pinaceae"	"pinus"	"jeffreyi"	NA	"pinus jeffreyi"
"f745a4bd-0533-4353-815b-63c5f5ae7426"	"rsa"	"rsa682537"	"alpers canyon: along fs rd. 2s04, above big switchbacks."	37.7777777777778	-118.943333333333	"united states"	"california"	"mono"	NA	NA	"pinaceae"	"pinus"	"jeffreyi"	NA	"pinus jeffreyi"
"f82229d4-5a38-43a9-a2e5-c2ed627177a1"	"cas"	"cas484400"	"[tom\'s] toms place, highway 395"	37.5616	-118.6807	"united states"	"california"	"mono"	NA	1000	"pinaceae"	"pinus"	"jeffreyi"	NA	"pinus jeffreyi"
"f872a1d0-9378-478a-b84d-5074061abd95"	"ucsb"	"ucsb16192"	"vincent gap, 6 mi. west of big pines on u.s. highway 2"	34.3732	-117.7528	"united states"	"california"	"los angeles"	NA	800	"pinaceae"	"pinus"	"jeffreyi"	NA	"pinus jeffreyi"
"f8898850-1759-4d63-8346-a7d9b6d0a5cb"	"ucr"	"ucr149924"	"eastern san gabriel mtns. wrightwood at wright lake"	34.36028	-117.64222	"united states"	"california"	"san bernardino"	NA	1000	"pinaceae"	"pinus"	"jeffreyi"	NA	"pinus jeffreyi"
"f8d29f86-3ed8-4a4f-a0ad-b5c46d735b13"	"obi"	"obi36538"	"ca. 4 mi se of sr 299 along titlow hill rd below horse mtn summit rd"	40.8654	-123.7379	"united states"	"california"	"humboldt"	NA	399	"pinaceae"	"pinus"	"jeffreyi"	NA	"pinus jeffreyi"
"f8d8fbe6-8345-41a4-9669-47c1a7b84ef4"	"cas"	"cas361594"	"between monache and summit meadows."	36.2114	-118.1213	"united states"	"california"	"tulare"	NA	1400	"pinaceae"	"pinus"	"jeffreyi"	NA	"pinus jeffreyi"
"f8dc9145-341e-47af-aa0a-347f208fda33"	"cas"	"297637"	"1/2 mile n.w. of lundy, east slope of sierra nevada"	38.029	-119.2501	"united states"	"california"	"mono county"	NA	NA	"pinaceae"	"pinus"	"jeffreyi"	NA	"pinus jeffreyi  balf."
"f9b13011-1308-4a24-8695-ade233bb7f7b"	"ds"	"ds212004"	"lundy lake, northwest of mono lake, east slope of the sierra nevada mountains"	38.0293	-119.2301	"united states"	"california"	"mono"	NA	2100	"pinaceae"	"pinus"	"jeffreyi"	NA	"pinus jeffreyi"
"fa1b8626-30e1-435f-88b5-250a89e9d61f"	"hsc"	"hsc52129"	"near gasquet mtn., close to the town of gasquet"	41.87788889	-123.9924444	"united states"	"california"	"del norte"	NA	NA	"pinaceae"	"pinus"	"jeffreyi"	NA	"pinus jeffreyi"
"fac75652-3966-4214-8af6-1e85ef9d9696"	"cas"	"459574"	"whitney portal [road] road"	36.5954	-118.2137	"united states"	"california"	"inyo county"	NA	NA	"pinaceae"	"pinus"	"jeffreyi"	NA	"pinus jeffreyi  balf."
"fb727787-8c70-4086-917e-2d45dccf6777"	"ds"	"ds211988"	"mono mills, south of mono lake"	37.8879	-118.9603	"united states"	"california"	"mono"	NA	1400	"pinaceae"	"pinus"	"jeffreyi"	NA	"pinus jeffreyi"
"fbaea527-a2de-4b0c-83ea-903fcd093f02"	"rsa"	"rsa6910"	"south end of mono lake. desert of granitic sand and gravel, just east of mono craters and north of mono mills."	37.9003	-118.9819	"united states"	"california"	"mono"	NA	2000	"pinaceae"	"pinus"	"jeffreyi"	NA	"pinus jeffreyi"
"fbb65d45-6fe3-460d-892e-c7cc02108912"	"ucr"	"ucr256141"	"san gabriel mountains crystal lake, within 50 ft. of shore line around the entire perimeter"	34.31778	-117.84694	"united states"	"california"	"los angeles"	NA	1000	"pinaceae"	"pinus"	"jeffreyi"	NA	"pinus jeffreyi"
"fc1193e3-3a5a-4447-9d19-792242f64219"	"ucr"	"ucr202566"	"northern sierra nevada mountains along ca-89 at woodfords, 0.1 mile south of its junction with ca-88"	38.77417	-119.82222	"united states"	"california"	"alpine"	NA	1000	"pinaceae"	"pinus"	"jeffreyi"	NA	"pinus jeffreyi"
"fd2a91a2-d7fc-4cf8-8ee5-be7fee887d88"	"cas"	"cas577300"	"ne edge of echo lake, sw of lake tahoe, el dorado national forest."	38.8359	-120.045	"united states"	"california"	"el dorado"	NA	504	"pinaceae"	"pinus"	"jeffreyi"	NA	"pinus jeffreyi"
"fd3ef768-5b50-4111-bf19-a6de1ec6922c"	"ds"	"ds61397"	"cobb mt."	38.8073	-122.7406	"united states"	"california"	"lake"	NA	2500	"pinaceae"	"pinus"	"jeffreyi"	NA	"pinus jeffreyi"
"ff092b84-aeb6-4b6f-a9a0-5ea434752e83"	"rsa"	"rsa6219"	"gold lake"	39.6779	-120.6562	"united states"	"california"	"sierra"	NA	1559	"pinaceae"	"pinus"	"jeffreyi"	NA	"pinus jeffreyi"
"ff25be0e-a102-43fb-b026-37ff0518e340"	"rsa"	"rsa248917"	"mt. san antonio"	34.2892	-117.647	"united states"	"california"	"san bernardino"	NA	4500	"pinaceae"	"pinus"	"jeffreyi"	NA	"pinus jeffreyi"
