"fa4562a1-a9a4-4ef1-96ed-95569c5c3420"	"uc"	"uc1534906"	"mouth of pellisier creek, white mountains, owens valley drainage pellisier creek; white mountains, pellisier creek"	37.716730896463	-118.358048961257	"united states"	"california"	"mono"	NA	825	"rosaceae"	"prunus"	"andersonii"	NA	"prunus andersonii"
"fb6b0307-1005-4c75-bb02-3277679d98f9"	"rsa"	"rsa682728"	"n edge of long valley: s-facing granitic slopes leading up from valley floor, n of ranch road."	37.7566666666667	-118.799722222222	"united states"	"california"	"mono"	NA	NA	"rosaceae"	"prunus"	"andersonii"	NA	"prunus andersonii"
"fc185764-22af-4fe6-9e7f-3c46cba850b6"	"cas"	"1201886"	"southern sierra nevada: scodie mountains, kiavah wilderness. sequoia national forest: horse canyon, about 0.10 (air)miles n of horse canyon road, along a wash"	35.56686	-118.08819	"united states"	"california"	"kern county"	NA	NA	"rosaceae"	"prunus"	"andersonii"	NA	"prunus andersonii  a. gray"
"fc768238-26b6-4b86-aa8f-25757f1f4c90"	"cas"	"270597"	"batchelder spring, w. side of westgard pass"	37.243066	-118.194463	"united states"	"california"	"inyo county"	NA	NA	"rosaceae"	"prunus"	"andersonii"	NA	"prunus andersonii  a. gray"
"fc820870-11eb-4c5f-8e0a-ca05d8a07e4f"	"pom"	"pom275660"	"canebrake creek, s. fork kern river. piute mt"	35.7283	-118.1695	"united states"	"california"	"kern"	NA	10000	"rosaceae"	"prunus"	"andersonii"	NA	"prunus andersonii"
"fe52a327-1483-4ecd-adc2-83079e0f42e4"	"cas"	"cas438760"	"willow spring, last chance mts."	37.3362007141	-117.7126998901	"united states"	"california"	"inyo"	NA	410	"rosaceae"	"prunus"	"andersonii"	NA	"prunus andersonii"
"fedbb6fe-c49b-41be-be5e-529cbc9471c5"	"sd"	"sd51292"	"1.6 miles from entrance to inyo nat. forest on road to westgard pass."	37.246	-118.1853	"united states"	"california"	"inyo"	NA	300	"rosaceae"	"prunus"	"andersonii"	NA	"prunus andersonii"
"fef6bff2-2946-4573-9362-9afaf61ddf2e"	"uc"	"uc696088"	"w of summit on walker pass road walker pass road; sierra nevada, walker pass road"	35.6624827239142	-118.025736565943	"united states"	"california"	"kern"	NA	425	"rosaceae"	"prunus"	"andersonii"	NA	"prunus andersonii"
"ff3f10fa-5c77-4287-9095-5c0535ef7609"	"rsa"	"rsa118722"	"sierra nevada: north fork of bishop creek, 16miles sw of bishop."	37.2582	-118.577	"united states"	"california"	"inyo"	NA	335	"rosaceae"	"prunus"	"andersonii"	NA	"prunus andersonii"
"ff57dd76-300e-46fc-ac6a-2522c98c94af"	"cas"	"228345"	"pine creek, sierra nevada, (near round valley)"	37.4013	-118.6502	"united states"	"california"	"inyo county"	NA	NA	"rosaceae"	"prunus"	"andersonii"	NA	"prunus andersonii  a. gray"
"ff597325-71ff-4c8b-a19d-eeb57da618dc"	"cas"	"333716"	"upper shores of mono lake at mono [postoffice] post office"	37.9899	-119.1428	"united states"	"california"	"mono county"	NA	NA	"rosaceae"	"prunus"	"andersonii"	NA	"prunus andersonii  a. gray"
"ff7c1641-12fa-4739-a938-cc546a347f4e"	"sbbg"	"sbbg27267"	"w side of westgard pass, inyo mtns"	37.2459291334592	-118.179931837055	"united states"	"california"	"inyo"	NA	NA	"rosaceae"	"prunus"	"andersonii"	NA	"prunus andersonii"
