"37de9e64-6dad-4b06-8859-f5d69ab77d6a"	"sbbg"	"sbbg125768"	"santa lucia mtns: toward e end of sam jones cyn, ca. 1.3 km s of san antonio river, ca. 2.5 km wnw of quail top, ca. 2.1 rd km sw of sam jones rd bridge over san antonio river; ft hunter liggett"	35.9037673673949	-121.13742976575	"united states"	"california"	"monterey"	NA	1200	"fagaceae"	"quercus"	"wislizeni"	"frutescens"	"quercus wislizeni var. frutescens"
"37e21b93-e789-462b-becd-93d5887d94bc"	"cda"	"cda22082"	"road cut along marsh creek rd about 1.5 miles w of deer valley rd."	37.8833333333333	-121.8	"united states"	"california"	"contra costa"	NA	NA	"fagaceae"	"quercus"	"wislizeni"	"wislizeni"	"quercus wislizeni var. wislizeni"
"381103d2-aebd-42b7-bd58-57055aed0344"	"uc"	"uc1135827"	"1.5 mi ne forty-nine gap; sonora quad."	37.6457326724486	-120.290223113468	"united states"	"california"	"mariposa"	NA	825	"fagaceae"	"quercus"	"wislizeni"	NA	"quercus wislizeni"
"381a86a2-15be-46e6-80b7-931848de7f3a"	"hsc"	"hsc84759"	"cold springs lookout, sw of philo on signal ridge rd."	39.0223	-123.5229	"united states"	"california"	"mendocino"	NA	569	"fagaceae"	"quercus"	"wislizeni"	NA	"quercus wislizeni"
"38339f77-93fc-4ffb-8c5c-d9fba5d3e4d9"	"cas"	"cas575805"	"kern river canyon above roads end. sierra nevada"	35.937	-118.4855	"united states"	"california"	"tulare"	NA	2561	"fagaceae"	"quercus"	"wislizeni"	NA	"quercus wislizeni"
"3860dcc7-a63d-48f1-a735-4bcf90ae0565"	"cas"	"520111"	"san bruno mountainin northern part of county."	37.6833333333	-122.4333333333	"united states"	"california"	"san mateo county"	NA	NA	"fagaceae"	"quercus"	"wislizeni"	NA	"quercus wislizeni  a. dc."
"3876c597-48cc-4238-821b-df6c87950368"	"ucsb"	"ucsb34697"	"9 mi nw of idyllwild (on ca hwy 243)"	33.7957	-116.7462	"united states"	"california"	"riverside"	NA	1000	"fagaceae"	"quercus"	"wislizeni"	"frutescens"	"quercus wislizeni var. frutescens"
"38858cb7-2712-42f9-b092-1e7e9a6e415f"	"ucsb"	"ucsb36266"	"6 mi n of wofford blvd on kern river rd kernville (hospital flat campground)"	35.8282	-118.4602	"united states"	"california"	"kern"	NA	3800	"fagaceae"	"quercus"	"wislizeni"	NA	"quercus wislizeni"
"38d4aa63-e33b-42ed-aa02-eed0ea27f6f6"	"ds"	"ds281423"	"on state highway #120, 1 mile w of junction with big oak flat road between knight\'s ferry and jamestown"	37.8196265893608	-120.078718856093	"united states"	"california"	"tuolumne"	NA	1828	"fagaceae"	"quercus"	"wislizeni"	NA	"quercus wislizeni"
"38de63d4-caa7-43cc-a8f4-1ccc77a08148"	"ucd"	"ucd47658"	"ca. 4 mi. southwest of coloma, specifically 1/4 mi. south of luneman rd., and 2.2 mi. west of intersection of luneman rd. and lotus rd., (sw 1/4, ne 1/4, s34; t 11 n, r 9 e.)"	38.767	-120.9595	"united states"	"california"	"el dorado"	NA	530	"fagaceae"	"quercus"	"wislizeni"	"wislizeni"	"quercus wislizeni var. wislizeni"
"38e8a282-1a5c-4708-b952-d27b4954fe2d"	"chsc"	"chsc3613"	"collected 3 miles west of hayfork"	40.5625	-123.237777777778	"united states"	"california"	"trinity"	NA	825	"fagaceae"	"quercus"	"wislizeni"	NA	"quercus wislizeni"
"39335b54-40a7-4b01-9bc4-f8159cc6b95a"	"ucd"	"ucd147530"	"napa county: knoxville public lands. california department of fish and wildlife property. headwaters of nevada creek. most northwestern part of property"	38.77348	-122.33501	"united states"	"california"	"napa"	NA	NA	"fagaceae"	"quercus"	"wislizeni"	"frutescens"	"quercus wislizeni var. frutescens"
"39361186-0df3-4800-a581-102ad4456bd9"	"jeps"	"jeps46713"	"kaweah basin"	36.5451379229767	-118.480426079377	"united states"	"california"	"tulare"	NA	2818	"fagaceae"	"quercus"	"wislizeni"	NA	"quercus wislizeni"
"39408ac4-a139-40ac-b4b0-f6bc03ad6e68"	"pom"	"pom270294"	"mt. konocti, west side, middle n coast mt. range, clear lake watershed."	38.9797	-122.8071	"united states"	"california"	"lake"	NA	3344	"fagaceae"	"quercus"	"wislizeni"	NA	"quercus wislizeni"
"39464055-f190-4f51-903b-d0eac20c258d"	"ucr"	"ucr184537"	"tehachapi mtns. johnson canyon above bear trap canyon, c. 7 miles ne of lebec in vicinity of calif. aqueduct tunnel"	34.88194	-118.76278	"united states"	"california"	"kern"	NA	1000	"fagaceae"	"quercus"	"wislizeni"	NA	"quercus wislizeni"
"3961bb52-b56f-4ccb-aeca-7bb8dc015d5c"	"ucr"	"ucr210290"	"san gabriel mtns. stoddard flats, ene of stoddard peak, c. 1.5 mi. south of barrett village along both sides of barrett-stoddard rd."	34.20111	-117.66083	"united states"	"california"	"san bernardino"	NA	1000	"fagaceae"	"quercus"	"wislizeni"	NA	"quercus wislizeni"
"397c5ab2-ffab-4237-a686-6b61ed75bb35"	"ucr"	"ucr91627"	"agua tibia mountains cleveland national forest, agua tibia wilderness, e slope of agua tibia mtn, west of arroyo seco drainage, along the crosley trail."	33.40583	-116.96417	"united states"	"california"	"san diego"	NA	NA	"fagaceae"	"quercus"	"wislizeni"	"frutescens"	"quercus wislizeni var. frutescens"
"399ae7a2-f9e9-41e6-adf1-16b6c372670f"	"uc"	"uc848380"	"1 mi w state highway 120 junction with big oak flat road (on state highway 120, between knight\'s ferry and jamestown)"	37.8195865901368	-120.078698855743	"united states"	"california"	"tuolumne"	NA	1828	"fagaceae"	"quercus"	"wislizeni"	NA	"quercus wislizeni"
"39b30e52-8a93-47fb-af4d-ec1c1da02933"	"ucd"	"ucd47621"	"north slope of montecito peak, just below summit, southeastern santa barbara county, california"	34.4719277777778	-119.636625	"united states"	"california"	"santa barbara"	NA	NA	"fagaceae"	"quercus"	"wislizeni"	"frutescens"	"quercus wislizeni var. frutescens"
"39db1dde-b638-4412-bd38-51415e05b3be"	"uc"	"uc473891"	"vicinity pelican bay; santa cruz island"	34.0320440526741	-119.703302092807	"united states"	"california"	"santa barbara"	NA	1000	"fagaceae"	"quercus"	"wislizeni"	NA	"quercus wislizeni"
"3a190047-e8a4-479c-baf4-c0a27fc4ecf3"	"uc"	"uc566169"	"1/4 mi se kelley ranch (3 mi nw redrock mt.)"	34.6845	-118.6617	"united states"	"california"	"los angeles"	NA	300	"fagaceae"	"quercus"	"wislizeni"	NA	"quercus wislizeni"
"3a1c3fd1-1a3e-4389-97e6-06f1dd4b7518"	"uc"	"uc1135920"	"0.5 mi n pinehurst; concord quad."	37.8308265198183	-122.144976548668	"united states"	"california"	"contra costa"	NA	825	"fagaceae"	"quercus"	"wislizeni"	"frutescens"	"quercus wislizeni var. frutescens"
"3a3f8351-cae9-4d88-91b2-797f762653b4"	"sd"	"sd142945"	"jacumba wilderness area, in-koh-pah mountains, smuggler\'s cave area south of mountain spring, along us/mexico border. (ipb 10/07)"	32.63262	-116.08724	"united states"	"california"	"imperial"	NA	412	"fagaceae"	"quercus"	"wislizeni"	"frutescens"	"quercus wislizeni var. frutescens"
"3a4a0f0d-0bbb-4f6d-b57b-8182d916cfd1"	"cas"	"cas177697"	"trail to top of mt. st. helena"	38.6604479	-122.6163482	"united states"	"california"	"napa"	NA	1625	"fagaceae"	"quercus"	"wislizeni"	NA	"quercus wislizeni"
"3a5a9a23-8e37-421a-bcbd-3e1ff79c6d14"	"rsa"	"rsa716341"	"e of rainbow canyon, n of rainbow heights, termite\'s hike trail. utm: 11s 0490122e 3699671n (nad83)."	33.4364	-117.1063	"united states"	"california"	"riverside"	NA	1000	"fagaceae"	"quercus"	"wislizeni"	"frutescens"	"quercus wislizeni var. frutescens"
"3a648545-ab55-439e-b9fd-4e1bcfb7118f"	"sjsu"	"sjsu10138"	"cow mt recreational area, lower benmore region"	39.0129	-123.0219	"united states"	"california"	"lake"	NA	2750	"fagaceae"	"quercus"	"wislizeni"	"frutescens"	"quercus wislizeni var. frutescens"
"3a6d4a90-f606-4aca-9bcb-670ddab2544e"	"sd"	"sd220372"	"aguanga mountain, cleveland national forest, along high point road, near 4.5 miles sse of junction highway 79 and cahuilla road (sr 371) at mile 8 of forest service 8s05."	33.38583	-116.82833	"united states"	"california"	"san diego"	NA	NA	"fagaceae"	"quercus"	"wislizeni"	"frutescens"	"quercus wislizeni var. frutescens"
"3a9fd573-843c-4d03-9459-a95ebf52207d"	"cas"	"cas518442"	"along road to banning 6.1 miles nw of lake fulmor, san jacinto mountains"	33.8539	-116.8315	"united states"	"california"	"riverside"	NA	1000	"fagaceae"	"quercus"	"wislizeni"	NA	"quercus wislizeni"
"3ad7f9d7-f00f-458f-9f02-0e2f5ec4e52d"	"uc"	"uc1790089"	"viejas mountain: north of alpine, approx. 0.5 miles north of the water tanks on anderson truck trail; east of the road along the main trail to the top"	32.8608	-116.73	"united states"	"california"	"san diego"	NA	NA	"fagaceae"	"quercus"	"wislizeni"	"frutescens"	"quercus wislizeni var. frutescens"
"3b5caa95-cf8e-4c7f-9e1c-7bf0e925609d"	"uc"	"uc1927582"	"sierra nevada; southern sierra nevada region; the owens peak eastern watershed. short canyon. sw side of canyon."	35.7114	-117.9258	"united states"	"california"	"kern"	NA	NA	"fagaceae"	"quercus"	"wislizeni"	NA	"quercus wislizeni"
"3b7c3343-950e-4519-a79e-8eb1a7287a74"	"uc"	"uc1135876"	"1 mi ene saddle peak; san luis obispo national forest, port san luis quad."	35.2306751517613	-120.781310028153	"united states"	"california"	"san luis obispo"	NA	825	"fagaceae"	"quercus"	"wislizeni"	NA	"quercus wislizeni"
"3b847c79-a615-4818-b229-4a60ce85f0b8"	"rsa"	"rsa711101"	"rancho los flores"	34.3286111111111	-117.2725	"united states"	"california"	"san bernardino"	NA	NA	"fagaceae"	"quercus"	"wislizeni"	"frutescens"	"quercus wislizeni var. frutescens"
"3bbf4f56-f918-4b4b-927e-66bde4c7fa71"	"pom"	"pom106367"	"mt tamalpais."	37.9238	-122.5976	"united states"	"california"	"marin"	NA	5000	"fagaceae"	"quercus"	"wislizeni"	"wislizeni"	"quercus wislizeni var. wislizeni"
"3bc45b97-de4d-48fe-b00e-78d5f2205d3a"	"ucr"	"ucr235096"	"western san bernardino mountains cajon pass area, cleghorn road (dirt) above powerlines, 1.6 miles airline ene (98&deg;) of cajon junction"	34.30858	-117.44712	"united states"	"california"	"san bernardino"	NA	100	"fagaceae"	"quercus"	"wislizeni"	NA	"quercus wislizeni"
"3c15174e-9872-4fd5-86ac-c493d2bd0460"	"rsa"	"rsa296120"	"san bernardino mts, white canyon: 3.2 miles upstream from trout farm."	34.0239	-116.6976	"united states"	"california"	"riverside"	NA	750	"fagaceae"	"quercus"	"wislizeni"	"frutescens"	"quercus wislizeni var. frutescens"
"3c23c341-04c4-47b7-900f-79f71294f683"	"ucd"	"ucd47648"	"1.9 miles below summit (via jeep ""road""); junipero serra peak, santa lucia mountains, monterey county, california"	36.1343694444445	-121.408644444444	"united states"	"california"	"monterey"	NA	NA	"fagaceae"	"quercus"	"wislizeni"	NA	"quercus wislizeni"
"3c5d4c64-e010-4d20-9e2d-940d6636e113"	"jeps"	"jeps46712"	"north fork of the kaweah sierra nevadas"	36.5696	-118.903	"united states"	"california"	"tulare"	NA	10788	"fagaceae"	"quercus"	"wislizeni"	NA	"quercus wislizeni"
"3c7b56c5-b71c-43ac-a462-ef0dd7465013"	"sdsu"	"sdsu6994"	"6 miles from mountain center on the road to hemet."	33.7105	-116.7699	"united states"	"california"	"riverside"	NA	1000	"fagaceae"	"quercus"	"wislizeni"	NA	"quercus wislizeni"
"3cd0178a-eb5f-42a8-a039-abebdebce6e3"	"hsc"	"hsc29951"	"hillside beside lake mendocino"	39.2374	-123.1651	"united states"	"california"	"mendocino"	NA	1259	"fagaceae"	"quercus"	"wislizeni"	NA	"quercus wislizeni"
"3cd86665-2653-4007-a6eb-58b4ea02914d"	"uc"	"uc1135899"	"4 mi s of los coches"	34.9257786243395	-120.25028817568	"united states"	"california"	"santa barbara"	NA	825	"fagaceae"	"quercus"	"wislizeni"	NA	"quercus wislizeni"
"3d0c32fe-c059-4ef8-83c7-2176caeb8600"	"pom"	"pom18130"	"santa ana mts. from holy jim canyon to santiago peak."	33.701	-117.5238	"united states"	"california"	"orange"	NA	1500	"fagaceae"	"quercus"	"wislizeni"	"frutescens"	"quercus wislizeni var. frutescens"
"3d5d45d7-ff00-47d5-a79f-e150f11e87bd"	"obi"	"obi74379"	"tierra redonda mtn."	35.772803	-120.984136	"united states"	"california"	"san luis obispo"	NA	NA	"fagaceae"	"quercus"	"wislizeni"	"frutescens"	"quercus wislizeni var. frutescens"
"3d679551-23d1-4e2e-b240-b0445d69deb9"	"rsa"	"rsa477146"	"big basin."	37.1689	-122.2208	"united states"	"california"	"santa cruz"	NA	10000	"fagaceae"	"quercus"	"wislizeni"	"wislizeni"	"quercus wislizeni var. wislizeni"
"3d7f46cb-3a2c-4bd1-b505-d6e3bd37ee3c"	"sfv"	"sfv8503"	"sierra nevada on ca-highway 20, 5 miles west of rough and ready."	39.202	-121.21	"united states"	"california"	"nevada"	NA	2500	"fagaceae"	"quercus"	"wislizeni"	NA	"quercus wislizeni"
"3d84c703-1c77-46bc-9e7f-d49e75b6fe53"	"cas"	"cas177701"	"knight\'s ferry"	37.8201276624079	-120.671938327383	"united states"	"california"	"stanislaus"	NA	1179	"fagaceae"	"quercus"	"wislizeni"	NA	"quercus wislizeni"
"3db7a9bc-1f2b-4b68-9bc2-39a4deca03c3"	"ucr"	"ucr231344"	"peninsular range; santa ana mtns. near pleasants peak along the main divide truck trail"	33.79686	-117.61492	"united states"	"california"	"orange"	NA	100	"fagaceae"	"quercus"	"wislizeni"	NA	"quercus wislizeni"
"3de801a0-9da7-41e0-8861-fc6dbc2720a4"	"cas"	"cas394007"	"w of saddle between junipero serra & pinyon peaks"	36.1682	-121.4104	"united states"	"california"	"monterey"	NA	1000	"fagaceae"	"quercus"	"wislizeni"	NA	"quercus wislizeni"
"3e2212e7-3a99-4645-82d6-96c41cfca278"	"cas"	"518442"	"along road to banning 6.1 miles nw of lake fulmor, san jacinto mountains"	33.8539	-116.8315	"united states"	"california"	"riverside county"	NA	NA	"fagaceae"	"quercus"	"wislizeni"	NA	"quercus wislizeni  a. dc."
"3e59cee7-8277-4bc4-a210-15eec71b876b"	"sact"	"sact002734"	"waldorf school, american river, sacramento, ca"	38.6322	-121.2873	"united states"	"california"	"yolo"	NA	310	"fagaceae"	"quercus"	"wislizeni"	NA	"quercus wislizeni"
"3ec34691-723d-4e79-b800-765e3d83e282"	"pom"	"pom270270"	"above muir woods, seaward n coast mt. range, pacific ocean watershed."	37.9001	-122.5857	"united states"	"california"	"marin"	NA	2000	"fagaceae"	"quercus"	"wislizeni"	"wislizeni"	"quercus wislizeni var. wislizeni"
"3ec60755-d7cb-4ed1-8cff-5ddac5e737a8"	"ds"	"ds588750"	"vicinity of loma prieta road and road leading to loma prieta lookout"	37.095	-121.8466666667	"united states"	"california"	"santa cruz"	NA	NA	"fagaceae"	"quercus"	"wislizeni"	NA	"quercus wislizeni"
"3ee00238-36e1-47cc-8714-e1fb4c3f45e1"	"rsa"	"rsa3328"	"snow creek, 100yds above the fish hatchery, north base of san jacinto mts. alt 2000ft"	33.8724	-116.6811	"united states"	"california"	"riverside"	NA	250	"fagaceae"	"quercus"	"wislizeni"	"frutescens"	"quercus wislizeni var. frutescens"
"3f499676-efa1-43b0-911c-fa806927f5eb"	"uc"	"uc1199523"	"harris grade"	34.7331	-120.4403	"united states"	"california"	"santa barbara"	NA	5100	"fagaceae"	"quercus"	"wislizeni"	NA	"quercus wislizeni"
"3f58bc81-94d3-459e-ab67-777758ae508a"	"jeps"	"jeps46306"	"between west point and bootjack camp (on bolinas road); mount tamalpais"	37.9127325837825	-122.596816423031	"united states"	"california"	"marin"	NA	838	"fagaceae"	"quercus"	"wislizeni"	"frutescens"	"quercus wislizeni var. frutescens"
"3f668718-2c68-4bd5-bebc-a633537ba56f"	"uc"	"uc1222294"	"7 mi n harris; mail ridge"	40.1502	-123.7076	"united states"	"california"	"humboldt"	NA	537	"fagaceae"	"quercus"	"wislizeni"	NA	"quercus wislizeni"
"3f7097a8-0bf2-464b-9b4a-b3beb247c416"	"cas"	"181485"	"slope of summit of grizzley peak, berkeley hills"	37.8821	-122.2338	"united states"	"california"	"alameda county"	NA	NA	"fagaceae"	"quercus"	"wislizeni"	NA	"quercus wislizeni  a. dc."
"40561b0c-8f24-46ab-8faa-a2e8aaffe64a"	"pom"	"pom106177"	"forest- ranch."	39.8822	-121.6717	"united states"	"california"	"butte"	NA	3360	"fagaceae"	"quercus"	"wislizeni"	NA	"quercus wislizeni"
"4066dfe3-2383-4308-b6ff-07a7135416cb"	"cas"	"277065"	"snow crrek, 100 yds. above the fish hatchery, n base of san jacinto mts."	33.8724	-116.6811	"united states"	"california"	"riverside county"	NA	NA	"fagaceae"	"quercus"	"wislizeni"	NA	"quercus wislizeni  a. dc."
"40a6e85b-109d-4f44-a6cc-dc3adf1add72"	"ucd"	"ucd47654"	"seven miles northeast of annapolis, section 19, t 11n, r 13w, sonoma county"	38.7866166666667	-123.275402777778	"united states"	"california"	"sonoma"	NA	NA	"fagaceae"	"quercus"	"wislizeni"	NA	"quercus wislizeni"
"40d0aa6d-a7ae-4e2e-a87d-e431c4143737"	"jeps"	"jeps37954"	"ukiah valley"	39.1489101066548	-123.207216403307	"united states"	"california"	"mendocino"	NA	11769	"fagaceae"	"quercus"	"wislizeni"	NA	"quercus wislizeni"
"4165bb42-22b6-4f88-952b-9560318a3e16"	"ucr"	"ucr158813"	"santa ana mtns. near head of holy jim canyon, a major tributary of trabuco canyon, along the trail in the switchbacks, below the towers on santiago peak"	33.69839	-117.52217	"united states"	"california"	"orange"	NA	100	"fagaceae"	"quercus"	"wislizeni"	NA	"quercus wislizeni"
"418d8327-ad2d-4181-922d-fcaea918c793"	"jeps"	"jeps37963"	"delta"	40.94444	-122.42361	"united states"	"california"	"shasta"	NA	NA	"fagaceae"	"quercus"	"wislizeni"	NA	"quercus wislizeni"
"4195ce79-3138-41ce-93a8-632824d36bc2"	"ucd"	"ucd47594"	"gorman- bell road, between gorman\'s and u.s highway 395, oak creek, northwest of independence, inyo county, california"	36.8265388888889	-118.219669444444	"united states"	"california"	"inyo"	NA	NA	"fagaceae"	"quercus"	"wislizeni"	NA	"quercus wislizeni"
"419f0635-58c5-4bdc-8827-7d1aab1b59a3"	"uc"	"uc1135896"	"ridge between ladd canyon and east fork canyon; corona quad."	33.7803176369332	-117.600882268533	"united states"	"california"	"orange"	NA	825	"fagaceae"	"quercus"	"wislizeni"	NA	"quercus wislizeni"
"41a4bebe-949c-4a53-8b04-181de75828b1"	"cda"	"cda16523"	"sierra madre mountains sierra madre rd. between entrance and miranda pine, &plusmn; 3 mi up from hwy 166. chaparral, oak woodland mosaic. common tree in woodland, w/ quercus douglasii to 25+ ft."	35.0991666666667	-120.079166666667	"united states"	"california"	"santa barbara"	NA	NA	"fagaceae"	"quercus"	"wislizeni"	"wislizeni"	"quercus wislizeni var. wislizeni"
"41aef657-11b8-4d3a-bb15-de205ede570e"	"cas"	"192697"	"2 mi n idyllwild, san jacinto mts."	33.7494	-116.7357	"united states"	"california"	"riverside county"	NA	NA	"fagaceae"	"quercus"	"wislizeni"	NA	"quercus wislizeni  a. dc."
"41d52697-8152-4ec5-821d-8bc1e5830b60"	"cas"	"83615"	"ione"	38.3561602966446	-120.934415879079	"united states"	"california"	"amador county"	NA	NA	"fagaceae"	"quercus"	"wislizeni"	NA	"quercus wislizeni  a. dc."
"42842f7f-2ea8-40d2-9a40-e3d259a4a2f0"	"sact"	"sact002727"	"northwest corner of parking lot."	38.65722	-121.21889	"united states"	"california"	"sacramento"	NA	NA	"fagaceae"	"quercus"	"wislizeni"	NA	"quercus wislizeni"
"42a08a34-75c8-4037-8598-115d8900c43c"	"rsa"	"rsa477138"	"near keene"	35.2232	-118.5622	"united states"	"california"	"kern"	NA	10000	"fagaceae"	"quercus"	"wislizeni"	NA	"quercus wislizeni"
"42ba3073-0e73-4a78-a1ad-dcefe618fbcb"	"uc"	"uc762353"	"above la honda; la honda creek"	37.3192	-122.2739	"united states"	"california"	"san mateo"	NA	3350	"fagaceae"	"quercus"	"wislizeni"	NA	"quercus wislizeni"
"42c9fd3c-f6d5-43f7-b2af-0f8b5662b7ec"	"rsa"	"rsa573406"	"cuddy canyon near lebec"	34.8213	-118.9228	"united states"	"california"	"kern"	NA	1400	"fagaceae"	"quercus"	"wislizeni"	NA	"quercus wislizeni"
"42fa9744-45d6-485c-923a-bcf103d0d662"	"clark-a"	"clark-a1528-4985"	"san bernardino mountains by south fork bluff; ; moonridge 7.5\'q"	34.15262	-116.84368	"united states"	"california"	"san bernardino"	NA	NA	"fagaceae"	"quercus"	"wislizeni"	NA	"quercus wislizeni"
"432d12f1-119e-4fa7-8476-cde0ba5dc3ad"	"sd"	"sd211611"	"east of rainbow canyon, north of rainbow heights, termite\'s hike trail"	33.43639	-117.10639	"united states"	"california"	"riverside"	NA	NA	"fagaceae"	"quercus"	"wislizeni"	"frutescens"	"quercus wislizeni var. frutescens"
"4344cc81-dfe2-4080-b7de-c7f98149abe0"	"ucsb"	"ucsb60958"	"1/2 mi. above bear creek camp"	39.3285	-122.8391	"united states"	"california"	"lake"	NA	500	"fagaceae"	"quercus"	"wislizeni"	"wislizeni"	"quercus wislizeni var. wislizeni"
"4356464e-fe28-4fb3-acb1-a41ae6c25c60"	"jeps"	"jeps37982"	"twin sisters peak"	38.3063134890612	-122.172781725428	"united states"	"california"	"solano"	NA	75	"fagaceae"	"quercus"	"wislizeni"	NA	"quercus wislizeni"
"43cc4797-aa69-42d1-958c-dcb5a097d434"	"cas"	"cas509747"	"foothill woodland along hwy. 49, 2.3 miles w of mariposa"	37.5108	-120.0271	"united states"	"california"	"mariposa"	NA	1500	"fagaceae"	"quercus"	"wislizeni"	NA	"quercus wislizeni"
"43e2386c-e344-439f-92e7-635dab4c7022"	"cas"	"cas568983"	"on ridge forming ne border of pleasant valley . n of corralitos"	37.005	-121.8214	"united states"	"california"	"santa cruz"	NA	1690	"fagaceae"	"quercus"	"wislizeni"	NA	"quercus wislizeni"
"43fe41c8-3065-472e-8a7e-63d6de7bfbe0"	"clark-a"	"clark-a1528-2909"	"san bernardino mountains ; forest falls 7.5\'q"	34.0869	-116.9151	"united states"	"california"	"san bernardino"	NA	3000	"fagaceae"	"quercus"	"wislizeni"	"frutescens"	"quercus wislizeni var. frutescens"
"44079e25-7f2f-4ba0-8cf1-b3f23467c735"	"ucd"	"ucd47493"	"california: american fork of the sacramento river. photo of holotype specimen at mo. citation: prodromus 16(2):67.1864"	38.6040722222222	-121.502761111111	"united states"	"california"	"sacramento"	NA	NA	"fagaceae"	"quercus"	"wislizeni"	NA	"quercus wislizeni"
"4435e781-193d-42bd-b127-6cb3e97090ce"	"uc"	"uc1281419"	"santa cruz island"	34.01	-119.73	"united states"	"california"	"santa barbara"	NA	9500	"fagaceae"	"quercus"	"wislizeni"	NA	"quercus wislizeni"
"444ea667-7e56-410e-808b-48475f810b77"	"ucd"	"ucd73482"	"riverside co.: san bernardino mtns.: morongo indian reservation, sag pond at se end of burro flats"	33.9833333333333	-116	"united states"	"california"	"riverside"	NA	NA	"fagaceae"	"quercus"	"wislizeni"	NA	"quercus wislizeni"
"445ff405-eac3-498b-b762-eef9433c98d6"	"uc"	"uc1135824"	"ash mtn - advance motor highway sequoia national park, tehipite quad."	36.503378	-118.869655	"united states"	"california"	"tulare"	NA	3315	"fagaceae"	"quercus"	"wislizeni"	NA	"quercus wislizeni"
"4483a957-8106-4570-bb20-f648ad349b30"	"uc"	"uc57498"	"pierson\'s mine"	34.403	-118.0717	"united states"	"california"	"los angeles"	NA	1000	"fagaceae"	"quercus"	"wislizeni"	NA	"quercus wislizeni"
"4494ca74-4585-4a68-98d4-ae96a0b90a6e"	"obi"	"obi53187"	"los padres natl forest. vicinity of aliso park campground sw of new cuyama and sw along jeep trail"	34.907	-119.7685	"united states"	"california"	"santa barbara"	NA	1000	"fagaceae"	"quercus"	"wislizeni"	"wislizeni"	"quercus wislizeni var. wislizeni"
"44aa1d90-36ab-4fad-841d-166c99f10ebf"	"uc"	"uc5685"	"saratoga"	37.26389	-122.02194	"united states"	"california"	"santa clara"	NA	NA	"fagaceae"	"quercus"	"wislizeni"	NA	"quercus wislizeni"
"44bd74bb-5eb5-45fb-8932-2aa9f6bb9418"	"sbbg"	"sbbg111477"	"sierra nevada: ca. 4 mi sw of coloma, 0.25 mi s of luneman rd and 2.2 mi w of intersection of luneman rd and lotus rd"	38.767	-120.9595	"united states"	"california"	"el dorado"	NA	530	"fagaceae"	"quercus"	"wislizeni"	"wislizeni"	"quercus wislizeni var. wislizeni"
"44cc2228-3a03-4d34-b6e9-0167049745f1"	"jeps"	"jeps37955"	"ukiah valley"	39.1489101066548	-123.207216403307	"united states"	"california"	"mendocino"	NA	11769	"fagaceae"	"quercus"	"wislizeni"	NA	"quercus wislizeni"
"44ce4fb2-9406-4f28-8090-d441076edbd2"	"ucsb"	"ucsb31742"	"crystal lake, san gahriel mountain range"	34.3218	-117.8381	"united states"	"california"	"los angeles"	NA	3000	"fagaceae"	"quercus"	"wislizeni"	"frutescens"	"quercus wislizeni var. frutescens"
"44d9aec1-a327-4147-83b9-63f3dc86a3f5"	"ucd"	"ucd60318"	"amador county: northern sierra nevada mountains: along ca e-16, 0.7 mile south of river pines"	38.5358333332775	-120.74666666699	"united states"	"california"	"amador"	NA	NA	"fagaceae"	"quercus"	"wislizeni"	"wislizeni"	"quercus wislizeni var. wislizeni"
"44ef590a-2574-4656-b8db-4d1bf233644a"	"uc"	"uc1196510"	"north dobbyn creek dobbyn creek"	40.2217	-123.6017	"united states"	"california"	"humboldt"	NA	696	"fagaceae"	"quercus"	"wislizeni"	NA	"quercus wislizeni"
"45094a31-d006-46fb-87c9-c831aaac38f0"	"ds"	"ds693538"	"w side santa anita canyon, san gabriel mts."	34.1999	-118.019	"united states"	"california"	"los angeles"	NA	4500	"fagaceae"	"quercus"	"wislizeni"	NA	"quercus wislizeni"
"452d5086-011c-4a87-b35d-14ad0a830237"	"uc"	"uc915721"	"near ukiah (s slope, lower part of canyon); mill creek canyon"	39.1183394295801	-123.118423792661	"united states"	"california"	"mendocino"	NA	2722	"fagaceae"	"quercus"	"wislizeni"	NA	"quercus wislizeni"
"4562786d-5350-4de8-b94c-3d48c1fa3db4"	"chsc"	"chsc59980"	"along a south bank of eticuera creek ca. 1-1/2 road miles north of lake berryessa. location is to the west of the berryessa-knoxville road (at the 20.00 mile marker) where the creek turns sharply to the nw, away from the road. (extends the range of q. agrifolia in this area by ca. 15 miles to the ne of the limits shown in griffin & critchfield, 1972)"	38.6963888888889	-122.289722222222	"united states"	"california"	"napa"	NA	412	"fagaceae"	"quercus"	"wislizeni"	NA	"quercus wislizeni"
"458ba651-1da9-49e9-b6b6-914275055abb"	"ucr"	"ucr144740"	"santa ana mtns. pine canyon, 4.1 km nw of modjeska peak"	33.73917	-117.57972	"united states"	"california"	"orange"	NA	1000	"fagaceae"	"quercus"	"wislizeni"	"frutescens"	"quercus wislizeni var. frutescens"
"45952787-4d85-4f2a-bba9-1ebd488387b3"	"ucsb"	"ucsb37465"	"5.8 mi n of nacimiento-ferguson rd cone peak road (13 mi e of hwy 1)"	36.0081	-121.401	"united states"	"california"	"monterey"	NA	60	"fagaceae"	"quercus"	"wislizeni"	"frutescens"	"quercus wislizeni var. frutescens"
"45dfb863-a21c-4eac-a3fc-b962bbdb4f26"	"ucr"	"ucr6730"	"sierra nevada mtns. foothills deer creek road, 1.9-2.9 mi from third bridge"	35.96056	-118.85139	"united states"	"california"	"tulare"	NA	10000	"fagaceae"	"quercus"	"wislizeni"	NA	"quercus wislizeni"
"45f7fc62-6189-45fc-a94b-ea8ee39a3beb"	"sbbg"	"sbbg59033"	"santa lucia mtns: rogers auto court, near big sur"	36.3704825341248	-121.808183603844	"united states"	"california"	"monterey"	NA	1000	"fagaceae"	"quercus"	"wislizeni"	"wislizeni"	"quercus wislizeni var. wislizeni"
"461c1cb3-e033-4e77-abc7-2e418bbf82e6"	"rsa"	"rsa169319"	"4 miles east of mormon bar."	37.4624	-119.8807	"united states"	"california"	"mariposa"	NA	500	"fagaceae"	"quercus"	"wislizeni"	"wislizeni"	"quercus wislizeni var. wislizeni"
