"c52d5ab7-e723-4b29-a902-4f723d7f3061"	"uc"	"uc674970"	"0.5 mi n and 5 mi w independence; south fork of oak creek"	36.8116	-118.2734	"united states"	"california"	"inyo"	NA	400	"fagaceae"	"quercus"	"wislizeni"	"wislizeni"	"quercus wislizeni var. wislizeni"
"c54fb31e-d76d-4a71-a894-a97ea288dd95"	"ds"	"ds558170"	"6 mi n of nacimiento summit on cone peak road"	36.048	-121.484	"united states"	"california"	"monterey"	NA	635	"fagaceae"	"quercus"	"wislizeni"	NA	"quercus wislizeni"
"c550ca1d-7f97-48d7-9ea7-d99439dbfac6"	"uc"	"uc1135909"	"laguna cleveland national forest, carrizo quad."	32.8078518815273	-116.468150185496	"united states"	"california"	"san diego"	NA	825	"fagaceae"	"quercus"	"wislizeni"	"frutescens"	"quercus wislizeni var. frutescens"
"c5567c61-7067-4a8d-9e37-ad0140bc00ab"	"jeps"	"jeps37828"	"felton"	37.05139	-122.07222	"united states"	"california"	"santa cruz"	NA	NA	"fagaceae"	"quercus"	"wislizeni"	NA	"quercus wislizeni"
"c57f89af-3ec4-4ba9-ab15-0570035e7c38"	"jeps"	"jeps46718"	"vacaville"	38.35667	-121.9867	"united states"	"california"	"solano"	NA	NA	"fagaceae"	"quercus"	"wislizeni"	NA	"quercus wislizeni"
"c5b5f737-5d7d-4fd2-9ace-0781a28ca6bf"	"ucd"	"ucd47608"	"near kenworthy ranger station, hemet valley, san jacinto mts"	33.6575861111111	-116.684975	"united states"	"california"	"riverside"	NA	NA	"fagaceae"	"quercus"	"wislizeni"	NA	"quercus wislizeni"
"c5dfa8eb-04ad-4348-b56e-62dca305e44b"	"uc"	"uc2029243"	"stanislaus national forest, merced river canyon, incline road. along north side of the merced river."	37.66236	-119.84643	"united states"	"california"	"mariposa"	NA	NA	"fagaceae"	"quercus"	"wislizeni"	"wislizeni"	"quercus wislizeni var. wislizeni"
"c620a0ee-e0d6-41a1-98d1-20f7eda7de52"	"ucsc"	"ucsc1116"	"pine flats, san gabriel mts. -"	34.2999992370605	-117.91667175293	"united states"	"california"	"los angeles"	NA	NA	"fagaceae"	"quercus"	"wislizeni"	NA	"quercus wislizeni"
"c66a356e-3a08-45b0-b8b2-f47b7d08cf78"	"cas"	"357384"	"north fork of eel river at crossing below mina (n of covelo)"	39.9383	-123.349	"united states"	"california"	"mendocino county"	NA	NA	"fagaceae"	"quercus"	"wislizeni"	NA	"quercus wislizeni  a. dc."
"c66ce027-16d9-47d9-9109-42758138f0d3"	"ds"	"ds48487"	"sulphur banks"	39.0008	-122.6703	"united states"	"california"	"lake"	NA	2500	"fagaceae"	"quercus"	"wislizeni"	NA	"quercus wislizeni"
"c6776788-36cf-4aa7-a43a-91b376fb6cdd"	"uc"	"uc1135847"	"1 mi e round valley; mt. diablo quad."	37.8597252600466	-121.76066476952	"united states"	"california"	"contra costa"	NA	825	"fagaceae"	"quercus"	"wislizeni"	NA	"quercus wislizeni"
"c68900ea-fb47-4ee7-8507-41f8f3e18701"	"cas"	"cas878013"	"camp nine road noertheast of vallecito"	38.1379	-120.3824	"united states"	"california"	"calaveras"	NA	1000	"fagaceae"	"quercus"	"wislizeni"	NA	"quercus wislizeni"
"c69a616b-a266-40de-b00c-7e4980a0085d"	"cas"	"392317"	"boulder creek highway"	37.15	-122.1666666667	"united states"	"california"	"santa cruz county"	NA	NA	"fagaceae"	"quercus"	"wislizeni"	NA	"quercus wislizeni  a. dc."
"c6f0874a-f284-4a6b-bf0b-8bf5209743fe"	"ucr"	"ucr170324"	"northern sierra nevada foothills [e of sacramento, c. 3 air mi nnw of placerville]; south fork of american river on the west side of calif. highway 193"	38.76639	-120.82222	"united states"	"california"	"el dorado"	NA	1000	"fagaceae"	"quercus"	"wislizeni"	NA	"quercus wislizeni"
"c7145d9a-a885-4873-a163-d8945ca945aa"	"cas"	"cas759559"	"page ranch. 6 mi w of yorkville. pyramid rock meadow"	38.8744	-123.3102	"united states"	"california"	"mendocino"	NA	4000	"fagaceae"	"quercus"	"wislizeni"	NA	"quercus wislizeni"
"c73ccd6d-fdc2-4ae7-992d-fe5c351753dd"	"ds"	"ds671488"	"agrc. station"	38.3518	-120.7741	"united states"	"california"	"amador"	NA	6938	"fagaceae"	"quercus"	"wislizeni"	NA	"quercus wislizeni"
"c755ed93-5e58-4f21-834a-2d6824b403da"	"ucsb"	"ucsb1286"	"bank of n fork of oak creek on rd between mt. whitney fish hatchery and oak creek campground, 0.5 mi. w of fish hatchery and ca. 3 air miles nw of independence"	36.8323	-118.2342	"united states"	"california"	"inyo"	NA	500	"fagaceae"	"quercus"	"wislizeni"	"frutescens"	"quercus wislizeni var. frutescens"
"c75c23d4-8eb8-4f4a-a898-8458d1b7e109"	"pom"	"pom2112"	"upper stoddard canyon, mt. ridge, san gabriel mts."	34.2006	-117.6603	"united states"	"california"	"los angeles"	NA	1000	"fagaceae"	"quercus"	"wislizeni"	"frutescens"	"quercus wislizeni var. frutescens"
"c768f0f9-256c-4a70-b9e7-24364d48a4bb"	"rsa"	"rsa477141"	"1 mile north of bear valley on hwy 49."	37.5834	-120.1213	"united states"	"california"	"mariposa"	NA	200	"fagaceae"	"quercus"	"wislizeni"	"wislizeni"	"quercus wislizeni var. wislizeni"
"c7853f72-d1bb-4b23-a8d5-a30ce572a1e8"	"la"	"la205366"	"figueroa mt., figueroa camp"	34.7355	-119.9887	"united states"	"california"	"santa barbara"	NA	400	"fagaceae"	"quercus"	"wislizeni"	NA	"quercus wislizeni"
"c796e596-aa07-4c0f-b144-9d87c55c56fb"	"ds"	"ds48620"	"vicinity of fort tejon, near soldier camp"	34.873	-118.8929	"united states"	"california"	"kern"	NA	1000	"fagaceae"	"quercus"	"wislizeni"	NA	"quercus wislizeni"
"c7977d04-84e1-49a8-a725-180122d86a58"	"uc"	"uc691296"	"russelman park mount diablo"	37.9124298013384	-121.905694314725	"united states"	"california"	"contra costa"	NA	178	"fagaceae"	"quercus"	"wislizeni"	NA	"quercus wislizeni"
"c7dc372a-9ac7-4f9e-be1d-1177e095c19e"	"ucr"	"ucr123366"	"san jacinto mtns. area cahuilla mountain, sw of anza at head of bautista canyon, along the crest of the mountain"	33.57417	-116.78306	"united states"	"california"	"riverside"	NA	10000	"fagaceae"	"quercus"	"wislizeni"	NA	"quercus wislizeni"
"c7e46a7c-7000-4dec-9240-20aab5b51e42"	"uc"	"uc1135864"	"near mouth of austrian gulch"	37.1339466015289	-121.918167676143	"united states"	"california"	"santa clara"	NA	825	"fagaceae"	"quercus"	"wislizeni"	NA	"quercus wislizeni"
"c7ebc2b9-3c0d-4e73-8f03-431dce4ea78a"	"ds"	"ds693527"	"2 mi n idyllwild, san jacinto mts."	33.7494	-116.7357	"united states"	"california"	"riverside"	NA	1000	"fagaceae"	"quercus"	"wislizeni"	NA	"quercus wislizeni"
"c7ed187a-ae73-40a8-a78e-4704a31cfb63"	"cda"	"cda16526"	"sierra madre mountains sierra madre rd. between hwy 166 entrance and miranda pine, > 3 mi up from 166. chaparral, oak woodland mosaic. &plusmn; a shrub on open slope. common."	35.0991666666667	-120.079166666667	"united states"	"california"	"santa barbara"	NA	NA	"fagaceae"	"quercus"	"wislizeni"	"frutescens"	"quercus wislizeni var. frutescens"
"c816c879-dbd1-4bda-a03e-7374e28a08b6"	"uc"	"uc5687"	"saratoga"	37.26389	-122.02194	"united states"	"california"	"santa clara"	NA	NA	"fagaceae"	"quercus"	"wislizeni"	NA	"quercus wislizeni"
"c824c945-4258-4699-8b52-0c869665359d"	"ucd"	"ucd44974"	"lake county: goat mountain. root homestead"	39.2333	-122.7167	"united states"	"california"	"lake"	NA	750	"fagaceae"	"quercus"	"wislizeni"	"frutescens"	"quercus wislizeni var. frutescens"
"c82cf580-81d0-4c75-9d98-8d67eeea08aa"	"la"	"la205338"	"san jacinto mountains"	33.6844	-116.7009	"united states"	"california"	"riverside"	NA	4250	"fagaceae"	"quercus"	"wislizeni"	NA	"quercus wislizeni"
"c82d4650-39c8-4376-aa78-326b49d8d606"	"ucd"	"ucd47534"	"anderson peak, ca. 10 miles southeast of big sur, monterey county, california"	36.182725	-121.639858333333	"united states"	"california"	"monterey"	NA	NA	"fagaceae"	"quercus"	"wislizeni"	NA	"quercus wislizeni"
"c8323db0-05c5-4801-a2bd-e6618c7d2e43"	"rsa"	"rsa656661"	"ca. 20 air miles w of san bernardino, 3 miles nw of angeles oaks, near junction of deer creek and santa ana river near filaree flat."	34.1711	-116.9889	"united states"	"california"	"san bernardino"	NA	10000	"fagaceae"	"quercus"	"wislizeni"	"frutescens"	"quercus wislizeni var. frutescens"
"c8392871-266f-49b3-8f79-36dbc73d8dea"	"uc"	"uc1135831"	"n of colfax (wolf creek); smartsville quad."	39.1645948931643	-121.030458385125	"united states"	"california"	"nevada"	NA	825	"fagaceae"	"quercus"	"wislizeni"	NA	"quercus wislizeni"
"c83a8e53-2f7b-47bf-92d5-277efe569972"	"ds"	"ds109059"	"mts. above claremont"	34.253	-117.6556	"united states"	"california"	"san bernardino"	NA	10000	"fagaceae"	"quercus"	"wislizeni"	NA	"quercus wislizeni"
"c86d8fc2-d665-4d1d-9e6a-4f8c5e909c5c"	"jeps"	"jeps37797"	"la jota mesa howell mt."	38.5686	-122.4355	"united states"	"california"	"napa"	NA	3000	"fagaceae"	"quercus"	"wislizeni"	NA	"quercus wislizeni"
"c87041b9-6c0a-41be-b546-8ed2547372c6"	"ucd"	"ucd47599"	"hopland field station, mendocino county"	39.0018388888889	-123.082497222222	"united states"	"california"	"mendocino"	NA	NA	"fagaceae"	"quercus"	"wislizeni"	NA	"quercus wislizeni"
"c886e55d-b172-49d5-8f99-0ded3258ccc2"	"cas"	"cas83597"	"angels camp"	38.0723	-120.5398	"united states"	"california"	"calaveras"	NA	950	"fagaceae"	"quercus"	"wislizeni"	NA	"quercus wislizeni"
"c8899b5d-cfd3-4b7a-b982-a98fdbdafb53"	"uc"	"uc1212091"	"hall canyon san jacinto mts."	33.8091	-116.7756	"united states"	"california"	"riverside"	NA	300	"fagaceae"	"quercus"	"wislizeni"	NA	"quercus wislizeni"
"c8b42095-dc9d-4daa-a6c2-b375b4089e61"	"uc"	"uc571702"	"n side, near summit copernicus peak; mount hamilton"	37.3485286041697	-121.630222868887	"united states"	"california"	"santa clara"	NA	1762	"fagaceae"	"quercus"	"wislizeni"	NA	"quercus wislizeni"
"c8ca14e3-74b2-4667-a5ee-b3e8e69a927d"	"mor"	"0059685mor"	"uc davis arboretum, mary wattis brown: grid #16-g8."	38.537036	-121.747637	"united states"	"california"	"yolo"	NA	NA	"fagaceae"	"quercus"	"wislizeni"	NA	"quercus wislizeni"
"c8ea21b4-897e-4a69-8985-95feda4b53a8"	"cas"	"cas595834"	"tehachapi-kernville region. breckenridge mountain, 2.3 mile w of the havilah road"	35.4842	-118.5487	"united states"	"california"	"kern"	NA	600	"fagaceae"	"quercus"	"wislizeni"	NA	"quercus wislizeni"
"c90c715f-f5d7-4903-9b59-389d20183f6d"	"cas"	"233220"	"snow crrek, 100 yds. above the fish hatchery, n base of san jacinto mts."	33.8724	-116.6811	"united states"	"california"	"riverside county"	NA	NA	"fagaceae"	"quercus"	"wislizeni"	NA	"quercus wislizeni  a. dc."
"c921761a-c76f-4f8d-9521-2e9365497da9"	"uconn"	"conn00018803"	"big sur, along rt. 1"	36.27027	-121.80638	"united states"	"california"	"monterey county"	"big sur"	NA	"fagaceae"	"quercus"	"wislizeni"	NA	"quercus wislizeni a.dc."
"c9270057-588b-464a-a131-6aafe58f646f"	"ds"	"ds156652"	"cajon pass"	34.3252	-117.4284	"united states"	"california"	"san bernardino"	NA	2000	"fagaceae"	"quercus"	"wislizeni"	NA	"quercus wislizeni"
"c94acc9b-f29b-4180-9b2c-fc221eac42ae"	"uc"	"uc2029245"	"sierra nevada forest, buckeye heliport, south of the 4 lane"	37.04929	-119.39411	"united states"	"california"	"fresno"	NA	NA	"fagaceae"	"quercus"	"wislizeni"	"frutescens"	"quercus wislizeni var. frutescens"
"c9ab710e-b95a-4103-b43d-b30b3b077d7d"	"ucd"	"ucd112042"	"yuba county: indiana creek"	39.4216666665549	-121.24500000005	"united states"	"california"	"yuba"	NA	NA	"fagaceae"	"quercus"	"wislizeni"	NA	"quercus wislizeni"
"ca1842be-9198-4898-b3c0-67092ffb2ef1"	"cas"	"cas878250"	"south butte, sutter buttes"	39.2151	-121.8217	"united states"	"california"	"sutter"	NA	3894	"fagaceae"	"quercus"	"wislizeni"	NA	"quercus wislizeni"
"ca71bb15-0e46-4f12-95ec-64f1cdd78d46"	"cda"	"cda25741"	"along highway ca-88, 1.0 mile southwest of clements at disch road."	38.1766666666667	-121.115	"united states"	"california"	"san joaquin"	NA	NA	"fagaceae"	"quercus"	"wislizeni"	"wislizeni"	"quercus wislizeni var. wislizeni"
"ca80060d-3292-4321-bd1a-d4abebc68030"	"cas"	"cas83596"	"mt. st. helena"	38.668465	-122.630209	"united states"	"california"	"napa"	NA	3400	"fagaceae"	"quercus"	"wislizeni"	NA	"quercus wislizeni"
"ca98fa4b-40cb-44d8-8f1d-237513026421"	"ucsb"	"ucsb1274"	"away from n fork of oak creek at oak creek campground, 1.7 rd. mi. nw of mt. whitney fish hatchery, which is 3 air miles nw of independence"	36.8414	-118.263	"united states"	"california"	"inyo"	NA	400	"fagaceae"	"quercus"	"wislizeni"	"frutescens"	"quercus wislizeni var. frutescens"
"cacc6f94-0568-4ce4-8de6-340c7badd9b7"	"cas"	"cas799890"	"honcut creek on road from oroville to marysville"	39.3087	-121.5935	"united states"	"california"	"butte"	NA	1388	"fagaceae"	"quercus"	"wislizeni"	NA	"quercus wislizeni"
"caddd646-c225-489f-922a-12eac2618c08"	"ds"	"ds211160"	"santa cruz island near west end"	34.06	-119.893	"united states"	"california"	"santa barbara"	NA	4700	"fagaceae"	"quercus"	"wislizeni"	NA	"quercus wislizeni"
"cb560687-ee91-4696-a16a-946aea406865"	"jeps"	"jeps110548"	"on the west side of north honcut creek, peter ahart ranch, about 1 1/2 mile north and 2 3/4 miles east of honcut, about 12 miles southeast of oroville"	39.35083	-121.487495	"united states"	"california"	"butte"	NA	NA	"fagaceae"	"quercus"	"wislizeni"	"wislizeni"	"quercus wislizeni var. wislizeni"
"cb563d70-8b6e-4022-b9df-bcf022b57fd3"	"ucd"	"ucd59334"	"yolo co.: tuleyome ireland ranch. in inner coast range, northwest of the city of winters, between salt creek and enos creek, just north of wild cow mountain. central part of ranch"	38.5966666669895	-122.112777777389	"united states"	"california"	"yolo"	NA	NA	"fagaceae"	"quercus"	"wislizeni"	"frutescens"	"quercus wislizeni var. frutescens"
"cbad4af2-8fde-4b4f-aa15-b5197ae84691"	"ucd"	"ucd47590"	"huddart park, san mateo county"	37.4355583333334	-122.294166666667	"united states"	"california"	"san mateo"	NA	NA	"fagaceae"	"quercus"	"wislizeni"	NA	"quercus wislizeni"
"cbf2a05d-4dd9-4ecb-8bf4-7ef81cecad83"	"ucd"	"ucd83086"	"fresno county; sierra foothills conservancy. table mtn"	37.0550898118789	-119.571972342447	"united states"	"california"	"fresno"	NA	10	"fagaceae"	"quercus"	"wislizeni"	"wislizeni"	"quercus wislizeni var. wislizeni"
"cc05725d-8d40-4fb0-88ed-40044cf75759"	"cas"	"509445"	"along empire grade about 1 mile s of its intersection felton - bonny doon road"	37.05	-122.1166666667	"united states"	"california"	"santa cruz county"	NA	NA	"fagaceae"	"quercus"	"wislizeni"	NA	"quercus wislizeni  a. dc."
"cc08fb5e-33f6-4bba-8baa-7497b5ad66b7"	"hsc"	"hsc98340"	"near hopkins butte, close to the town of orleans"	41.21561111	-123.6159167	"united states"	"california"	"humboldt"	NA	NA	"fagaceae"	"quercus"	"wislizeni"	NA	"quercus wislizeni"
"cc1ca8c6-1439-426e-9ec3-ea409f0e3713"	"ds"	"ds588890"	"meyer (loma prieta)"	37.1112473458206	-121.843564792563	"united states"	"california"	"santa cruz"	NA	1833	"fagaceae"	"quercus"	"wislizeni"	NA	"quercus wislizeni"
"cc25c6c6-c2d0-4156-9c62-11818bf170cd"	"cas"	"cas709016"	"on the e side of the piute mountains adjacent to the boundary of the sequoia national forest along section line 12"	35.5979	-118.2725	"united states"	"california"	"kern"	NA	1250	"fagaceae"	"quercus"	"wislizeni"	NA	"quercus wislizeni"
"cc27d35f-5c7d-4806-a03b-04612545d278"	"ucr"	"ucr249289"	"fort hunter liggett training areas 4, 5, 8, near junction of training areas, c. 3.4 air km due south of san antonio river, c. 5.7 air km due west of san antonio river, c. 5.3 road kmn (3.3 mi) southwest of del venturi road on road beginning in china gulch"	36.0368406055065	-121.346090455186	"united states"	"california"	"monterey"	NA	NA	"fagaceae"	"quercus"	"wislizeni"	"frutescens"	"quercus wislizeni var. frutescens"
"cc5cd99b-a8ca-48c8-97a7-f45cbac0aaf0"	"rsa"	"rsa9704"	"w side santa anita canyon."	34.1999	-118.019	"united states"	"california"	"los angeles"	NA	4500	"fagaceae"	"quercus"	"wislizeni"	"frutescens"	"quercus wislizeni var. frutescens"
"cc6b933d-ebbb-402a-b946-a90245388ef5"	"jeps"	"jeps37981"	"greasewood hills yolla bolly mountains"	40.1581246092654	-122.73879095234	"united states"	"california"	"tehama"	NA	1651	"fagaceae"	"quercus"	"wislizeni"	NA	"quercus wislizeni"
"cca8f57c-56b0-434f-a2c6-ae69fb33d7e3"	"ucr"	"ucr252162"	"fort hunter liggett training areas 4, 5, 8, near junction of training areas, c. 3.4 air km due south of san antonio river, c. 5.7 air km due west of san antonio river, c. 5.3 road kmn (3.3 mi) southwest of del venturi road on road beginning in china gulch"	36.0368406055065	-121.346090455186	"united states"	"california"	"monterey"	NA	NA	"fagaceae"	"quercus"	"wislizeni"	"frutescens"	"quercus wislizeni var. frutescens"
"ccc03914-398e-4fb8-bba6-ed3c987223a6"	"uc"	"uc1135867"	"3 mi n santa cruz; santa cruz quad."	37.0618482420491	-122.063274561029	"united states"	"california"	"santa cruz"	NA	4950	"fagaceae"	"quercus"	"wislizeni"	NA	"quercus wislizeni"
"ccf1ab98-0010-4059-a876-61cecf6fccfe"	"ds"	"ds488652"	"crest of san bernardino mountains, n of city limits of crestline"	34.2486	-117.2897	"united states"	"california"	"san bernardino"	NA	1000	"fagaceae"	"quercus"	"wislizeni"	NA	"quercus wislizeni"
"cd0b0065-b92a-4cb8-b472-cd2b43adad2b"	"sfv"	"sfv881"	"san jacinto mountains mount san jacinto. about 10 miles south of banning. beside road at entrance to national forest."	33.8582	-116.8362	"united states"	"california"	"riverside"	NA	1000	"fagaceae"	"quercus"	"wislizeni"	"frutescens"	"quercus wislizeni var. frutescens"
"cd34ad76-bca6-489f-be99-cbd88e30c054"	"cas"	"cas548043"	"butano state park"	37.217	-122.3069	"united states"	"california"	"san mateo"	NA	3850	"fagaceae"	"quercus"	"wislizeni"	NA	"quercus wislizeni"
"cd3712e3-6b62-45ed-ab75-b523c9d3c39d"	"jeps"	"jeps37993"	"summit twin sisters peak twin sisters peak"	38.3065	-122.1717	"united states"	"california"	"solano"	NA	750	"fagaceae"	"quercus"	"wislizeni"	"frutescens"	"quercus wislizeni var. frutescens"
"cd3e3396-3155-4417-8904-91566f2852ed"	"pom"	"pom14293"	"san jacinto canyon, about rocks near mouth of strawberry creek."	33.7095	-116.7699	"united states"	"california"	"riverside"	NA	198	"fagaceae"	"quercus"	"wislizeni"	"frutescens"	"quercus wislizeni var. frutescens"
"cd853ed1-4964-42f0-9846-e90a3b7b80f4"	"uc"	"uc405352"	"tracy lake"	38.2119483297779	-121.330925064632	"united states"	"california"	"san joaquin"	NA	1664	"fagaceae"	"quercus"	"wislizeni"	NA	"quercus wislizeni"
"cdf8edf5-fe78-4c33-a01f-953ef9bf02b8"	"sd"	"sd111501"	"north slope of el cajon mountain"	32.91667	-116.81667	"united states"	"california"	"san diego"	NA	412	"fagaceae"	"quercus"	"wislizeni"	"frutescens"	"quercus wislizeni var. frutescens"
"ce35efa0-2f68-41b5-8cfe-b5d2991912f2"	"cas"	"cas475855"	"parkfield summit"	35.8899	-120.4312	"united states"	"california"	"monterey"	NA	3350	"fagaceae"	"quercus"	"wislizeni"	NA	"quercus wislizeni"
"ce5643f2-ba93-48c2-ad63-ee49f43b42d5"	"cas"	"cas538592"	"by side of road near summit of nacimiento road to coast"	35.9951	-121.3685	"united states"	"california"	"monterey"	NA	4750	"fagaceae"	"quercus"	"wislizeni"	NA	"quercus wislizeni"
"ce5a9d0c-d644-4885-bfea-aa678d179276"	"ucr"	"ucr188829"	"northern sierra nevada mountains foothills hills bordering the east end of sacramento valley. salmon falls road, 4.6 miles north of green valley road, above ne arm of folsom lake"	38.76528	-121.04361	"united states"	"california"	"el dorado"	NA	1000	"fagaceae"	"quercus"	"wislizeni"	"wislizeni"	"quercus wislizeni var. wislizeni"
"ce6784f9-3eb3-40c2-b30a-4ddee45e008f"	"ds"	"ds373967"	"at thornton place (oakstone motel) ca 1/4 mile below the fish hatchery on oak creek, ca 2 miles nw of independence"	36.8323	-118.24	"united states"	"california"	"inyo"	NA	500	"fagaceae"	"quercus"	"wislizeni"	NA	"quercus wislizeni"
"ce777f97-393f-4388-93f8-e1332d7d0add"	"cas"	"cas435378"	"bartlett springs"	39.1839	-122.7044	"united states"	"california"	"lake"	NA	1000	"fagaceae"	"quercus"	"wislizeni"	NA	"quercus wislizeni"
"ce83fbf9-d1fe-420a-a01f-13a844b4dff2"	"ucd"	"ucd47622"	"harris grade, santa barbara county"	34.7331	-120.4403	"united states"	"california"	"santa barbara"	NA	5100	"fagaceae"	"quercus"	"wislizeni"	NA	"quercus wislizeni"
"cebc5251-9b06-445a-bf3d-2c45b16cedb6"	"ucr"	"ucr241174"	"southeast sacramento valley bike trail parking area at the south side of the american river, 0.6 mile west of gold country road"	38.63167	-121.23556	"united states"	"california"	"sacramento"	NA	1000	"fagaceae"	"quercus"	"wislizeni"	"wislizeni"	"quercus wislizeni var. wislizeni"
"cec3bec5-9e6d-4239-a5cc-4ebe9db9a3d7"	"uc"	"uc691307"	"ridge e rhine canyon (about halfway-up slope, on spur at s end of ridge (also next canyon to e, which enters curry canyon at gate to olafsons\' ranch""); mount diablo"	37.8654570474349	-121.88934862143	"united states"	"california"	"contra costa"	NA	839	"fagaceae"	"quercus"	"wislizeni"	NA	"quercus wislizeni"
"cece7fce-7cde-44e8-a936-562521a3f752"	"cas"	"cas975036"	"liebre mountains. lower deer canyon: inside the rather broad mouth of the canyon, ca 220-380 m nnw of its confluence with elizabeth lake canyon"	34.65	-118.4872	"united states"	"california"	"los angeles"	NA	300	"fagaceae"	"quercus"	"wislizeni"	NA	"quercus wislizeni"
"ced03734-761b-4034-add5-53ea3031a329"	"sbbg"	"sbbg59050"	"pine cyn"	34.7549813345468	-118.599919847352	"united states"	"california"	"los angeles"	NA	NA	"fagaceae"	"quercus"	"wislizeni"	"frutescens"	"quercus wislizeni var. frutescens"
"cf16a6d0-981e-4676-8be6-9730d6cd3b23"	"rsa"	"rsa118974"	"1.5 miles e of nacimiento summit as measured along the road."	36.01	-121.45	"united states"	"california"	"monterey"	NA	NA	"fagaceae"	"quercus"	"wislizeni"	"wislizeni"	"quercus wislizeni var. wislizeni"
"cf224d7c-f41b-4786-9993-ab2a2099ae86"	"rsa"	"rsa254990"	"west bank of borax lake, north of clear lake park."	38.9868	-122.6815	"united states"	"california"	"lake"	NA	504	"fagaceae"	"quercus"	"wislizeni"	NA	"quercus wislizeni"
"cf6f6ace-f6e5-4bf6-af50-e94acaedadf3"	"uc"	"uc848376"	"pelican bay santa barbara islands, santa cruz island"	34.0320040511092	-119.702962079266	"united states"	"california"	"santa barbara"	NA	1000	"fagaceae"	"quercus"	"wislizeni"	NA	"quercus wislizeni"
"cf7337d0-3a2e-46e4-a01e-8294bf45b8da"	"ds"	"ds62346"	"santa cruz peninsula. in front of iverson\'s house near peter creek"	37.2553	-122.2167	"united states"	"california"	"san mateo"	NA	500	"fagaceae"	"quercus"	"wislizeni"	NA	"quercus wislizeni"
"cf779caa-1dd6-4ebe-8853-55b928b8d8e9"	"ucr"	"ucr104779"	"sierra nevada mtns/piute mtns. oiler canyon, 0.5 mi. west of jct of caliente-bodfish rd & caliente creek rd, between tehachapi & lake isabella"	35.30389	-118.58361	"united states"	"california"	"kern"	NA	10000	"fagaceae"	"quercus"	"wislizeni"	NA	"quercus wislizeni"
"cf9a2861-db26-42b3-bc2a-4d9c81a9529c"	"uc"	"uc1135834"	"0.5 mi s nelson\'s bar; chico quad."	39.6917845860352	-121.549381965283	"united states"	"california"	"butte"	NA	825	"fagaceae"	"quercus"	"wislizeni"	NA	"quercus wislizeni"
"cf9b7f67-eaf5-429a-95d1-0606c7b354a7"	"ucd"	"ucd47512"	"west of road near old headquarters, h 1-a project area, sierra foothill field station, yuba county, california"	39.24123	-121.31365	"united states"	"california"	"yuba"	NA	447	"fagaceae"	"quercus"	"wislizeni"	NA	"quercus wislizeni"
"cf9de8dc-ab40-4825-9db6-0b5858b20390"	"ucr"	"ucr166153"	"san bernardino mtns head of banning (san gorgonio river) canyon close to the san bernardino co. line, 1 mi se of oak glen conservation camp"	34.02375	-116.89231	"united states"	"california"	"riverside"	NA	1000	"fagaceae"	"quercus"	"wislizeni"	NA	"quercus wislizeni"
"cfac9db0-96bb-4e22-a7b8-25278328983a"	"ucr"	"ucr196713"	"southern sierra nevada mtns/west mojave desert owens peak eastern watershed, short canyon, sw side of canyon"	35.71139	-117.92581	"united states"	"california"	"kern"	NA	1000	"fagaceae"	"quercus"	"wislizeni"	NA	"quercus wislizeni"
"cfe03af0-a30a-44b8-8225-349d636259d3"	"rsa"	"rsa719730"	"san gabriel mountains: san dimas experimental forest, east half of brown\'s flat"	34.1905555555556	-117.715555555556	"united states"	"california"	"los angeles"	NA	NA	"fagaceae"	"quercus"	"wislizeni"	"frutescens"	"quercus wislizeni var. frutescens"
"d00eb7e4-86d7-4fae-bba4-0fcf059fd5dd"	"ds"	"ds161041"	"fort seward"	40.2203	-123.643	"united states"	"california"	"humboldt"	NA	1000	"fagaceae"	"quercus"	"wislizeni"	NA	"quercus wislizeni"
"d045c0dd-bbe7-4d10-b9be-0967643e1c19"	"cas"	"cas166976"	"eel river"	40.3684	-123.9253	"united states"	"california"	"humboldt"	NA	43280	"fagaceae"	"quercus"	"wislizeni"	NA	"quercus wislizeni"
"d091fa18-5164-4550-b90c-c7236ebc07d9"	"cas"	"cas83569"	"island of santa cruz"	34.0100046719841	-119.73096296953	"united states"	"california"	"santa barbara"	NA	19000	"fagaceae"	"quercus"	"wislizeni"	NA	"quercus wislizeni"
"d0ba90ba-b9dd-486c-8f40-785a9db96299"	"ucsb"	"ucsb59612"	"bear creek valley at bear creek camp"	39.3222	-122.8371	"united states"	"california"	"lake"	NA	1000	"fagaceae"	"quercus"	"wislizeni"	"wislizeni"	"quercus wislizeni var. wislizeni"
"d0d42eac-672b-4081-9d5a-f3679dd00cf6"	"obi"	"obi14203"	"4 mi e of mormon bar"	37.4624	-119.8807	"united states"	"california"	"mariposa"	NA	300	"fagaceae"	"quercus"	"wislizeni"	"wislizeni"	"quercus wislizeni var. wislizeni"
"d0f15ee7-f87e-4013-8b39-44ae7252bc3a"	"ucsb"	"ucsb1291"	"rd between idyllwild and hemet"	33.7017	-116.7458	"united states"	"california"	"riverside"	NA	1000	"fagaceae"	"quercus"	"wislizeni"	"frutescens"	"quercus wislizeni var. frutescens"
"d115582c-3bf4-45e6-a376-96463bb31300"	"cas"	"cas139995"	"cambria"	35.564	-121.0808	"united states"	"california"	"san luis obispo"	NA	3317	"fagaceae"	"quercus"	"wislizeni"	NA	"quercus wislizeni"
"d123fde1-cc65-494c-9a10-6750981d0f0c"	"hsc"	"hsc84958"	"page ranch, 6 mi w of yorkville, pyramid rock meadow"	38.8744	-123.3102	"united states"	"california"	"mendocino"	NA	4000	"fagaceae"	"quercus"	"wislizeni"	NA	"quercus wislizeni"
"d13691a9-49c2-414f-b765-42354e831777"	"uc"	"uc1286605"	"4.5 mi w stanton ranch headquarters; santa cruz island"	34.0116	-119.788	"united states"	"california"	"santa barbara"	NA	1000	"fagaceae"	"quercus"	"wislizeni"	NA	"quercus wislizeni"
"d14633ca-9b97-4b96-85b4-8335df58c19e"	"cas"	"cas345203"	"newcastle"	38.8742	-121.1322	"united states"	"california"	"placer"	NA	3360	"fagaceae"	"quercus"	"wislizeni"	NA	"quercus wislizeni"
