"ea6d6c85-4770-455c-a8c8-5574a62e93b5"	"uvsc"	"14437"	"e slopes of mount timpanogos, canyon n of elk point, along the timpanogos trail at the avalanche ca 0.5 mile w of aspen grove;"	40.404816	-111.61195	"united states"	"utah"	"utah"	NA	30	"caprifoliaceae"	"symphoricarpos"	"oreophilus"	NA	"symphoricarpos oreophilus"
"ec97149b-09fe-415a-b371-a73165ce07c4"	"enlc"	"enlc02358"	"new pass range. ~.3 miles by air northeast of new pass peak on ridgeline."	39.650975	-117.479748	"united states"	"nevada"	"lander"	NA	50	"caprifoliaceae"	"symphoricarpos"	"oreophilus"	"parishii"	"symphoricarpos oreophilus var. parishii"
"ecb162a0-39c6-41bf-91af-042a0133353d"	"ny"	"1577284"	"16 miles due east of ely, summit of cave mountain"	39.1631	-114.6081	"united states"	"nevada"	"white pine co."	NA	NA	"caprifoliaceae"	"symphoricarpos"	"oreophilus"	NA	"symphoricarpos oreophilus a.gray"
"ece323cf-26b5-4374-85bd-601986d68005"	"uvsc"	"1529"	"north end of causey reservoir, off sr 39, ogden canyon."	41.313888	-111.555555	"united states"	"utah"	"weber"	NA	1800	"caprifoliaceae"	"symphoricarpos"	"oreophilus"	"utahensis"	"symphoricarpos oreophilus var. utahensis"
"ed8ef203-9d64-4ce5-a247-0c43998c02d7"	"asc"	"51276"	"coconino national forest, beaver creek ws #7, 6 mi nw of happy jack."	34.768056	-111.508611	"united states"	"arizona"	"coconino county"	NA	NA	"caprifoliaceae"	"symphoricarpos"	"oreophilus"	NA	"symphoricarpos oreophilus"
"edbfb18d-0621-45d3-b63c-e8f1adae7387"	"utc"	"utc00265785"	"cedar mountain, east of cedar city"	37.491867	-112.944917	"united states"	"utah"	"iron"	NA	NA	"caprifoliaceae"	"symphoricarpos"	"oreophilus"	NA	"symphoricarpos oreophilus"
"ee0e124c-4ec7-4576-ad04-fec14e454df8"	"ny"	"1577305"	"mt. nebo, bear canyon"	39.8	-111.72	"united states"	"utah"	"juab co."	NA	NA	"caprifoliaceae"	"symphoricarpos"	"oreophilus"	"oreophilus"	"symphoricarpos oreophilus var. oreophilus"
"ef31ad3d-2e9c-4807-a7ae-3ceadd0bf0b1"	"utc"	"utc00274210"	"new pass range. ~.3 miles by air northeast of new pass peak on ridgeline."	39.650975	-117.479748	"united states"	"nevada"	"lander"	NA	50	"caprifoliaceae"	"symphoricarpos"	"oreophilus"	"parishii"	"symphoricarpos oreophilus var. parishii"
"ef963fa3-6547-4a87-aaa5-f5333be52f15"	"asc"	"75850"	"santa catalina mountains  mount lemmon summit. fire tower, meadow trails."	32.3737	-110.785617	"united states"	"arizona"	"pima county"	NA	NA	"caprifoliaceae"	"symphoricarpos"	"oreophilus"	NA	"symphoricarpos oreophilus"
"f09d91be-5432-41d6-8cd0-7ff94e6445f3"	"ny"	"1577391"	"white mountains: canyon of n fork of chiatovich creek 2.8 miles n 64° e of mt. dubois summit.  fishlake valley drainage"	37.8031	-118.3019	"united states"	"california"	"mono co."	NA	NA	"caprifoliaceae"	"symphoricarpos"	"oreophilus"	"utahensis"	"symphoricarpos oreophilus var. utahensis (rydb.) a.nelson"
"f0a9a006-0289-4dab-a69f-8733d6202050"	"ny"	"1577440"	"pine valley. left fork along creek"	37.38	-113.45	"united states"	"utah"	"washington co."	NA	NA	"caprifoliaceae"	"symphoricarpos"	"oreophilus"	"utahensis"	"symphoricarpos oreophilus var. utahensis (rydb.) a.nelson"
"f0bfccd6-dfcd-4f54-9b53-3659f670e15f"	"ny"	"1577529"	"headwaters of left fork of minnie maude creek, west tavaputs plateau, 20 miles north of wellington."	39.801686	-110.565231	"united states"	"utah"	"carbon co."	NA	NA	"caprifoliaceae"	"symphoricarpos"	"oreophilus"	"utahensis"	"symphoricarpos oreophilus var. utahensis (rydb.) a.nelson"
"f10a692b-e7f3-4afd-96a9-7a3d00cdd41b"	"utc"	"utc00224564"	"dixie national forest ; forest boundary in cedar canyon along crow creek."	37.5833333	-112.9166667	"united states"	"utah"	"iron"	NA	NA	"caprifoliaceae"	"symphoricarpos"	"oreophilus"	NA	"symphoricarpos oreophilus"
"f2a4aa95-38c2-4ce3-9da9-079d24ca6056"	"ny"	"1577507"	"south hills, rogerson-oakley road, shoshone creek, near shoshone guard station, 19.1 (12.5 airline) miles east of rogerson"	42.22	-114.35	"united states"	"idaho"	"twin falls co."	NA	NA	"caprifoliaceae"	"symphoricarpos"	"oreophilus"	"utahensis"	"symphoricarpos oreophilus var. utahensis (rydb.) a.nelson"
"f2c84416-416c-4fe2-b395-9d30c8c78345"	"utc"	"utc00186453"	"wasatch cache national forest; 500 yards, south and above snow basin parking lot."	41.22	-111.8483333	"united states"	"utah"	"weber"	NA	NA	"caprifoliaceae"	"symphoricarpos"	"oreophilus"	NA	"symphoricarpos oreophilus"
"f3ef8a5a-4f4c-4dbe-8ea8-8ec13f752adc"	"ny"	"1577335"	"deep creek mountains, granite creek canyon"	39.79	-113.9	"united states"	"utah"	"juab co."	NA	NA	"caprifoliaceae"	"symphoricarpos"	"oreophilus"	"oreophilus"	"symphoricarpos oreophilus var. oreophilus"
"f499dc4c-eb13-489d-92b7-ba988a523f5a"	"utc"	"utc00266551"	"jay wilde ranch; 7188 east birch creek rd., 0.5 mile e and 0.25 mi s of house"	42.220733	-111.690917	"united states"	"idaho"	"franklin"	NA	NA	"caprifoliaceae"	"symphoricarpos"	"oreophilus"	"utahensis"	"symphoricarpos oreophilus var. utahensis"
"f4c0131f-5657-490f-8a1c-c436215441f2"	"ny"	"1577509"	"on a dry slope above chipman creek; in chipman canyon below yellow streak mountain above sunflower flat. in the foothills of ""the mahoganies""."	41.8	-115.78	"united states"	"nevada"	"elko co."	NA	NA	"caprifoliaceae"	"symphoricarpos"	"oreophilus"	"utahensis"	"symphoricarpos oreophilus var. utahensis (rydb.) a.nelson"
"f5067f07-e85d-4445-94c0-0e2074c1bf97"	"des"	"des00038552"	"dark canyon, ca 150 yards east of scorup cabin and horse pasture canyon, at base of, and against large alcove on north side of creek."	37.769083	-109.820944	"united states"	"utah"	"san juan"	NA	NA	"caprifoliaceae"	"symphoricarpos"	"oreophilus"	NA	"symphoricarpos oreophilus"
"f6251288-3ea3-46f1-8763-2ce57220b7ad"	"ny"	"1577320"	"lasal mountains, warner lake"	38.515	-109.27839	"united states"	"utah"	"san juan co."	NA	NA	"caprifoliaceae"	"symphoricarpos"	"oreophilus"	NA	"symphoricarpos oreophilus a.gray"
"f686efe4-1f2a-4565-9f6f-6008976b747d"	"ny"	"1577376"	"preuss range, caribou forest, ridge above montpelier creek just west of whiskey flat"	42.44	-111.2	"united states"	"idaho"	"bear lake co."	NA	NA	"caprifoliaceae"	"symphoricarpos"	"oreophilus"	"utahensis"	"symphoricarpos oreophilus var. utahensis (rydb.) a.nelson"
"f7c26247-d52b-4dfa-80cd-1d89b1d27db1"	"dbg"	"khd00043113"	"vermejo park ranch: culebra range: along base of prominent cliffs on north side of long canyon 1.2 air mi w of uppermost of seven lakes; 1.5 air mi e of summit of big costilla peak."	36.91797222	-105.3008056	"united states"	"new mexico"	"taos"	NA	7	"caprifoliaceae"	"symphoricarpos"	"oreophilus"	"oreophilus"	"symphoricarpos oreophilus var. oreophilus"
"f804200c-087b-4af8-b369-f586b947c3d8"	"des"	"des00041070"	"navajo indian reservation, upper reaches of fir canyon (side canyon to tsegi canyon to the west), laguna creek drainage, on stream bank."	36.690295	-110.517022	"united states"	"arizona"	"navajo"	NA	1506	"caprifoliaceae"	"symphoricarpos"	"oreophilus"	NA	"symphoricarpos oreophilus"
"f80d680a-846e-4ca8-a5da-441f93ed96e9"	"des"	"des00038033"	"kaibab plateau, east rim view point, along trail #7, ca 1 mile down from trailhead, above north canyon."	36.4069	-112.082	"united states"	"arizona"	"coconino county"	NA	NA	"caprifoliaceae"	"symphoricarpos"	"oreophilus"	"utahensis"	"symphoricarpos oreophilus var. utahensis"
"f8259515-1787-4a82-a265-68e8445d5ba2"	"utc"	"utc00225302"	"cache national forest ; card canyon 10 mi. up logan canyon going east toward bear lake.  turn off is on the south side of the highway  across fr"	41.7666667	-111.5833333	"united states"	"utah"	"cache"	NA	NA	"caprifoliaceae"	"symphoricarpos"	"oreophilus"	NA	"symphoricarpos oreophilus"
"f8e448f4-6e03-41b4-8de5-016ee2dbb8b5"	"ny"	"1577278"	"sweetwater mountains, northeast end of little smith valley, northwest base of east sister"	38.542969	-119.295158	"united states"	"nevada"	"lyon co."	NA	NA	"caprifoliaceae"	"symphoricarpos"	"oreophilus"	NA	"symphoricarpos oreophilus a.gray"
"fa4f8771-843a-4f4d-8beb-95351a809d80"	"ny"	"01109874"	"on large knoll northeast of jacks creek in upper dave creek basin 10 miles south of murphy hot springs, idaho, in jarbidge mountains"	41.894983	-115.37365	"united states"	"nevada"	"elko co."	NA	NA	"caprifoliaceae"	"symphoricarpos"	"oreophilus"	"utahensis"	"symphoricarpos oreophilus var. utahensis (rydb.) a.nelson"
"fb3ff2b3-dfac-44dc-bcf7-a4a5c5dcc95f"	"ny"	"1577567"	"wasatch range, flagstaff mountain, between empire and ontario canyons; along unimproved part of ut 224 ca. 6.4 road miles north of jct. ut 152 above brighton and 2.2 road miles south of jct. ut 248 in park city"	40.62	-111.49	"united states"	"utah"	"summit co."	NA	NA	"caprifoliaceae"	"symphoricarpos"	"oreophilus"	"utahensis"	"symphoricarpos oreophilus var. utahensis (rydb.) a.nelson"
"fb6714e6-6c56-4eb9-bd05-4e2745fceb45"	"asc"	"41279"	"oldham park"	35.2593	-111.6044	"united states"	"arizona"	"coconino county"	NA	1250	"caprifoliaceae"	"symphoricarpos"	"oreophilus"	NA	"symphoricarpos oreophilus"
"fd067ad2-059f-48e3-bc99-29e03fc61eb7"	"asu"	NA	"baboquivari mountains; sabino canyon; baboquivari peak 7.5' quad."	31.7762	-111.598	"united states"	"arizona"	"pima county"	NA	700	"caprifoliaceae"	"symphoricarpos"	"oreophilus"	NA	"symphoricarpos oreophilus"
"fd83052f-3a3a-4558-801d-9485656e2026"	"ny"	"1577422"	"ca. 9 miles due northeast of mount waas, la sal mountains. polar mesa."	38.66	-109.13	"united states"	"utah"	"grand co."	NA	NA	"caprifoliaceae"	"symphoricarpos"	"oreophilus"	"utahensis"	"symphoricarpos oreophilus var. utahensis (rydb.) a.nelson"
"fddfcc12-94eb-4f24-b261-4017dfb58036"	"ny"	"1577424"	"toiyabe range, s fork of birch creek"	39.4	-117.07	"united states"	"nevada"	"lander co."	NA	NA	"caprifoliaceae"	"symphoricarpos"	"oreophilus"	"utahensis"	"symphoricarpos oreophilus var. utahensis (rydb.) a.nelson"
"fe3ba0b3-3ba7-4f4a-b5b4-3d2223666e6b"	"asc"	"95972"	"abajo mountains, along south cottonwood creek road west of blanding"	37.835333	-109.736833	"united states"	"utah"	"san juan county"	NA	NA	"caprifoliaceae"	"symphoricarpos"	"oreophilus"	NA	"symphoricarpos oreophilus"
"fec53fef-9406-432e-b5bc-5204ce63460f"	"asu"	NA	"rim of horse thief basin"	34.1667	-112.267	"united states"	"arizona"	"yavapai county"	NA	NA	"caprifoliaceae"	"symphoricarpos"	"oreophilus"	NA	"symphoricarpos oreophilus"
